p142r,p141r_1,c_142r_01,x,x,x,NJR,"Smudged, but most likely <i>cest</i> (it is)","tc, tcn, tl",,Editorial | Structural,,,true,true,,,,
p142v,p142v_1,c_142v_02,x,,,NJR,"This marginal note is squeezed in between the main text and the other marginal notes, and appears to be in a different ink.","tc, tcn, tl",,Editorial | Structural,,,false,false,,,,
p142v,p142v_3,c_142v_07,,x,x,PHS,a type of mold,"tc, tcn, tl",,,,,false,false,,,,
p144v,p144v_1,c_144v_02,x,x,x,NJR,The subject (molding turtles) resumes two folios later on fol. 146v.,"tc, tcn, tl",,Structural,p146v_1,,false,false,,,,
p145r,p145r_1,c_145r_04,x,x,x,THU CAG,Correction in original: -e written over -un,"tc, tcn, tl",,editorial,,,false,false,,,,
p145r,p145r_1,c_145r_05,x,x,x,THU,Latin: Investigate,"tc, tcn, tl",,Translation,,,false,false,,,,
p146v,p146v_1,c_146v_02,x,x,x,NJR,"Two folios earlier (fol. 144v), the author-practitioner indicates that his discussion of this subject (molding turtles) resumes here.","tc, tcn, tl",,Structural,p144v_1,,false,false,,,,
p147r,p146v_1,c_147r_02,x,x,x,NJR,"The subject (molding turtles), begun on fol. 144r and continued here, resumes again two folios later on fol. 148v.","tc, tcn, tl",,Structural,p148v_1,,false,false,,,,
p147v,p147v_1,c_147v_01,x,x,x,NJR,An unknown superscript abbreviation renders the meaning unclear.,"tc, tcn, tl",,Editorial,,,false,false,,,,
p148r,p147v_4,c_148r_01,x,,,NJR,Appears to be an unfinished sentence.,"tc, tcn, tl",,Editorial | Structural,,,false,false,,,,
p148r,p148r_3,c_148r_02,x,,,NJR,"From this word on, the heading is written in the script of main text (i.e., not the Italic script used for headings), which may indicate a later addition.","tc, tcn, tl",,Editorial | Structural,,,false,false,,,,
p148r,p148r_4,c_148r_03,x,,,NJR,Change of ink here may give clues to authorial intent and composition of the text.,"tc, tcn, tl",,Handshift,,,false,false,,,,
p148v,p148v_1,c_148v_01,,x,,NJR,"Two folios earlier (fol. 147r), the author-practitioner indicates that his discussion of this subject (molding turtles), begun on fol. 144r and continued on 146v, resumes again here.","tc, tcn, tl",,Structural,p146v_1,,false,false,,,,
p149v,p149v_3,c_149v_01,x,,,NJR,"This final sentence and the marginal note appear to be in a different ink, which may give clues to authorial intent and composition of the text.","tc, tcn, tl",,Handshift,,,false,false,,,,
p150r,p150r_1,c_150r_01,x,,,NJR,"What appears to be a smudged capital letter may indicate that the author-practitioner first began this entry here, reconsidered, and then began it again below.","tc, tcn, tl",,Handshift,,,false,false,,,,
p150v,p150v_1,c_150v_02,x,,x,NJR,"This note continues on the next page (fol. 151r) in the bottom left margin at the letter ""A""","tc, tcn, tl",,Structural,p150v_1,,false,false,,,,
p150v,p150v_1,c_150v_03,,,x,NJR,"i.e., the first mold made directly from the turtle (see fol. 146v) and therefore the one closest to its natural appearance.","tc, tcn, tl",,Editorial,p146v_1,,false,false,,,,
p151r,p150v_1,c_151r_01,x,,x,NJR,"This note begins on the previous page (fol. 150v) in the bottom left corner and ends in the bottom right with the letter ""A""","tc, tcn, tl",,Structural,p150v_1,,false,false,,,,
,p150v_1,c_151r_02,,,x,NJR,"Master Alexander, an unidentified artisan","tc, tcn, tl",,,,,false,false,,,,
p151v,p150v_1,c_151v_01,,x,,NJR,Likely the same as <i>gouges</i> (gouges). See glossary.,"tc, tcn",,Editorial,,,true,true,,,,
p151v,p150v_1,c_151v_02,x,,,NJR,"The first ""r"" in <i>grommeleures</i> is followed by a seemingly accidental vertical stroke. Meaning unclear.","tc, tcn, tl",,Conjectural | Structural,,,true,true,,,,
p152r,p152r_1,c_152r_01,x,x,x,NJR,Dionysius I of Syracuse (ca. 432–367 BCE): Greek tyrant who burned off his beard rather than trust a barber to trim it for fear the barber would cut his throat.,"tc, tcn, tl",,Editorial | Historical,,,false,false,,,,
p152r,p152r_1,c_152r_02,x,x,x,NJR,This and surrounding words smudged but legible,"tc, tcn, tl",,Handshift,,,false,false,,,,
p152r,p152r_1,c_152r_03,x,x,x,"NJR, THU","The final letter ""-<i>s</i>"" is missing in the original. It appears to have been cut off when the original choirs of the manuscript were cut apart during rebinding. See ann_326_ie_19 (Marc Smith).","tc, tcn, tl",,Structural | Editorial,,,true,true,,,,
p152v,p152v_1,c_152v_02,x,x,x,NJR,"<i>bequet</i>: literally ""a small beak."" A tool used in metalworking, likely a type of vise attached to a goldsmith's table.","tc, tcn, tl",,Translation,,,true,true,,,,
p153r,p153r_1,c_153r_01,x,x,x,NJR,"The marginal note appears to be in a darker ink, which may give clues to authorial intent and composition of the text.","tc, tcn, tl",,Handshift,,,false,false,,,,
p153r,p153r_2,c_153r_02,x,x,x,NJR,Word obscured by inkblot,"tc, tcn, tl",,Structural | Handshift,,,false,false,,,,
p153r,p153r_1,c_153r_03,x,x,x,PHS,"The principal will not melt if used with molten tin or lead because it is made of <i>metal</i>, a copper alloy with a higher melting point.","tc, tcn, tl",,Translation | Historical,,,true,true,,,,
p154r,p154r_3,c_154r_01,x,x,x,NJR,"All notes in the left margin appear to be in a darker ink, which may give clues to authorial intent and composition of the text.","tc, tcn, tl",,Handshift,,,false,false,,,,
p154r,p154r_4,c_154r_02,x,x,x,NJR,<i>& letton</i> partially obscured by inkblot but legible,"tc, tcn, tl",,Handshift,,,true,true,,,,
p154v,p154v_3,c_154v_01,x,x,x,NJR,"Both additions in this entry, the one here in the heading and the other in the main text, appear to be in a darker ink, perhaps suggesting they were written together at a later time.","tc, tcn, tl",,Handshift,,,false,false,,,,
p154v,p154v_4,c_154v_03,x,x,x,NJR,This mark appears to indicate that the text of the marginal note should be inserted here.,"tc, tcn, tl",,Editorial,,,false,false,"146v, 45r",,,
p156r,p156r_2,c_156r_01,x,x,x,THU,"This sentence makes more sense in relation to the process by reading the ""or"" (<i>ou</i>) as an ""and"" (<i>et</i>).","tc, tcn, tl",,Editorial,,,,,,,,
p156v,p156v_1,c_156v_02,x,x,x,PHS,"See figure on fol. 165v, which illustrates these instructions.","tc, tcn, tl",,Editorial,fig_165v_1,,false,false,,,,
p156v,p156v_1,c_156v_03,x,x,x,CAG THU,Correction in original: -g written over -e,"tc, tcn, tl",review,Editorial,,,false,false,,,,
p156v,p156v_1,c_156v_04,x,x,x,CAG THU,Correction in original: d- written over un,"tc, tcn, tl",review,Editorial,,,false,false,,,,
p156v,p156v_1,c_156v_05,x,x,x,CAG THU,Correction in original: -e written over -a,"tc, tcn, tl",,Editorial,,,false,false,,,,
p156v,p156v_1,c_156v_06,x,x,x,THU,Correction in original: o- written over &,"tc, tcn, tl",,Editorial,,,false,false,,,,
p157r,p157r_4,c_157r_04,x,x,x,NJR,"<i>Masselote</i> (mod. <i>machelotte</i>), from <i>machelote</i>, an ""excess reserve of liquid metal for filling the mold,"" according to TLFi1994. By 1704, the word is used to designate ""superfluous metal that remains in the mold after casting a cannon.""","tc, tcn, tl",,,,,true,true,,DONE,,
p157v,p157v_3,c_157v_01,x,x,x,NJR,This heading includes multiple words with abbreviation marks. The expanded content for two words remains unclear.,"tc, tcn, tl",,,,,false,false,,,,
p157v,p157v_3,c_157v_02,x,x,x,NJR,"This entry is added across the entire bottom of the page in a different, super-cursive hand (hand A', see also fol. 2v). ","tc, tcn, tl",review         PHS:ok,Handshift,2v,,false,false,,,,
p157v,p157v_3,c_157v_03,x,x,x,CAG THU,Correction in original: -t written over -d,"tc, tcn, tl",,Editorial,,,false,false,,,,
p158r,p158r_1,c_158r_01,x,x,x,NJR,The blank space before this entry may give clues to authorial intent and composition of the text.,"tc, tcn, tl",,Structural,,,false,false,"also used on 161v, 88v, 90r",,,
p158r,p158r_1,c_158r_02,x,x,x,NJR,The darker ink of this marginal note may give clues about authorial intent and composition of text.,"tc, tcn, tl",,Handshift,,,false,false,,,,
p158v,p158v_1,c_158v_01,x,x,x,NJR,"In three places on this folio (here, in the margin, and at the end of the last entry), there are changes in ink color and letter size. This may indicate later additions and provide clues to authorial intent and composition of text.","tc, tcn, tl",,Handshift,,,false,false,,,,
p158v,p158v_1,c_158v_02,x,x,x,NJR THU,This entry describes a processes for coloring lifecast plants and thus is a recipe for painting on metal.,"tc, tcn, tl",,,,,false,false,129r,,,
p160r,p160r_1,c_160r_01,x,x,x,NJR,<i>Etrier</i> (stirrup) refers to the metal bracket which is attached to the bottom of the screw and fixed to the upper plate of the press. ,"tc, tcn, tl",,Translation | Editorial,,,true,true,,,,
p160r,p160r_1,c_160r_02,x,x,x,NJR THU,i.e.: the X-shaped cross named after Saint Andrew the Apostle,"tc, tcn, tl",,Historical,,,,,,,,
p160v,p160v_3,c_160v_03,x,x,x,NJR,"This mark appears to indicate that the text of the marginal note should be inserted here. This mark and the corresponding marginal note appear to be in a lighter ink, which may indicate a later addition.","tc, tcn, tl",,Structural | Editorial,,,false,false,,,,
p160v,p160v_5,c_160v_04,x,x,x,CAG THU,Correction in original: Et written over il,"tc, tcn, tl",,Editorial,,,false,false,,,,
p161r,p161r_1,c_161r_01,x,x,x,NJR,"Latin: ""bricks."" <i>Gip de lateribus</i> likely refers to a kind of brick mortar","tc, tcn, tl",,Translation,,,true,true,,,,
p161r,p161r_1,c_161r_02,x,x,x,THU,<i>Alumen jamenum</i> in the Latin nominative. A type of alum.,"tc, tcn, tl",,,,"goo.gl/S4TCPd 
goo.gl/odrj9h",true,true,,,,
p161r,p161r_1,c_161r_03,x,x,x,NJR,"This entry was written in various inks and hands, This may indicate later additions and provide clues to authorial intent and composition of text.","tc, tcn, tl",,Handshift,,,false,false,,,,
p161r,p161r_1,c_161r_04,x,x,x,TT,"Latin: ""Note."" See corresponding marginal note that begins with the same mark and word, which are both written in a super-cursive hand, likely the author-practitioner's own in speed-writing mode (A', less cursive here than on fols. 2v and 157v). He seems to have initially placed this intervention in the previous sentence, then changed his mind.","tc, tcn, tl",review PHS:ok,Handshift,2v; 157v,,false,false,,,,
p161r,p161r_1,c_161r_05,x,x,x,TT,"Latin: ""Note."" See corresponding addition in the main text that begins with the same mark and word.","tc, tcn, tl",review     PHS:ok,Handshift,,,false,false,,,,
p161v,p161v_1,c_161v_02,x,x,x,PHS,<i>Roration</i> (wettings) is a Latinism used to mean moisten.,"tc, tcn, tl",,translation,,,true,true,,,,
p162r,p162r_1,c_162r_01,x,x,x,TT,"A likely source is the 1566 Latin edition of Herodotus's <i>Histories</i>. See estienne1566, 1.","tc, tcn, tl",,historical,,,true,true,,,,
p162r,p162r_1,c_162r_02,x,x,x,"TT
NJR","Page references suggest a likely source is the 1566 Latin edition of Herodotus's <i>Histories</i>. See estienne1566, 1. Medea: in Greek mythology, daughter of King Aeëtes of Colchis.","tc, tcn, tl",,historical,,,true,true,,,,
p162r,p162r_1,c_162r_03,x,x,x,TT,Latin: Six gold bowls weighing 30 talents.,"tc, tcn, tl",,translation,,,false,false,,,,
p162r,p162r_1,c_162r_04,x,x,x,TT,"Page references suggest a likely source is the 1566 Latin edition of Herodotus's <i>Histories</i>. See estienne1566, 3.","tc, tcn, tl",,historical,,,true,true,,,,
p162r,p162r_1,c_162r_05,x,x,x,TT,"Latin: Bowl of welded iron at Delphi, a notable sight among all the offerings that are at Delphi, the work of Glaucus of Chios, who alone among all discovered iron welding.","tc, tcn, tl",,translation,,,false,false,,,,
p162r,p162r_1,c_162r_06,x,x,x,TT,Latin: welded iron,"tc, tcn, tl",,Translation,,,false,false,,,,
,p162r_1,c_162r_07,x,x,x,NJR,Alyattes of Lydia (ca. 610–560 BCE): King of Lydia and father of Croesus.,"tc, tcn, tl",,,,,false,false,,,,
p162r,p162r_1,c_162r_08,x,x,x,NJR,"Clio is also the name of Book I of the <i>Histories of Herodotus</i>. In Greek mythology, Clio was the muse of history. ","tc, tcn, tl",,Translation | Historical | Editorial,,,true,true,,,,
,p162r_1,c_162r_09,x,x,x,NJR,Croesus (595–ca. 546 BCE): King of Lydia and son of Alyattes.,"tc, tcn, tl",,,,,false,false,,,,
,p162r_1,c_162r_10,x,x,x,NJR,"Glaucus of Chios (8th c. BCE): Greek sculptor, often referred to as the inventor of the arts of soldering metals.","tc, tcn, tl",,,,,false,false,,,,
,p162r_1,c_162r_11,x,x,x,NJR,Gyges of Lydia (7th c. BCE): King of Lydia and founder of the Mermnad dynasty.,"tc, tcn, tl",,,,,false,false,,,,
p163r,p163r_1,c_163r_03,x,x,x,NJR,reading <i>pinon</i> as <i>pignon</i> (pine nut),"tc, tcn, tl",,Editorial | Translation,,,true,true,,,,
p164v,p164v_1,c_164v_03,x,x,x,PHS,like a mitten,"tc, tcn, tl",,Editorial | Translation,,,false,false,,,,
p165v,p165v_1,c_165v_02,x,x,x,NJR,This addition appears to be in a darker ink and begins as the last line of the main text before continuing into the right margin. This may indicate that it was added at a later time.,"tc, tcn, tl",,Handshift,,,false,false,,,,
p165v,p165v_2,c_165v_03,x,x,x,NJR,"This appears to be in a darker ink, which may indicate a later addition.","tc, tcn, tl",,Handshift,,,false,false,,,,
p165v,p165v_4,c_165v_04,x,x,x,PHs,"i.e., the common lute","tc, tcn, tl",,Editorial | Translation,,,false,false,,,,
p166r,p166r_1,c_166r_01,x,x,x,NJR THU,"This aphorism also appears, slightly rephrased, on fol. 1r.","tc, tcn, tl",,,,,false,false,,,,
p166r,p166r_1,c_166r_02,x,x,x,TT,"A similar note appears in Latin on fol. 1r. Here, the author-practitioner offers an expanded French paraphrase.","tc, tcn, tl",,,1r_02,,false,false,,,,
p166r,p166r_1,c_166r_03,x,x,x,,"Numenius Numenius (2nd c. CE): platonist philosopher; see macrobius1556, 1.2.19. Mentioned by various sixteenth-century authors, such as vives2000; cartari1584, 276. The author-practitioner's knowledge that Numenius was a Pythagorean comes from elsewhere.","tc, tcn, tl",,,,,false,false,,,,
p166r,p166r_1,c_166r_04,x,x,x,,"Titus Flavius Josephus, also known as Yosef ben Matityahu (1st c. CE): Jewish priest, soldier, and historian based in Rome. The quotation in Josephus has not been identified. See josephus1486","tc, tcn, tl",,,,,false,false,,,,
p166r,p166r_1,c_166r_05,x,x,x,NJR,Pythagoras of Samos (ca. 570–ca. 495 BCE): Greek philosopher.,"tc, tcn, tl",,,,,false,false,,,,
p166r,p166r_1,c_166r_06,x,x,x,CAG     PHS,"Latin: ""Nothing is said now that has not been said or done before."" This would seem to be glossing Terence (second century BCE), <i>Eunuchus</i>, Prologue: ""Nothing is said now that has not been said before."" The author here adds <i>aut factum</i> (or done), perhaps because his book is of deeds not words.","tc, tcn, tl",,,,,true,true,,,,
p166r,p166r_1,c_166r_07,,,,,Unidentified quotation,"tc, tcn, tl",,,,,false,false,,,,
p166r,p166r_1,c_166r_08,x,x,x,CAG       PHS,"Latin: ""Apollo learned to medicate from Chiron, yet he is considered the god of medicine."" Source is not known, but may simply be common knowledge of mythology in the author-practitioner's own Latin. The reference is wrong: it should not be Apollo but Aesculapius (Apollo put Chiron in charge of Aesculapius's medical education).","tc, tcn, tl",,,,,false,false,,,,
p166r,p166r_1,c_166r_09,x,x,x,CAG       PHS,"Latin: ""Homer imitated the poem of Orpheus, for, as Orpheus had begun, 'Iram cane, dea, Cereris frugiferentis,' so Homer repeated, 'Iram cane, dea, Pelidae Achillis.' In Justin Martyr, towards the beginning."" Cf. justin1555, 20 (= <i>Ad Graecos Cohortatio</i>, 17).","tc, tcn, tl",,,,,true,true,,DONE,,
p166r,p166r_1,c_166r_10,x,x,x,PHS,"The word <i>zelotype</i> rarely occurs in French texts, although it does appear in COT1611 and DMF2015.","tc, tcn, tl",,,,,true,true,,,,
,p166r_1,c_166r_12,x,x,x,NJR,"Cebes of Thebes (ca. 430–350 BCE): Greek philosopher, disciple of Socrates, and author of the <i>Table of Cebes</i>. ","tc, tcn, tl",,,,,true,true,,,,
,p166r_1,c_166r_13,x,x,x,NJR,Numa Pompilius (753–673 BCE): second King of Rome and religious founder.,"tc, tcn, tl",,,,,false,false,,,,
,p166r_1,c_166r_14,x,x,x,NJR,"Marcus Tullius Cicero (106–43 BCE): Roman statesman, philosopher, and orator.","tc, tcn, tl",,,,,false,false,,,,
,p166r_1,c_166r_15,x,x,x,NJR,Plato (ca. 428–ca. 447 BCE): Greek philosopher.,"tc, tcn, tl",,,,,false,false,,,,
,p166r_1,c_166r_16,x,x,x,NJR,"Publius Vergilius Maro, also known as Virgil (70–19 BCE): Roman poet under the reign of Augustus.","tc, tcn, tl",,,,,false,false,,,,
,p166r_1,c_166r_17,x,x,x,NJR,Homer (8th c. BCE): Greek poet.,"tc, tcn, tl",,,,,false,false,,,,
,p166r_1,c_166r_18,x,x,x,NJR,Aulus Gellius (ca. 125–ca. 180 CE): Latin writer and grammarian based in Rome. gellius1585,"tc, tcn, tl",,,,,false,false,1r,,,
,p166r_1,c_166r_19,x,x,x,NJR,Valerius Maximus (1st c. CE): Latin writer and historian. maximus1491,"tc, tcn, tl",,,,,false,false,1r,,,
,p166r_1,c_166r_20,x,x,x,NJR,Titus Livius (64 or 59 BCE–12 or 17 CE): Roman historian. livius1573; livius1583,"tc, tcn, tl",,,,,false,false,,,,
,p166r_1,c_166r_21,x,x,x,NJR,Polybius (208–126 BCE): statesman and historian from the Hellenistic period. polybius1582,"tc, tcn, tl",,,,,false,false,,,,
,p166r_1,c_166r_22,x,x,x,NJR,Serapis: Graeco-Egyptian sun god associated with healing and fertility.,"tc, tcn, tl",,,,,false,false,,,,
,p166r_1,c_166r_23,x,x,x,NJR,"Ceres, also known as Demeter: Graeco-Roman goddess of harvest and agriculture.","tc, tcn, tl",,,,,false,false,,,,
,p166r_1,c_166r_24,x,x,x,NJR,"Apollo: Graeco-Roman god associated with the sun, healing, knowledge, and various arts.","tc, tcn, tl",,,,,false,false,,,,
,p166r_1,c_166r_25,x,x,x,NJR,"Chirone: in Greek mythology, a Centaur famous for his wisdom and knowledge of medicine.","tc, tcn, tl",,,,,false,false,,,,
,p166r_1,c_166r_26,x,x,x,NJR,"Orpheus: in Greek mythology, a hero endowed with superhuman musical skills. ","tc, tcn, tl",,,,,false,false,,,,
,p166r_1,c_166r_28,x,x,x,NJR,"Peleus: in Greek mythology, hero and King of Phthia, and father of Achilles.","tc, tcn, tl",,,,,false,false,,,,
,p166r_1,c_166r_29,x,x,x,NJR,"Achilles: in Greek mythology, hero of the Trojan War and protagonist of Homer's <i>Illiad</i>.","tc, tcn, tl",,,,,true,true,,,,
,p166r_1,c_166r_30,x,x,x,NJR,"Justin Martyr (ca. 100–165 CE): Christian apologist and philosopher. On the editions of Justin Martyr, cf. wartelle2001; martyr1551; and martyr1555","tc, tcn, tl",,,,,false,false,,,,
,p166r_1,c_166v_02,x,x,x,NJR,"David (10th c. BCE): biblical figure, King of Israel.","tc, tcn, tl",,,,,false,false,,,,
p166v,p166v_2,c_166v_03,x,x,x,NJR      phs,Uncertain reading,"tc, tcn, tl",,,,,false,false,,,,
p166v,p166v_1,c_166v_04,x,x,x,CAG        PHS,"Latin: ""I was small."" See Bible, Ps. 151:1.","tc, tcn, tl",,,,,false,false,,,,
p166v,p166v_1,c_166v_05,x,x,x,CAG        PHS,"Latin: ""My hands made an organ and my fingers fashioned a psaltery."" See Bible, Ps. 151:2.","tc, tcn, tl",,,,,false,false,,,,
p166v,p166v_3,c_166v_06,x,x,x,THU,"Latin: ""dead head,"" i.e., residue from an alchemical operation. The term often referred to metal oxides used as pigments, such as hematite (a red/purple iron oxide).","tc, tcn, tl",,Translation,,,false,false,,,,
p166v,p166r_1,c_166v_07,x,x,x,THU,Latin: in the Synopsis.,"tc, tcn, tl",,Translation,,,false,false,,,,
,p166r_1,c_166v_08,x,x,x,NJR,Athanasius of Alexandria (ca. 296–ca. 373 CE): theologian and statesman based in Egypt.  ,"tc, tcn, tl",,,,,false,false,,,,
p167r,p167r_1,c_167r_01,x,x,x,NJR,A description of each tool depicted is given on fol. 168r–v.,"tc, tcn, tl",,Editorial | Structural,,,false,false,,,,
p167v,p167r_1,c_167v_01,x,x,x,NJR,Fine powder used for priming a piece of artillery.,"tc, tcn, tl",,Editorial,,,false,false,,,,
p168r,p167r_1,c_168r_01,x,x,x,NJR,A boring tool similar to a gimlet.,"tc, tcn, tl",,Editorial,,,false,false,,,,
p168v,p167r_1,c_168v_01,x,x,X,NJR,"i.e., a flange to hang it up","tc, tcn, tl",,Editorial,,,false,false,168r,,,
p169v,p169v_2,c_169v_02,x,x,x,NJR,"Likely Istrian stone (<i>pietra d'Istria</i>), a building stone from the Republic of Venice or, perhaps, a stone from Istres, France.","tc, tcn, tl",,Editorial,,,true,true,,,,
p170r,p170r_6,c_170r_01,x,x,x,NJR,This marginal note is oriented 90 degrees clockwise to the main text and continues the last entry on this page which ends with a corresponding mark.,"tc, tcn, tl",,Structural,,,false,false,,,,
p170r,p170r_6,c_170r_02,x,x,x,NJR,This continues in the margin indicated by a corresponding mark.,"tc, tcn, tl",,Structural,,,false,false,,,,
p170r,p170r_1,c_170r_03,x,x,x,PHS    CAG,"<i>Trampe</i> is translated here as ""quenched"" but could also be ""tempered.""","tc, tcn, tl",,Translation,,,true,true,,,,
p170v,p170v_1,c_170v_03,x,x,x,"NJR
THU","This is a mark only visible when the page is back-lit. It looks like two vertical bars with a single crosshatch. Currency unknown, perhaps <i>sols</i> as above. The mark visible under the paper strip in the right margin suggests the writer (hand E, semi-calligraphic) intended to continue this thought elsewhere on the page but forgot.","tc, tcn, tl",,Editorial | Handshift,,,true,true,,,,
p170v,p170v_3,c_170v_04,X,x,x,TT          PHS,"This list of six titles in Italic script seems to be continued on fol. 1r with the singular Italic title, <i>Aquatilium animalium historiæ</i>, found near the bottom of the page. This might indicate that when the author-practitioner ran out of room here, he turned the entire bound text over and upside down to start writing on what is now the first folio of the manuscript.","tc, tcn, tl",,Structural,,,true,true,,,,
p170v,p170v_1,c_170v_12,x,x,X,NJR       phs TT,"This whole page is upside down. The first half of this page (now found at the bottom) is in a different hand (hand E, semi-calligraphic) and records payments of rent to the heirs of Sieur Ouvrier. It is struck through with diagonal lines and is separated from the subsequent text by a horizontal line. The second half of the page (now at the top), is in the author-practitioner's main hand (hand A). This suggests that he took a bound, mostly-blank book—perhaps a book recording accounts such as the ones found here—struck through the account records, and began to record medical recipes and a list of titles under them. Then, when he ran out of room, he flipped the entire book over, turned it upside down, and began writing on what now is the first folio of the manuscript (1r).","tc, tcn, tl",review         PHS:ok,Structural,,,false,false,,,,
p170v,p170v_1,c_170v_13,x,x,X,,"The Ouvrier family (sometimes d’Ouvrier), a prominent family of Toulouse from the late 15th-18th century, included Rigail Ouvrier (Capitoul 1541, 1544), his son, Jean Ouvrier (d. 1580), a Conseiller in the Parliament, Jean’s son, also called Jean Ouvrier, also Conseiller in the Parliament. Jean II was a strong supporter of the League, dying in 1592 at the Battle of Villemur alongside his friend Duke Scipion de Joyeuse and the Sieur de Pardeilhan, commander of the artillery. Benoît Ouvrier (d. 1573), another son of Rigail and a merchant, owned a house located on the “rue des Fleurs,” near the Mint. This is probably the <i>feu sr Ouvryer</i> mentioned here. Benoît's sons, Gabriel d’Ouvrier was Capitoul 1610-1611 and François was <i>Maître des ports et passages</i> in 1608. The Ouvrier family was linked to the Du Cros family (see fol. 9v) through two marriages, one between Jean Ouvrier (the supporter of the League) and Anne Du Cros in 1586, and the other between Gabriel Ouvrier (his brother) and Françoise Du Cros in 1592.","tc, tcn, tl",,Historical ,,,true,true,,,,
p170v,p170v_1,c_170v_14,x,x,X,NJR,"Saint-Frajou: Haute-Garonne, district of Saint-Gaudens, canton of Isle-en-Dodon (approx. 65 km SW of Toulouse)","tc, tcn, tl",,Historical,,,false,false,,,,
p170v,p170v_2,c_170v_15,x,x,X,NJR,"<i>Scabieuse</i> (scabious) seems to refer to several kinds of plants, not all of which belong to the genus Scabiosa in modern botany.","tc, tcn, tl",,Editorial,,,true,true,,,,
p170v,p170v_3,c_170v_16,x,x,X,,"Latin: ""Vinegar made from rue, juniper berries crushed together. With this vinegar red-hot bricks shall be extinguished and the vapor shall be received through the mouth & nostrils.""","tc, tcn, tl",,Translation,,,false,false,,,,
p170v,p170v_3,c_170v_17,x,x,X,NJR,"<i>Aer infaict</i> (infected air) connotes a tiny amount of morbid substance spreading throughout the air, analogous to dye tinging clear water.","tc, tcn, tl",,Editorial,,,true,true,,,,
p170v,p170v_3,c_170v_19,x,x,X,TT,Perhaps referring to seeds of the juniper berries mentioned in the Latin passage above.,"tc, tcn, tl",,Translation,,,false,false,,,,
p170v,p170v_3,c_170v_20,x,x,X,CAG,buchanan1582,"tc, tcn, tl",review         PHS:ok,,,,false,false,,,,
p170v,p170v_3,c_170v_21,x,x,X,CAG,dodoens1553,"tc, tcn, tl",review         PHS:ok,,,,false,false,,,,
p170v,p170v_3,c_170v_22,x,x,X,CAG,delorme1561,"tc, tcn, tl",review         PHS:ok,,,,false,false,,,,
p170v,p170v_3,c_170v_23,x,x,X,CAG,"Michel de Vascosan (ca. 1500–1576): Parisian printer. He is the publisher of porzio1549, which the author-practitioner seems to confuse with telesio1528. Telesius is often associated (i.e., bound, printed) with works of French humanist Lazare de Baïf (1496–1547). See: collin2010","tc, tcn, tl",review,,,,false,false,,,,
p170v,p170v_3,c_170v_24,x,x,X,CAG,marbidus1511. This work was reprinted frequently throughout the sixteenth century.,"tc, tcn, tl",review         PHS:ok,,,,false,false,,,,
p170v,p170v_3,c_170v_25,x,x,X,CAG,A twelfth-century chronicle: otto1515; otto1569. The reference here points to the 1569 edition.,"tc, tcn, tl",review         PHS:ok,,,,false,false,,,,
p170v,p170v_3,c_170v_26,x,x,X,CAG,burchard1537,"tc, tcn, tl",review,,,,false,false,,,,
p170v,p170v_3,c_170v_27,x,x,X,TT,mercuriale1588,"tc, tcn, tl",review         PHS:ok,,,,false,false,,,,
