folio,folio_display,div_id,categories,heading_tc,heading_tcn,heading_tl,al_tc,al_tcn,al_tl,bp_tc,bp_tcn,bp_tl,cn_tc,cn_tcn,cn_tl,df_tc,df_tcn,df_tl,env_tc,env_tcn,env_tl,m_tc,m_tcn,m_tl,md_tc,md_tcn,md_tl,ms_tc,ms_tcn,ms_tl,mu_tc,mu_tcn,mu_tl,pa_tc,pa_tcn,pa_tl,pl_tc,pl_tcn,pl_tl,pn_tc,pn_tcn,pn_tl,pro_tc,pro_tcn,pro_tl,sn_tc,sn_tcn,sn_tl,tl_tc,tl_tcn,tl_tl,tmp_tc,tmp_tcn,tmp_tl,wp_tc,wp_tcn,wp_tl,de_tc,de_tcn,de_tl,el_tc,el_tcn,el_tl,it_tc,it_tcn,it_tl,la_tc,la_tcn,la_tl,oc_tc,oc_tcn,oc_tl,po_tc,po_tcn,po_tl
121v,121v,121v_1,casting,Pour gecter en argent,Pour gecter en argent,For casting in silver,,,,doigts; poulse; joinctee,doigts; poulse; joinctee,finger; handful; thumb,,,,,,,,,,letton; plastre; moustarde claire; alum de plume; eau de vye; eau; sel armoniac; metaulx; argent allie est meilleur pour gecter que le fin; sable; or; alum de plume pur recuit &amp; pulverise; brique recuicte; crocum; argent; eau commune; alum de plume recuit; saulce espesse,letton; plastre; moustarde claire; argent allié est meilleur pour gecter que le fin; eau de vye; alum de plume; sel armoniac; metaulx; eau; or; sable; brique recuicte; alum de plume pur recuit &amp; pulverisé; crocum; argent; eau commune; alum de plume recuit; saulce espesse,thick sauce; latten; gold; alloyed silver is better for casting than the fine one; sand; metal; brick; mustard; plaster; silver; eau-de-vie; crocum; ammoniac; water; feather,,,,petite joinctee; aultant que tu en pourras prendre avecq les 4 doigts et le poulse; escuelle de terre ou les paysans mangent leurs souppes; part; pars,petite joinctee; aultant que tu en pourras prendre avecq les 4 doigts et le poulse; escuelle de terre où les paysans mangent leurs souppes; part; pars,"as much as you can take with 4 fingers and the thumb; part; handful; earthenware bowl, from which the peasants eat their soup",,,,moustarde,moustarde,mustard,,,,,,,paysans,paysans,peasant,,,,mortier; pinceau; molle; table; pallete; escuelle de terre ou les paysans mangent leurs souppes; moules; escuelle,mortier; pinceau; molle; table; escuelle de terre où les paysans mangent leurs souppes; pallete; moules; escuelle,bowl; mortar; table; paintbrush; mold; spatula,,,,,,,,,,,,,,,,crocum,crocum,crocum,,,,,,
121v,121v,121v_2,casting,Argent a gecter,Argent a gecter,Silver for casting,,,,,,,teston; sols,teston; sols,sous; teston,,,,,,,poinct argent fin ains allie; terre areneuse; or; lutes; argent allie; fil de fer; argent de capitale; terre; argent de teston; luter; cendres; argent; bourre dequoy les fondeurs se servent pour gecter leurs canons; bon luth; souldure,terre areneuse; bourre de quoy les fondeurs se servent pour gecter leurs canons; or; lutes; fil de fer; argent allié; bon luth; terre; argent de teston; argent de capitale; luter; argent; cendres; poinct argent fin ains allié; souldure,solder; lute; wire; gold; earth; ash; silver; cloth waste which founders use to cast their cannon; luting,,,,denier,denier,denier,,,,,,,capitale,capitale,capital,,,,orfevres; fondeurs,orfevres; fondeurs,goldsmith; founder,,,,fil de fer; luter; bon luth; lutes; moules,fil de fer; luter; bon luth; lutes; moules,luting; iron wire; mold; lute,,,,canons,canons,cannon,,,,,,,,,,,,,,,,,,
122r,122r,122r_1,casting,Plant des animaulx divers,Plant des animaulx divers,Arranging various animals,lesardes; serpents,lesardes; serpents,lizard; snake,,,,,,,,,,,,,fil de fer; cire,fil de fer; cire,wire; wax,,,,,,,,,,,,,,,,,,,,,,,,,poincte dun trancheplume; grosse aiguille; table; fil de fer; chassis; moule; fil de fer chault par le bout,grosse aiguille; poincte d’un trancheplume; table; fil de fer; chassis; moule; fil de fer chault par le bout,frame; needle; iron wire; table; tip of a hot iron wire; mold; point,,,,,,,,,,,,,,,,,,,,,,,,
122r,122r,122r_2,casting,Fleur en la bouche du serpent,Fleur en la bouche du serpent,Flower in the mouth of the snake,serpent,serpent,snake,main,main,hand,,,,,,,,,,fil de fer; sable; cire,fil de fer; sable; cire,wire; wax; sand,contrepoison,contrepoison,antidote,,,,,,,absinthe,absinthe,wormwood,,,,,,,,,,,,,bout dun fil de fer qui soict chault; filet; esguille; main,filet; esguille; bout d’un fil de fer qui soict chault; main,end of a iron wire that is hot; thread; needle; hand,,,,,,,,,,,,,,,,,,,,,,,,
122v,122v,122v_1,casting,Nettoyer lescuelle et la cueillere dequoy on destrempe le sable,Nettoyer l’escuelle et la cueillere de quoy on destrempe le sable,Cleaning the bowl and the spoon with which one tempers the sand,,,,,,,,,,,,,,,,sable frais; sable,sable frais; sable,sand,,,,,,,,,,,,,,,,,,,,,,,,,pallette; moule; cuillere; cueillere; escuelle,pallette; moule; cuillere; cueillere; escuelle,spoon; mold; bowl; spatula,,,,,,,,,,,,,,,,,,,,,,,,
122v,122v,122v_2,casting,Mouler en creux,Mouler en creux,Molding hollow,escrevisses,escrevisses,crayfish,,,,,,,,,,,,,suif; cire; ardille,suif; cire; ardille,tallow; wax; clay,,,,,,,,,,,,,,,,,,,,,,,,,platine dardille; moule,platine d’ardille; moule,mold; slab,,,,,,,,,,,,,,,,,,,,,,,,
122v,122v,122v_3,casting,Mouler medailles et choses plattes,Mouler medailles et choses plattes,Molding medals and flat things,,,,,,,,,,,,,,,,metal; papier,metal; papier,paper; metal,,,,,,,,,,,,,,,,,,,,,,,,,,,,,,,,,,,,,,,,,,,,,,,,,,,
123r,123r,123r_1,metal process,Moyen di far correr lotnegra ,Moyen di far correr l’otnegra, A means di far correr lotnegra,serpents,serpents,snake,visaige; yeulx; bouche; nes; visage,visaige; yeulx; bouche; nes; visage,face; eye; nose; mouth,sols,sols,sous,,,,boutique,boutique,shop,sel gros commun fondu; arsenic; argent; terre fiens ou terre bourre de laquelle les fondeurs dartiglerie se servent; aes ustum; otnegra; souldent; soulder; arsenic blanc; estaim; sal gemme; sublime; lute; argent fondu; fil de fer; rostie au beurre; limaille de cuivre fin; metallique; antimoyne; letton; verre pile; orpiment; salpestre; pieces dor; grain metallic; suin de verre; estaim de glace; estaim fin; lutes; tartre crud; souldure; limailles; luth; luthe; zedoaire; beurre; plomb; arsenic jaulne; sel armoniac; borras; luter; cuivre; acier rompu; sels sublimes &amp; mesles ensemble; sels; metal fondu,"sel gros commun fondu; arsenic; sels sublimés &amp; meslés ensemble; luthé; argent; aes ustum; otnegra; souldent; soulder; arsenic blanc; estaim; sal gemme; sublime; lute; argent fondu; fil de fer; rostie au beurre; limaille de cuivre fin; metallique; antimoyne; letton; orpiment; salpestre; grain metallic; suin de verre; sublimé; verre pilé; terre fiens ou terre bourré, de laquelle les fondeurs d’artiglerie se servent; pieces d’or; estaim fin; lutes; tartre crud; souldure; estaim de glace; limailles; luth; zedoaire; beurre; plomb; arsenic jaulne; sel armoniac; borras; luter; cuivre; acier rompu; sels; metal fondu","pestled glass; solder; sandiver; arsenic; melted silver; saltpeter; salts, sublimated &amp; mixed together; silver; metallic; copper; aes ustum; ammoniac; tin; otnegra; filing; melted metal; lute; grain; wire; latten; butter; sublimate; borax; orpiment; zedoary; salt; earth; tartar; lead; steel; antimony; luted; coarse common salt melted; good buttered toast; gold coin",la fumee en est dangereuse; les fumees qui sont dangereuses te pourroient nuire,fumées qui sont dangereuses te pourroient nuire; fumée en est dangereuse,"fumes, which are dangerous, could hurt you; fumes of it are dangerou",bon matin; aultant que de borras; heures; matin; jour naturel; denier; sols; tout un jour; unces; quarte ou cinquiesme partye; moictie; ℥,bon matin; aultant que de borras; heures; moictié; matin; jour naturel; denier; tout un jour; unces; quarte ou cinquiesme partye; ℥; sols,part; in the early morning; as much as borax; for a whole day; sous; morning; hour; denier; day; ounce; ℥; half,,,,zedoaire,zedoaire,zedoary,,,,,,,ceulx qui travaillent de vaissele &amp; grosserie; garson de boutique; fondeurs dartiglerie; rustique; orfevres,fondeurs d’artiglerie; ceulx qui travaillent de vaissele &amp; grosserie; garson de boutique; rustique; orfevres,founder; boy; goldsmith; silversmith; those who work in plate and large ware; rustic,,,,creuset; tuyle; luthe; lute; crusol; pile; fil de fer; luter; piler; four a vent; fourneau; piles; lutes; serviette; luth,creuset; tuyle; lute; crusol; fil de fer; luter; piler; fourneau; four à vent; piles; luthé; lutes; pilé; serviette; luth,furnace; lute; crucible; pestled; iron wire; luted; pestle; tile; four à vent; cloth,bon matin; heures; long temps; matin; jour naturel; tout un jour,bon matin; heures; long temps; matin; jour naturel; tout un jour,for a whole day; time; morning; hour; day; in the early morning,artiglerie,artiglerie,artillery,,,,,,,di far correr lotnegra,di far correr l’otnegra,di far correr lotnegra,aes ustum,aes ustum,aes ustum,crusol,crusol,crucible,tourtelles; tourtelle,tourtelles; tourtelle,cake; cakes
124r,124r,124r_1,casting,Animaulx a poil et fleurs foibles et fort tanvres,Animaulx à poil et fleurs foibles et fort tanvres,Animals with hair and fragile and very thin flowers,papillons,papillons,butterfly,,,,,,,dent de lyon,dent de lyon,dandelion,vent,vent,wind,huile; huile de froment,huile; huile de froment,oil,,,,,,,,,,papus; dent de lyon; lapasses; froment,papus; dent de lyon; lapasses; froment,pappu; burdock; dandelion; wheat,,,,,,,,,,,,,,,,,,,,,,,,,,,,,,,,,,,,,,,
124r,124r,124r_2,casting,Noyaulx pour mouler creus,Noyaulx pour mouler creus,Noyaulx for molding hollow,,,,,,,,,,,,,,,,or; argent,or; argent,gold; silver,,,,,,,,,,,,,,,,,,,,,,,,,moule,moule,mold,,,,,,,,,,,,,,,,,,,,,,,,
124r,124r,124r_3,casting,Toile diraignee,Toile d’iraignee,Spider’s web,iraignee; iraigne,iraignee; iraigne,spider,,,,,,,,,,aulx champs,aulx champs,in the field,estaim bien peu allie de plomb; quarton; papier colle sur le quarton; eau,estaim bien peu allié de plomb; papier collé sur le quarton; quarton; eau,"paper; quarton; glued; water; tin, very little alloyed with lead",,,,,,,,,,,,,,,,,,,,,,,,,quarton; papier colle sur le quarton; poincte,papier collé sur le quarton; quarton; poincte,glued to the quarton; quarton; point,,,,,,,,,,,,,,,,,,,,,,,,
124r,124r,124r_4,casting,Or fin,Or fin,Fine gold ,,,,,,,,,,,,,,,,antimoyne; plomb; or; verdet; or fin; eau fort,antimoyne; plomb; or; verdet; or fin; eau fort,lead; gold; antimony; verdet; aquaforti,,,,,,,,,,,,,,,,,,,,,,,,,marteau,marteau,hammer,,,,,,,,,,,,,,,,,,,,,,,,
124v,124v,124v_1,painting;metal process,Esmail Rouge clair,Esmail rouge clair,Rouge clair enamel,,,,,,,escu; pistolet,escu; pistolet,écu; pistolet,,,,,,,arene; or; esmaulx; rouge clair; esmauls; or fin; grains dor; esmail,arene; or; esmaulx; rouge clair; esmauls; or fin; grains d’or; esmail,arene; grain; gold; rouge clair; enamel,,,,,,,,,,,,,,,,,,,orfevres,orfevres,goldsmith,,,,,,,,,,,,,,,,,,,,,,,,,,,,,,
124v,124v,124v_2,casting,Gecter en or,Gecter en or,Casting with gold,,,,,,,,,,,,,,,,plomb; eau; or allie; or; esmeraulde; terre; argent; or fin; chaulx diceulx; estain; cire,plomb; eau; chaulx d’iceulx; or; esmeraulde; terre; argent; or fin; or allié; estain; cire,emerald; lime; lead; gold; silver; wax; earth; water; tin,,,,un quart plus pesant que,un quart plus pesant que,quarter heavier than,,,,,,,,,,,,,orfevres,orfevres,goldsmith,,,,forge; four de reverberation; moule; moules; pot,forge; four de reverberation; moule; moules; pot,mold; forge; furnace; pot,,,,,,,,,,,,,,,,,,,,,,,,
124v,124v,124v_3,casting,Moyen de fayre le gect pour petites lezardes,Moyen de fayre le gect pour petites lezardes,A means to make the gate for small female lizards,serpent; lezardes,serpent; lezardes,lizard; snake,,,,,,,,,,,,,metal; fil de fer; sable; cire,metal; fil de fer; sable; cire,wire; metal; wax; sand,,,,espesseur dun costeau,espesseur d’un costeau,thickness of a knife,,,,,,,,,,,,,,,,,,,costeau; moule; bout du fil de fer chault; fil de fer chault,costeau; moule; bout du fil de fer chault; fil de fer chault,knife; hot iron wire; end of the hot iron wire; mold,,,,,,,,,,,,,,,,,,,,,,,,
125r,125r,125r_1,casting,Plastre,Plastre,Plaster,,,,,,,,,,,,,sur les maisons; pluyes,maisons; pluyes,rain,plastre; eau; eau froide; eau chaulde; huiler; pierre; sable de noyau; plastre gris transparent nest pas fort mays celuy est bon qui estant destrempe est blanc; cire,"plastre; eau; plastre gris transparent n’est pas fort, mays celuy est bon qui estant destrempé est blanc; eau froide; eau chaulde; huiler; pierre; sable de noyau; cire","stone; sand; plaster; wax; oil; water; transparent grey plaster is not strong, but the one that, being tempered, is white",,,,,,,,,,,,,allemaigne,allemaigne,germany,,,,,,,,,,moule; moules de plastre,moule; moules de plastre,mold,long temps,long temps,longer,,,,,,,,,,,,,,,,,,,,,
125r,125r,125r_2,arms and armor;casting,Symeterres,Symeterres,Scimitars,,,,,,,,,,,,,mine; mines,mine; mines,,acier; fer fondu; fer; fer douls; sable,acier; fer fondu; fer; fer douls; sable,melted iron; steel; sand; ore; iron,,,,,,,,,,,,,hongrie; turcs; damas,hongrie; turcs; damas,hungary; turk; damascu,,,,ouvriers,ouvriers,worker,,,,,,,,,,symeterres; cimeterres; cimeterre,symeterres; cimeterres; cimeterre,scimitar,,,,,,,,,,,,,,,,,,
125r,125r,125r_3,tricks and sleight of hand,Ouyr de loing,Ouyr de loing,Hearing from afar,,,,oreille,oreille,ear,,,,,,,,,,,,,,,,,,,,,,,,,,,,,,,,,,entendras; ouyr,entendras; ouyr,hearing; hear,,,,de nuict ou en temps de silence,de nuict ou en temps de silence,at night or at a silent time,,,,,,,,,,,,,,,,,,,,,
125v,125v,125v_1,casting,Viperes et serpens,Viperes et serpens,Vipers and snakes,cochon; vipere; chien; viperes; serpents; aspic cornu; serpent; serpens,cochon; vipere; chien; viperes; serpents; aspic cornu; serpent; serpens,dog; horned asp; pig; viper; snake,,,,,,,,,,,,,,,,,,,,,,,,,,,,,,,,,,,,,,,,,,,,,,,,,,,,,,,,,,,,,,,,,,
125v,125v,125v_2,casting,Mouler tortues,Mouler tortues,Molding turtles,serpents; tortues,serpents; tortues,turtle; snake,,,,,,,,,,,,,plastre; sucre,plastre; sucre,sugar; plaster,,,,,,,,,,,,,,,,,,,,,,,,,,,,,,,,,,,,,,,,,,,,,,,,,,,
125v,125v,125v_3,casting,Plastre pour gect de cire,Plastre pour gect de cire,Plaster for casting of wax,,,,,,,,,,,,,,,,plastre; albastre; metal; eau chaulde; cire,plastre; albastre; metal; eau chaulde; cire,metal; plaster; wax; alabaster; water,,,,,,,,,,,,,,,,,,,,,,,,,moule; moule de plastre,moule; moule de plastre,mold,,,,,,,,,,,,,,,,,,,,,,,,
126r,126r,126r_1,casting,Mouler fruicts en sucre et animaulx,Mouler fruicts en sucre et animaulx,Molding fruits and animals in sugar,,,,,,,,,,,,,,,,cirop; plastre; amydon; sucre fondu en eau; eau; metal; eau froide; sucre; ardille; terre; cire fondue; amande; sucre fort clarifie; cire,plastre; cirop; amydon; sucre fondu en eau; eau; sucre fort clarifié; metal; eau froide; sucre; ardille; terre; cire fondue; amande; cire,sugar; syrup; clay; starch; metal; plaster; melted wax; wax; almond; earth; sugar melted in water; water,,,,jour; nuict; tout un jour et une nuict,jour; nuict; tout un jour et une nuict,night; day,,,,raisins; sauvignons; raisin; pommes; chauches; poires; amande,raisins; sauvignons; grain; grains; raisin; pommes; poires; amande; chauchés,grape; pear; apple; almond; sauvignon; chauchés,,,,,,,,,,,,,moule de plastre; plaste dardille; plaste; moule; amande; moules,moule de plastre; plaste; moule; amande; moules; plaste d’ardille,almond; mold; slab,saison; jour; nuict,saison; jour; nuict,season; night; day,,,,,,,,,,,,,,,,,,,,,
126v,126v,126v_1,casting,Crocum ferri,Crocum ferri,Crocum ferri,,,,,,,sols,sols,sous,,,,,,,crocum ferri; cendres chauldes; or; limaille; rouille; crocum; rouille de fer; vinaigre,crocum ferri; cendres chauldes; or; limaille; rouille; crocum; rouille de fer; vinaigre,rust; filing; gold; ferri; vinegar; ash; crocum,,,,once; sols,once; sols,sous; ounce,,,,,,,,,,,,,,,,,,,moules; moule,moules; moule,mold,,,,,,,,,,,,,,,,crocum ferri; crocum,crocum ferri; crocum,crocum ferri; crocum,,,,,,
126v,126v,126v_2,casting,Plastre,Plastre,Plaster,,,,,,,,,,,,,,,,cire treschaulde; plastre; boys; cire fort chaulde,plastre; cire tres chaulde; boys; cire fort chaulde,plaster; wood; wax,,,,,,,,,,,,,,,,,,,,,,,,,moules,presse; moules,press; mold,,,,,,,,,,,,,,,,,,,,,,,,
126v,126v,126v_3,casting,Herbes difficilles a brusler dans le noyau,Herbes difficilles à brusler dans le noyau,Plants difficult to burn in the noyau,,,,,,,,,,,,,,,,escaille de fer; fer; sable cler; chair; sable destrempe; os des animaulx; esmeri; terre; crocum; cire; boys; cendre; huile de petrol ou de soufre; huile de brique; cire fondue; tourmentine; eaulx forts; eaulx de vye; vif argent; sables; os; charbon,escaille de fer; fer; sable cler; chair; os des animaulx; esmeri; terre; crocum; cire; boys; cendre; huile de petrol ou de soufre; huile de brique; cire fondue; tourmentine; eaulx forts; sable destrempé; eaulx de vye; vif argent; sables; os; charbon,emery; wood; bone; charcoal; turpentine; flesh; ash; sand; scale; eau-de-vie; wax; oil; iron; melted wax; crocum; earth; quicksilver; aquaforti,,,,jours,jours,day,,,,rosmarin; tim; asperge,rosmarin; tim; asperge,asparagu; thyme; rosemary,,,,,,,,,,,,,molle; moules; moule; cercle de terre,molle; moules; moule; cercle de terre,circle; mold,jours,jours,day,,,,,,,,,,,,,crocum,crocum,crocum,,,,,,
127r,127r,127r_1,casting,Moule de plastre pour cire,Moule de plastre pour cire,Molds of plaster for wax,,,,,,,,,,,,,,,,plastre; cire,plastre; cire,plaster; wax,,,,,,,,,,,,,,,,,,,,,,,,,moules; moule; moule de plastre,moules; moule; moule de plastre,mold,,,,,,,,,,,,,,,,,,,,,,,,
127v,127v,127v_1,casting,Terre des fondeurs,Terre des fondeurs,Founders’ earth,,,,,,,,,,,,,,,,brique; eau de vye; sable destrempe; ardille; terre des fondeurs; terre; argent; crocum; fiens; alum; terre susdicte des fondeurs; lute; fil de fer; terre de laquelle les sarruriers se servent pour braser ou soulder; bourre; cendre criblee; culs de crusols; plastre; terre ardille areneuse; cendres; lutes; terre bolvene; sable; lutte; luter; os,brique; eau de vye; terre des fondeurs; terre; argent; crocum; fiens; alum; terre susdicte des fondeurs; lute; fil de fer; bourre; culs de crusols; plastre; cendre criblée; terre ardille areneuse; cendres; lutes; terre bolvene; ardille meslée de sable; terre de laquelle les fondeurs se servent pour braser ou soulder; lutte; luter; sable destrempé; os,sand; dung; silver; crocum; alum; lute; wire; eau-de-vie; clay; brick; ash; earth; luting; cloth waste; bone; terre bolvene; luted; plaster; crucible bottom,,,,,,,,,,,,,bolvene,,,,,,fondeurs; sarruriers,fondeurs,founder,,,,moles; forge; molles; crampons; lute; lutes; lutte; luter; fil de fer; four de reverberation; moule; souflet; crusols; tuelle; moules; tamisee,moles; forge; crampons; lute; lutes; lutte; luter; fil de fer; four de reverberation; moule; souflet; tamisée; crusols; tuelle; moules; molles,forge; furnace; lute; crucible; iron wire; luted; blast-pipe; mold; bellow; clamp; sieved,,,,,,,,,,,,,,,,crocum,crocum,crocum,crusols,crusol,crucible,,,
128r,128r,128r_1,casting,Gecter en argent et or,Gecter en argent et or,Casting in silver and gold,,,,doigts,doigts,finger,realle,realle,real,,,,,,,alum de plume; arsenic; or et largent fondus; argent; crocum; sable maigre delie; argent fondu; argent plus fin que la ligue du capital et comme de realle; cendre; argent bien fondu; estain; metallique; acier; orpiment; metaulx; metal; arsenic &amp; deulx foys aultant de tartre crud grossierement pulverises; argent allie; borras moulu; argent sophistique; charbons; borras; or; sable; vif argent; pierrete de borras pulverisee,alum de plume; arsenic; argent; arsenic &amp; deulx foys aultant de tartre crud grossierement pulverisés; crocum; argent fondu; argent plus fin que la ligue du capital et comme de realle; argent allié; cendre; argent bien fondu; estain; metallique; acier; orpiment; metaulx; metal; borras moulu; pierrete de borras pulverisée; charbons; argent sophistiqué; or; sable; borras; vif argent; sable maigre delié; or et l’argent fondus,"melted silver; arsenic; gold and silver, melted; sand; silver; crocum; quicksilver; tin; charcoal; stone; mold; borax; orpiment; metal; gold; ash; feather; silver finer than the alloy from the capital and like that of the real; steel",,,,bons doigts; grosseur dun pois; deulx foys aultant; grosseur dune noisette,grosseur d’un pois; bons doigts; deulx foys aultant; grosseur d’une noisette,size of a hazelnut; two times as much; finger; size of a pea,,,,noisette; pois,noisette; pois,pea; hazelnut,capital,capital,capital,,,,orfevres,orfevres,goldsmith,,,,terrine; molletes; forge; crusol; four; moule bien rouge; mollettes; vaisseau; moule; souflet; molettes; petit souflet; tuelle; moules; cruset; molles,terrine; molletes; forge; crusol; four; moule bien rouge; mollettes; vaisseau; moule; souflet; molettes; petit souflet; tuelle; moules; cruset; molles,terrine; forge; furnace; crucible; metal; blast-pipe; mold; bellow; vessel; pincer,,,,,,,,,,,,,,,,crocum,crocum,crocum,crusol,crusol,crucible,,,
128v,128v,128v_1,casting;metal process,Blanchiment de largent gecte,Blanchiment de l’argent gecté,Whitening of cast silver,lesard; petit lesard,lesard; petit lesard,lizard,,,,teston,teston,teston,,,,,,,eau de tartre; argent bas; bas argent; tartre; argent; eau; bullitoyre; eau commune; sel commun; tarte; eau claire; fuma; papier; sel commun pulverise; sel; charbons; or; cuivre; eau du bullitoyre; commun bullitoyre; ligue de teston; tartre brusle,eau de tartre; argent bas; bas argent; tartre bruslé; tartre; argent; eau; bullitoyre; eau commune; sel commun; tarte; eau claire; fuma; papier; sel commun pulverisé; sel; charbons; or; cuivre; eau du bullitoyre; commun bullitoyre; ligue de teston,paper; tartar; charcoal; burned tartar; gold; smoked; bullitoyre; silver; copper; alloy of teston; salt; water,,,,presque autant dun que daultre,presque autant d’un que d’aultre,nearly as much of one as the other,,,,,,,allemands; allemand; france,allemands; allemand; france,german; france,,,,orfevres,orfevres,goldsmith,,,,forge; grattebroissa; crusol; vaisseau; papier,forge; grattebroissa; crusol; vaisseau; papier,paper; forge; crucible; brushed; vessel,,,,,,,,,,,,,,,,,,,crusol,crusol,crucible,,,
129r,129r,129r_1,painting,Paindre herbes de metal,Paindre herbes de metal,Painting plants of metal,,,,,,,,,,,,,,,,huile; metal; glaire; gomme; pelure de figuier,huile; metal; glaire; gomme; pelure de figuier,gum; peelings of the fig tree; metal; oil; glair,,,,,,,,,,figuier,figuier,tree,,,,,,,,,,,,,,,,long,long,time,,,,,,,,,,,,,,,,,,,,,
129r,129r,129r_2,painting,Pour santonique,Pour santonique,For wormseed,,,,,,,,,,,,,,,,massicot; scudegrun; ceruse; cendre dazur; vert de terre; blanc de plomb,massicot; scudegrun; ceruse; cendré d’azur; vert de terre; blanc de plomb,massicot; lead; ceruse; cendré of azure; stil de grain yellow; vert de terre,,,,,,,,,,santonique,santonique,wormseed,,,,,,,,,,,,,,,,,,,,,,,,,,,,,,,,,,,,,,,
129r,129r,129r_3,casting,Couleur de vipere,Couleur de vipere,Viper color,serpent; lesard; vipere,serpent; lesard; vipere,lizard; viper color; snake,,,,,,,,,,,,,estein; verdegris; plomb; linge rude; bon vinaigre; argent; metalline; estain; soufre,estein; verdegris; plomb; linge rude; bon vinaigre; argent; metalline; estain; soufre,verdigri; lead; vinegar; sulfur; silver; metalline; linen; tin,,,,demy balle dharquebus,demy balle d’harquebus,ball,,,,,,,,,,,,,,,,,,,linge rude,linge rude,linen,,,,harquebus,harquebus,arquebus,,,,,,,,,,,,,,,,,,
129r,129r,129r_4,casting,Roses moulees,Roses moulées,Molded roses,mouches,mouches,fly,,,,,,,,,,,,,sable destrempe; huile de froment,sable destrempé; huile de froment,oil; sand,,,,,,,,,,pensees; caprier; roses; froment,pensées; caprier; roses; froment,caper plant; rose; wheat; pansy,,,,,,,,,,,,,,,,,,,,,,,,,,,,,,,,,,,,,,,
129v,129v,129v_1,preserving;decorative;casting,Animaulx seiches au four de longue duree,Animaulx seichés au four de longue durée,Animals dried in the oven for a long time,oyseaulx; serpents,oyseaulx; serpents,bird; snake,,,,,,,,,,soleil de juin,soleil de juin,sun,terre; pain; fil de fer; sable,terre; pain; fil de fer; sable,earth; iron; bread; sand,,,,apres que le pain est tire; un jour &amp; une nuict; asses chault comme quand on en tire le pain; comme la chaleur du soleil de juin,"un jour &amp; une nuict; comme la chaleur du soleil de juin; assés chault, comme quand on en tire le pain; aprés que le pain est tiré","hot enough, like when one takes out the bread; like the heat of the sun in june; after the bread has been taken out; day",,,,,,,,,,,,,,,,puant,puant,smelly,pinceau; broisse; poinctes de fil de fer; four; plastre de terre,pinceau; le four; poinctes de fil de fer; broisse; four; plastre de terre,brush; paintbrush; oven; slab; point,juin; de longue duree; un jour &amp; une nuict,juin; de longue durée; un jour &amp; une nuict,june; time; day,,,,,,,,,,,,,,,,,,,,,
129v,129v,129v_2,casting,Animaulx gectes en cuivre,Animaulx gectés en cuivre,Animals cast in copper,,,,,,,,,,,,,,,,cuivre; foeilles de pierrerie,cuivre; foeilles de pierrerie,foil; copper,,,,,,,,,,,,,,,,,,,,,,,,,,,,,,,,,,,,,,,,,,,,,,,,,,,
129v,129v,129v_3,casting,Advis sur le gect,Advis sur le gect,Advice concerning the gate,,,,doigts,doigts,finger,,,,,,,,,,metal,metal,metal,,,,,,,,,,,,,,,,,,,,,,,,,,,,,,,,,,,,,,,,,,,,,,,,,,,
