folio,folio_display,div_id,categories,heading_tc,heading_tcn,heading_tl,al_tc,al_tcn,al_tl,bp_tc,bp_tcn,bp_tl,cn_tc,cn_tcn,cn_tl,df_tc,df_tcn,df_tl,env_tc,env_tcn,env_tl,m_tc,m_tcn,m_tl,md_tc,md_tcn,md_tl,ms_tc,ms_tcn,ms_tl,mu_tc,mu_tcn,mu_tl,pa_tc,pa_tcn,pa_tl,pl_tc,pl_tcn,pl_tl,pn_tc,pn_tcn,pn_tl,pro_tc,pro_tcn,pro_tl,sn_tc,sn_tcn,sn_tl,tl_tc,tl_tcn,tl_tl,tmp_tc,tmp_tcn,tmp_tl,wp_tc,wp_tcn,wp_tl,de_tc,de_tcn,de_tl,el_tc,el_tcn,el_tl,it_tc,it_tcn,it_tl,la_tc,la_tcn,la_tl,oc_tc,oc_tcn,oc_tl,po_tc,po_tcn,po_tl
121v,121v,121v_1,casting,Pour gecter en argent,Pour gecter en argent,For casting in silver,,,,doigts; poulse; joinctee,doigts; poulse; joinctee,finger; thumb; handful,,,,,,,,,,alum de plume recuit; or; eau; sable; metaulx; letton; eau de vye; crocum; argent; brique recuicte; argent allie est meilleur pour gecter que le fin; eau commune; moustarde claire; alum de plume; saulce espesse; plastre; sel armoniac; alum de plume pur recuit &amp; pulverise,alum de plume recuit; or; eau; sable; metaulx; alum de plume pur recuit &amp; pulverisé; letton; eau de vye; crocum; argent; brique recuicte; argent allié est meilleur pour gecter que le fin; eau commune; moustarde claire; alum de plume; saulce espesse; plastre; sel armoniac,feather; plaster; thick sauce; ammoniac; alloyed silver is better for casting than the fine one; crocum; eau-de-vie; latten; metal; brick; silver; mustard; sand; water; gold,,,,petite joinctee; part; aultant que tu en pourras prendre avecq les 4 doigts et le poulse; escuelle de terre ou les paysans mangent leurs souppes; pars,petite joinctee; part; aultant que tu en pourras prendre avecq les 4 doigts et le poulse; escuelle de terre où les paysans mangent leurs souppes; pars,"part; handful; earthenware bowl, from which the peasants eat their soup; as much as you can take with 4 fingers and the thumb",,,,moustarde,moustarde,mustard,,,,,,,paysans,paysans,peasant,,,,pinceau; mortier; molle; escuelle; table; pallete; escuelle de terre ou les paysans mangent leurs souppes; moules,pinceau; mortier; molle; escuelle; escuelle de terre où les paysans mangent leurs souppes; table; pallete; moules,paintbrush; spatula; mold; mortar; bowl; table,,,,,,,,,,,,,,,,crocum,crocum,crocum,,,,,,
121v,121v,121v_2,casting,Argent a gecter,Argent a gecter,Silver for casting,,,,,,,sols; teston,sols; teston,sous; teston,,,,,,,luter; bon luth; bourre dequoy les fondeurs se servent pour gecter leurs canons; argent allie; or; poinct argent fin ains allie; fil de fer; cendres; argent; souldure; terre areneuse; lutes; argent de capitale; argent de teston; terre,luter; bon luth; or; fil de fer; argent allié; cendres; bourre de quoy les fondeurs se servent pour gecter leurs canons; argent; souldure; terre areneuse; lutes; argent de capitale; poinct argent fin ains allié; argent de teston; terre,earth; lute; wire; solder; silver; luting; gold; cloth waste which founders use to cast their cannon; ash,,,,denier,denier,denier,,,,,,,capitale,capitale,capital,,,,fondeurs; orfevres,fondeurs; orfevres,goldsmith; founder,,,,luter; bon luth; fil de fer; lutes; moules,luter; bon luth; fil de fer; lutes; moules,luting; mold; lute; iron wire,,,,canons,canons,cannon,,,,,,,,,,,,,,,,,,
122r,122r,122r_1,casting,Plant des animaulx divers,Plant des animaulx divers,Arranging various animals,lesardes; serpents,lesardes; serpents,snake; lizard,,,,,,,,,,,,,fil de fer; cire,fil de fer; cire,wax; wire,,,,,,,,,,,,,,,,,,,,,,,,,fil de fer chault par le bout; fil de fer; moule; chassis; grosse aiguille; table; poincte dun trancheplume,fil de fer chault par le bout; fil de fer; moule; chassis; grosse aiguille; table; poincte d’un trancheplume,iron wire; mold; needle; table; frame; tip of a hot iron wire; point,,,,,,,,,,,,,,,,,,,,,,,,
122r,122r,122r_2,casting,Fleur en la bouche du serpent,Fleur en la bouche du serpent,Flower in the mouth of the snake,serpent,serpent,snake,main,main,hand,,,,,,,,,,fil de fer; cire; sable,fil de fer; cire; sable,wax; sand; wire,contrepoison,contrepoison,antidote,,,,,,,absinthe,absinthe,wormwood,,,,,,,,,,,,,bout dun fil de fer qui soict chault; main; esguille; filet,bout d’un fil de fer qui soict chault; main; esguille; filet,thread; hand; end of a iron wire that is hot; needle,,,,,,,,,,,,,,,,,,,,,,,,
122v,122v,122v_1,casting,Nettoyer lescuelle et la cueillere dequoy on destrempe le sable,Nettoyer l’escuelle et la cueillere de quoy on destrempe le sable,Cleaning the bowl and the spoon with which one tempers the sand,,,,,,,,,,,,,,,,sable; sable frais,sable; sable frais,sand,,,,,,,,,,,,,,,,,,,,,,,,,cueillere; escuelle; moule; cuillere; pallette,cueillere; escuelle; moule; cuillere; pallette,spatula; mold; spoon; bowl,,,,,,,,,,,,,,,,,,,,,,,,
122v,122v,122v_2,casting,Mouler en creux,Mouler en creux,Molding hollow,escrevisses,escrevisses,crayfish,,,,,,,,,,,,,cire; suif; ardille,cire; suif; ardille,clay; tallow; wax,,,,,,,,,,,,,,,,,,,,,,,,,platine dardille; moule,platine d’ardille; moule,slab; mold,,,,,,,,,,,,,,,,,,,,,,,,
122v,122v,122v_3,casting,Mouler medailles et choses plattes,Mouler medailles et choses plattes,Molding medals and flat things,,,,,,,,,,,,,,,,metal; papier,metal; papier,metal; paper,,,,,,,,,,,,,,,,,,,,,,,,,,,,,,,,,,,,,,,,,,,,,,,,,,,
123r,123r,123r_1,metal process,Moyen di far correr lotnegra ,Moyen di far correr l’otnegra, A means di far correr lotnegra,serpents,serpents,snake,visaige; yeulx; bouche; nes; visage,visaige; yeulx; bouche; nes; visage,mouth; face; nose; eye,sols,sols,sous,,,,boutique,boutique,shop,tartre crud; sublime; orpiment; lute; arsenic; otnegra; grain metallic; aes ustum; luter; sal gemme; suin de verre; rostie au beurre; zedoaire; plomb; borras; fil de fer; estaim de glace; souldure; salpestre; argent; cuivre; limailles; antimoyne; metal fondu; limaille de cuivre fin; luth; terre fiens ou terre bourre de laquelle les fondeurs dartiglerie se servent; sels; argent fondu; arsenic blanc; letton; souldent; luthe; lutes; metallique; sel armoniac; verre pile; soulder; sels sublimes &amp; mesles ensemble; arsenic jaulne; sel gros commun fondu; beurre; pieces dor; estaim; acier rompu; estaim fin,"tartre crud; sublime; orpiment; pieces d’or; lute; arsenic; otnegra; sublimé; grain metallic; aes ustum; luter; sal gemme; suin de verre; rostie au beurre; zedoaire; plomb; borras; fil de fer; estaim de glace; souldure; salpestre; argent; cuivre; limailles; antimoyne; metal fondu; limaille de cuivre fin; luth; sels; luthé; argent fondu; arsenic blanc; letton; terre fiens ou terre bourré, de laquelle les fondeurs d’artiglerie se servent; souldent; verre pilé; lutes; metallique; sel armoniac; soulder; sels sublimés &amp; meslés ensemble; arsenic jaulne; sel gros commun fondu; beurre; estaim; acier rompu; estaim fin","orpiment; grain; lute; latten; solder; ammoniac; sandiver; coarse common salt melted; arsenic; otnegra; aes ustum; steel; earth; salt; butter; zedoary; pestled glass; melted metal; tin; silver; tartar; borax; luted; good buttered toast; saltpeter; filing; gold coin; wire; sublimate; lead; salts, sublimated &amp; mixed together; antimony; metallic; melted silver; copper",les fumees qui sont dangereuses te pourroient nuire; la fumee en est dangereuse,fumées qui sont dangereuses te pourroient nuire; fumée en est dangereuse,"fumes, which are dangerous, could hurt you; fumes of it are dangerou",sols; moictie; ℥; unces; jour naturel; denier; quarte ou cinquiesme partye; heures; aultant que de borras; matin; bon matin; tout un jour,sols; ℥; unces; jour naturel; denier; quarte ou cinquiesme partye; heures; moictié; aultant que de borras; matin; bon matin; tout un jour,as much as borax; ℥; morning; day; ounce; part; denier; in the early morning; hour; sous; for a whole day; half,,,,zedoaire,zedoaire,zedoary,,,,,,,fondeurs dartiglerie; rustique; garson de boutique; ceulx qui travaillent de vaissele &amp; grosserie; orfevres,rustique; garson de boutique; fondeurs d’artiglerie; ceulx qui travaillent de vaissele &amp; grosserie; orfevres,goldsmith; boy; silversmith; rustic; those who work in plate and large ware; founder,,,,luter; tuyle; luth; creuset; serviette; fil de fer; lute; four a vent; crusol; lutes; piles; pile; piler; luthe; fourneau,luter; tuyle; luth; creuset; serviette; luthé; fil de fer; lute; crusol; lutes; piles; four à vent; piler; fourneau; pilé,iron wire; pestled; pestle; lute; cloth; luted; crucible; four à vent; tile; furnace,bon matin; jour naturel; heures; matin; long temps; tout un jour,bon matin; jour naturel; heures; matin; long temps; tout un jour,morning; day; time; in the early morning; hour; for a whole day,artiglerie,artiglerie,artillery,,,,,,,di far correr lotnegra,di far correr l’otnegra,di far correr lotnegra,aes ustum,aes ustum,aes ustum,crusol,crusol,crucible,tourtelle; tourtelles,tourtelle; tourtelles,cake; cakes
124r,124r,124r_1,casting,Animaulx a poil et fleurs foibles et fort tanvres,Animaulx à poil et fleurs foibles et fort tanvres,Animals with hair and fragile and very thin flowers,papillons,papillons,butterfly,,,,,,,dent de lyon,dent de lyon,dandelion,vent,vent,wind,huile de froment; huile,huile de froment; huile,oil,,,,,,,,,,froment; papus; lapasses; dent de lyon,froment; papus; lapasses; dent de lyon,dandelion; burdock; pappu; wheat,,,,,,,,,,,,,,,,,,,,,,,,,,,,,,,,,,,,,,,
124r,124r,124r_2,casting,Noyaulx pour mouler creus,Noyaulx pour mouler creus,Noyaulx for molding hollow,,,,,,,,,,,,,,,,argent; or,argent; or,gold; silver,,,,,,,,,,,,,,,,,,,,,,,,,moule,moule,mold,,,,,,,,,,,,,,,,,,,,,,,,
124r,124r,124r_3,casting,Toile diraignee,Toile d’iraignee,Spider’s web,iraignee; iraigne,iraignee; iraigne,spider,,,,,,,,,,aulx champs,aulx champs,in the field,quarton; papier colle sur le quarton; estaim bien peu allie de plomb; eau,quarton; estaim bien peu allié de plomb; papier collé sur le quarton; eau,"paper; glued; tin, very little alloyed with lead; quarton; water",,,,,,,,,,,,,,,,,,,,,,,,,quarton; papier colle sur le quarton; poincte,quarton; papier collé sur le quarton; poincte,quarton; glued to the quarton; point,,,,,,,,,,,,,,,,,,,,,,,,
124r,124r,124r_4,casting,Or fin,Or fin,Fine gold ,,,,,,,,,,,,,,,,verdet; plomb; or; eau fort; or fin; antimoyne,verdet; plomb; or; eau fort; or fin; antimoyne,verdet; antimony; aquaforti; gold; lead,,,,,,,,,,,,,,,,,,,,,,,,,marteau,marteau,hammer,,,,,,,,,,,,,,,,,,,,,,,,
124v,124v,124v_1,painting;metal process,Esmail Rouge clair,Esmail rouge clair,Rouge clair enamel,,,,,,,pistolet; escu,pistolet; escu,écu; pistolet,,,,,,,esmail; or; esmauls; rouge clair; or fin; esmaulx; grains dor; arene,esmail; or; esmauls; rouge clair; or fin; esmaulx; grains d’or; arene,arene; grain; rouge clair; enamel; gold,,,,,,,,,,,,,,,,,,,orfevres,orfevres,goldsmith,,,,,,,,,,,,,,,,,,,,,,,,,,,,,,
124v,124v,124v_2,casting,Gecter en or,Gecter en or,Casting with gold,,,,,,,,,,,,,,,,esmeraulde; or allie; plomb; or; eau; chaulx diceulx; argent; cire; or fin; estain; terre,esmeraulde; or allié; plomb; or; eau; argent; cire; or fin; estain; chaulx d’iceulx; terre,earth; tin; wax; emerald; silver; lime; lead; water; gold,,,,un quart plus pesant que,un quart plus pesant que,quarter heavier than,,,,,,,,,,,,,orfevres,orfevres,goldsmith,,,,moule; four de reverberation; pot; forge; moules,moule; four de reverberation; pot; forge; moules,mold; furnace; forge; pot,,,,,,,,,,,,,,,,,,,,,,,,
124v,124v,124v_3,casting,Moyen de fayre le gect pour petites lezardes,Moyen de fayre le gect pour petites lezardes,A means to make the gate for small female lizards,serpent; lezardes,serpent; lezardes,snake; lizard,,,,,,,,,,,,,metal; cire; fil de fer; sable,metal; cire; fil de fer; sable,metal; wax; sand; wire,,,,espesseur dun costeau,espesseur d’un costeau,thickness of a knife,,,,,,,,,,,,,,,,,,,fil de fer chault; moule; costeau; bout du fil de fer chault,fil de fer chault; moule; costeau; bout du fil de fer chault,mold; hot iron wire; end of the hot iron wire; knife,,,,,,,,,,,,,,,,,,,,,,,,
125r,125r,125r_1,casting,Plastre,Plastre,Plaster,,,,,,,,,,,,,sur les maisons; pluyes,maisons; pluyes,rain,eau chaulde; eau; huiler; pierre; eau froide; cire; plastre gris transparent nest pas fort mays celuy est bon qui estant destrempe est blanc; sable de noyau; plastre,"eau chaulde; eau; plastre gris transparent n’est pas fort, mays celuy est bon qui estant destrempé est blanc; huiler; pierre; eau froide; cire; sable de noyau; plastre","oil; plaster; wax; stone; sand; water; transparent grey plaster is not strong, but the one that, being tempered, is white",,,,,,,,,,,,,allemaigne,allemaigne,germany,,,,,,,,,,moule; moules de plastre,moule; moules de plastre,mold,long temps,long temps,longer,,,,,,,,,,,,,,,,,,,,,
125r,125r,125r_2,arms and armor;casting,Symeterres,Symeterres,Scimitars,,,,,,,,,,,,,mines; mine,mines; mine,,fer fondu; sable; fer; acier; fer douls,fer fondu; sable; fer; acier; fer douls,iron; melted iron; ore; sand; steel,,,,,,,,,,,,,turcs; hongrie; damas,turcs; hongrie; damas,hungary; damascu; turk,,,,ouvriers,ouvriers,worker,,,,,,,,,,cimeterres; cimeterre; symeterres,cimeterres; cimeterre; symeterres,scimitar,,,,,,,,,,,,,,,,,,
125r,125r,125r_3,tricks and sleight of hand,Ouyr de loing,Ouyr de loing,Hearing from afar,,,,oreille,oreille,ear,,,,,,,,,,,,,,,,,,,,,,,,,,,,,,,,,,ouyr; entendras,ouyr; entendras,hearing; hear,,,,de nuict ou en temps de silence,de nuict ou en temps de silence,at night or at a silent time,,,,,,,,,,,,,,,,,,,,,
125v,125v,125v_1,casting,Viperes et serpens,Viperes et serpens,Vipers and snakes,serpent; serpens; viperes; vipere; chien; cochon; serpents; aspic cornu,serpent; serpens; viperes; vipere; chien; cochon; serpents; aspic cornu,horned asp; snake; dog; viper; pig,,,,,,,,,,,,,,,,,,,,,,,,,,,,,,,,,,,,,,,,,,,,,,,,,,,,,,,,,,,,,,,,,,
125v,125v,125v_2,casting,Mouler tortues,Mouler tortues,Molding turtles,tortues; serpents,tortues; serpents,turtle; snake,,,,,,,,,,,,,sucre; plastre,sucre; plastre,plaster; sugar,,,,,,,,,,,,,,,,,,,,,,,,,,,,,,,,,,,,,,,,,,,,,,,,,,,
125v,125v,125v_3,casting,Plastre pour gect de cire,Plastre pour gect de cire,Plaster for casting of wax,,,,,,,,,,,,,,,,eau chaulde; metal; cire; plastre; albastre,eau chaulde; metal; cire; plastre; albastre,alabaster; plaster; wax; metal; water,,,,,,,,,,,,,,,,,,,,,,,,,moule; moule de plastre,moule; moule de plastre,mold,,,,,,,,,,,,,,,,,,,,,,,,
126r,126r,126r_1,casting,Mouler fruicts en sucre et animaulx,Mouler fruicts en sucre et animaulx,Molding fruits and animals in sugar,,,,,,,,,,,,,,,,cirop; amydon; cire fondue; eau; sucre; eau froide; metal; cire; sucre fondu en eau; amande; sucre fort clarifie; plastre; terre; ardille,cirop; amydon; cire fondue; eau; sucre; eau froide; metal; cire; amande; sucre fondu en eau; sucre fort clarifié; plastre; terre; ardille,earth; syrup; plaster; sugar melted in water; wax; starch; almond; clay; melted wax; metal; sugar; water,,,,nuict; jour; tout un jour et une nuict,nuict; jour; tout un jour et une nuict,night; day,,,,pommes; poires; raisins; raisin; amande; chauches; sauvignons,pommes; grains; grain; poires; raisins; raisin; amande; chauchés; sauvignons,pear; sauvignon; grape; almond; chauchés; apple,,,,,,,,,,,,,moule; moule de plastre; plaste dardille; amande; plaste; moules,plaste d’ardille; moule; moule de plastre; amande; plaste; moules,slab; mold; almond,nuict; saison; jour,nuict; saison; jour,season; night; day,,,,,,,,,,,,,,,,,,,,,
126v,126v,126v_1,casting,Crocum ferri,Crocum ferri,Crocum ferri,,,,,,,sols,sols,sous,,,,,,,rouille de fer; cendres chauldes; or; crocum ferri; crocum; rouille; limaille; vinaigre,rouille de fer; cendres chauldes; or; crocum ferri; crocum; rouille; limaille; vinaigre,ferri; rust; vinegar; filing; crocum; gold; ash,,,,once; sols,once; sols,sous; ounce,,,,,,,,,,,,,,,,,,,moule; moules,moule; moules,mold,,,,,,,,,,,,,,,,crocum ferri; crocum,crocum ferri; crocum,crocum ferri; crocum,,,,,,
126v,126v,126v_2,casting,Plastre,Plastre,Plaster,,,,,,,,,,,,,,,,cire fort chaulde; boys; cire treschaulde; plastre,cire fort chaulde; cire tres chaulde; boys; plastre,plaster; wood; wax,,,,,,,,,,,,,,,,,,,,,,,,,moules,moules; presse,mold; press,,,,,,,,,,,,,,,,,,,,,,,,
126v,126v,126v_3,casting,Herbes difficilles a brusler dans le noyau,Herbes difficilles à brusler dans le noyau,Plants difficult to burn in the noyau,,,,,,,,,,,,,,,,huile de petrol ou de soufre; charbon; chair; crocum; cire; terre; eaulx forts; cendre; os; fer; eaulx de vye; tourmentine; vif argent; sable destrempe; boys; cire fondue; escaille de fer; sable cler; huile de brique; esmeri; os des animaulx; sables,huile de petrol ou de soufre; charbon; chair; crocum; cire; terre; eaulx forts; cendre; os; fer; eaulx de vye; tourmentine; vif argent; sable destrempé; boys; cire fondue; escaille de fer; sable cler; huile de brique; esmeri; os des animaulx; sables,oil; earth; scale; charcoal; wood; sand; turpentine; iron; wax; crocum; eau-de-vie; flesh; bone; melted wax; quicksilver; emery; aquaforti; ash,,,,jours,jours,day,,,,tim; asperge; rosmarin,tim; asperge; rosmarin,thyme; rosemary; asparagu,,,,,,,,,,,,,moules; cercle de terre; moule; molle,moules; cercle de terre; moule; molle,mold; circle,jours,jours,day,,,,,,,,,,,,,crocum,crocum,crocum,,,,,,
127r,127r,127r_1,casting,Moule de plastre pour cire,Moule de plastre pour cire,Molds of plaster for wax,,,,,,,,,,,,,,,,cire; plastre,cire; plastre,plaster; wax,,,,,,,,,,,,,,,,,,,,,,,,,moule; moules; moule de plastre,moule; moules; moule de plastre,mold,,,,,,,,,,,,,,,,,,,,,,,,
127v,127v,127v_1,casting,Terre des fondeurs,Terre des fondeurs,Founders’ earth,,,,,,,,,,,,,,,,lutte; sable; lute; bourre; crocum; luter; os; fil de fer; terre susdicte des fondeurs; argent; fiens; terre bolvene; brique; culs de crusols; eau de vye; lutes; sable destrempe; terre ardille areneuse; terre des fondeurs; cendres; cendre criblee; terre de laquelle les sarruriers se servent pour braser ou soulder; alum; plastre; terre; ardille,lutte; lute; bourre; crocum; luter; os; fil de fer; terre susdicte des fondeurs; argent; fiens; ardille meslée de sable; terre bolvene; terre de laquelle les fondeurs se servent pour braser ou soulder; brique; culs de crusols; eau de vye; sable destrempé; lutes; cendre criblée; terre ardille areneuse; terre des fondeurs; cendres; alum; plastre; terre,lute; bone; crocum; eau-de-vie; dung; clay; ash; earth; crucible bottom; silver; terre bolvene; luted; luting; wire; plaster; brick; alum; sand; cloth waste,,,,,,,,,,,,,bolvene,,,,,,sarruriers; fondeurs,fondeurs,founder,,,,luter; lutte; tuelle; tamisee; fil de fer; souflet; moule; lute; moules; molles; four de reverberation; moles; crampons; lutes; forge; crusols,luter; lutte; tuelle; tamisée; fil de fer; souflet; moule; lute; moules; molles; four de reverberation; moles; crampons; lutes; forge; crusols,sieved; blast-pipe; iron wire; mold; bellow; lute; forge; crucible; clamp; luted; furnace,,,,,,,,,,,,,,,,crocum,crocum,crocum,crusols,crusol,crucible,,,
128r,128r,128r_1,casting,Gecter en argent et or,Gecter en argent et or,Casting in silver and gold,,,,doigts,doigts,finger,realle,realle,real,,,,,,,argent plus fin que la ligue du capital et comme de realle; orpiment; sable; crocum; arsenic; alum de plume; cendre; argent bien fondu; arsenic &amp; deulx foys aultant de tartre crud grossierement pulverises; borras moulu; borras; argent; metal; charbons; argent allie; argent fondu; or et largent fondus; vif argent; metallique; pierrete de borras pulverisee; sable maigre delie; or; metaulx; estain; argent sophistique; acier,pierrete de borras pulverisée; argent plus fin que la ligue du capital et comme de realle; orpiment; sable; argent sophistiqué; crocum; arsenic; alum de plume; cendre; argent bien fondu; borras moulu; borras; argent allié; argent; metal; sable maigre delié; or et l’argent fondus; charbons; argent fondu; vif argent; arsenic &amp; deulx foys aultant de tartre crud grossierement pulverisés; metallique; or; metaulx; estain; acier,"orpiment; crocum; arsenic; steel; ash; feather; tin; metal; silver; silver finer than the alloy from the capital and like that of the real; borax; gold; charcoal; mold; stone; melted silver; quicksilver; gold and silver, melted; sand",,,,deulx foys aultant; bons doigts; grosseur dun pois; grosseur dune noisette,deulx foys aultant; bons doigts; grosseur d’une noisette; grosseur d’un pois,size of a pea; finger; size of a hazelnut; two times as much,,,,noisette; pois,noisette; pois,pea; hazelnut,capital,capital,capital,,,,orfevres,orfevres,goldsmith,,,,tuelle; molletes; mollettes; moule; vaisseau; terrine; molles; moules; moule bien rouge; crusol; cruset; molettes; four; forge; souflet; petit souflet,tuelle; molletes; mollettes; moule; vaisseau; terrine; molles; moules; moule bien rouge; crusol; cruset; molettes; four; forge; souflet; petit souflet,blast-pipe; mold; vessel; bellow; forge; terrine; metal; crucible; furnace; pincer,,,,,,,,,,,,,,,,crocum,crocum,crocum,crusol,crusol,crucible,,,
128v,128v,128v_1,casting;metal process,Blanchiment de largent gecte,Blanchiment de l’argent gecté,Whitening of cast silver,lesard; petit lesard,lesard; petit lesard,lizard,,,,teston,teston,teston,,,,,,,sel; argent bas; commun bullitoyre; ligue de teston; sel commun; eau de tartre; tartre; argent; cuivre; papier; tartre brusle; charbons; bas argent; fuma; sel commun pulverise; or; eau; eau claire; bullitoyre; eau commune; tarte; eau du bullitoyre,sel; argent bas; commun bullitoyre; ligue de teston; sel commun; eau de tartre; tartre; argent; sel commun pulverisé; cuivre; papier; charbons; bas argent; fuma; tartre bruslé; or; eau; eau claire; bullitoyre; eau commune; tarte; eau du bullitoyre,charcoal; alloy of teston; salt; smoked; paper; bullitoyre; copper; burned tartar; silver; tartar; water; gold,,,,presque autant dun que daultre,presque autant d’un que d’aultre,nearly as much of one as the other,,,,,,,allemands; allemand; france,allemands; allemand; france,france; german,,,,orfevres,orfevres,goldsmith,,,,grattebroissa; vaisseau; crusol; papier; forge,grattebroissa; vaisseau; crusol; papier; forge,paper; brushed; vessel; crucible; forge,,,,,,,,,,,,,,,,,,,crusol,crusol,crucible,,,
129r,129r,129r_1,painting,Paindre herbes de metal,Paindre herbes de metal,Painting plants of metal,,,,,,,,,,,,,,,,gomme; pelure de figuier; metal; glaire; huile,gomme; pelure de figuier; metal; glaire; huile,oil; peelings of the fig tree; metal; gum; glair,,,,,,,,,,figuier,figuier,tree,,,,,,,,,,,,,,,,long,long,time,,,,,,,,,,,,,,,,,,,,,
129r,129r,129r_2,painting,Pour santonique,Pour santonique,For wormseed,,,,,,,,,,,,,,,,ceruse; vert de terre; massicot; scudegrun; cendre dazur; blanc de plomb,ceruse; vert de terre; cendré d’azur; massicot; scudegrun; blanc de plomb,ceruse; stil de grain yellow; vert de terre; cendré of azure; massicot; lead,,,,,,,,,,santonique,santonique,wormseed,,,,,,,,,,,,,,,,,,,,,,,,,,,,,,,,,,,,,,,
129r,129r,129r_3,casting,Couleur de vipere,Couleur de vipere,Viper color,serpent; lesard; vipere,serpent; lesard; vipere,viper color; snake; lizard,,,,,,,,,,,,,soufre; verdegris; plomb; estein; argent; metalline; estain; bon vinaigre; linge rude,soufre; verdegris; plomb; estein; argent; metalline; estain; bon vinaigre; linge rude,vinegar; tin; verdigri; sulfur; silver; metalline; linen; lead,,,,demy balle dharquebus,demy balle d’harquebus,ball,,,,,,,,,,,,,,,,,,,linge rude,linge rude,linen,,,,harquebus,harquebus,arquebus,,,,,,,,,,,,,,,,,,
129r,129r,129r_4,casting,Roses moulees,Roses moulées,Molded roses,mouches,mouches,fly,,,,,,,,,,,,,huile de froment; sable destrempe,huile de froment; sable destrempé,oil; sand,,,,,,,,,,froment; caprier; pensees; roses,froment; caprier; pensées; roses,caper plant; pansy; rose; wheat,,,,,,,,,,,,,,,,,,,,,,,,,,,,,,,,,,,,,,,
129v,129v,129v_1,preserving;decorative;casting,Animaulx seiches au four de longue duree,Animaulx seichés au four de longue durée,Animals dried in the oven for a long time,serpents; oyseaulx,serpents; oyseaulx,bird; snake,,,,,,,,,,soleil de juin,soleil de juin,sun,fil de fer; pain; terre; sable,fil de fer; pain; terre; sable,iron; earth; sand; bread,,,,un jour &amp; une nuict; apres que le pain est tire; comme la chaleur du soleil de juin; asses chault comme quand on en tire le pain,"un jour &amp; une nuict; comme la chaleur du soleil de juin; assés chault, comme quand on en tire le pain; aprés que le pain est tiré","like the heat of the sun in june; after the bread has been taken out; hot enough, like when one takes out the bread; day",,,,,,,,,,,,,,,,puant,puant,smelly,pinceau; plastre de terre; poinctes de fil de fer; four; broisse,pinceau; plastre de terre; poinctes de fil de fer; le four; four; broisse,brush; paintbrush; oven; slab; point,un jour &amp; une nuict; de longue duree; juin,un jour &amp; une nuict; de longue durée; juin,day; june; time,,,,,,,,,,,,,,,,,,,,,
129v,129v,129v_2,casting,Animaulx gectes en cuivre,Animaulx gectés en cuivre,Animals cast in copper,,,,,,,,,,,,,,,,foeilles de pierrerie; cuivre,foeilles de pierrerie; cuivre,copper; foil,,,,,,,,,,,,,,,,,,,,,,,,,,,,,,,,,,,,,,,,,,,,,,,,,,,
129v,129v,129v_3,casting,Advis sur le gect,Advis sur le gect,Advice concerning the gate,,,,doigts,doigts,finger,,,,,,,,,,metal,metal,metal,,,,,,,,,,,,,,,,,,,,,,,,,,,,,,,,,,,,,,,,,,,,,,,,,,,
