folio,folio_display,div_id,categories,heading_tc,heading_tcn,heading_tl,al_tc,al_tcn,al_tl,bp_tc,bp_tcn,bp_tl,cn_tc,cn_tcn,cn_tl,df_tc,df_tcn,df_tl,env_tc,env_tcn,env_tl,m_tc,m_tcn,m_tl,md_tc,md_tcn,md_tl,ms_tc,ms_tcn,ms_tl,mu_tc,mu_tcn,mu_tl,pa_tc,pa_tcn,pa_tl,pl_tc,pl_tcn,pl_tl,pn_tc,pn_tcn,pn_tl,pro_tc,pro_tcn,pro_tl,sn_tc,sn_tcn,sn_tl,tl_tc,tl_tcn,tl_tl,tmp_tc,tmp_tcn,tmp_tl,wp_tc,wp_tcn,wp_tl,de_tc,de_tcn,de_tl,el_tc,el_tcn,el_tl,it_tc,it_tcn,it_tl,la_tc,la_tcn,la_tl,oc_tc,oc_tcn,oc_tl,po_tc,po_tcn,po_tl
077r,77r,077r_2,medicine,Medecine des orientaulx contre toutes maladies,Medecine des orientaulx contre toutes maladies, Medicine of the orientals against all maladies,,,,nes; teste; bouche,nes; teste; bouche,nose; head; mouth,,,,,,,,,,rosmarin; charbon allume; pouldre; fumee,rosmarin; fumée; pouldre; charbon allumé,smoke; rosemary; powder; charcoal,contre morfondiments; rheumes; contre toutes maladies; purger la teste; aultres malladies,contre morfondiments; rheumes; contre toutes maladies; purger la teste; aultres malladies,against cold; other malady; against all malady; rheum; purge the head,,,,,,,rosmarin,rosmarin,rosemary,orientaulx,orientaulx,oriental,,,,,,,,,,godet,godet,bowl,au moys de may,au moys de may,in the month of may,,,,,,,,,,,,,,,,,,,,,
077r,77r,077r_3,casting,Terre graisse,Terre graisse,Fatty earth,,,,,,,,,,,,,a lombre,à l’ombre,in the shade,terre graisse,terre graisse,earth,,,,,,,,,,,,,,,,,,,fondeurs,fondeurs,founder,,,,,,,long temps,long temps,time,,,,,,,,,,,,,,,,,,,,,
077r,77r,077r_4,varnish,Recepte pour faire bronze et vernys de plusieurs sortes, Recepte pour faire bronze et vernys de plusieurs sortes,Recipe for making bronze and varnish of many sorts,,,,,,,,,,,,,,,,eaue claire; eau de vye; betjoin; cartes; vernys; bronze; verre; vetjoin aussi grossement pille; eau; pappier; pappiers,eaue claire; eau de vye; betjoin; cartes; vernys; bronze; verre; eau; pappier; pappiers; vetjoin aussi grossement pillé,paper; glass; bronze; card; benzoin; eau-de-vie; varnish; water,,,,once; lespace dung jour; onces,jour; once; onces,ounce; day,,,,,,,,,,,,,,,,,,,mortier; pinceau; pille; fiolle de verre; fiolle,pillé; mortier; pinceau; fiolle de verre; fiolle,pestled; vial; mortar; paintbrush,jour,jour,day,,,,,,,,,,,,,,,,,,,,,
077v,77v,077v_1,varnish,Aultre vernys aprouve,Aultre vernys aprouvé,Another approved varnish,,,,,,,,,,,,,,,,huille de lin; vernys; alung de glace; drogues; huille petrolle; verny; masticq; terre; cendres; copperoze blanche,huille de lin; vernys; alung de glace; drogues; huille petrolle; verny; masticq; terre; cendres; copperoze blanche,glass; ash; drug; mastic; oil; varnish; coppera; earthen,,,,onces,onces,ounce,,,,lin,lin,linseed,,,,,,,,,,,,,pot de terre,pot de terre,pot,,,,,,,,,,,,,,,,,,,,,,,,
077v,77v,077v_2,varnish,Aultre verny,Aultre verny,Another varnish,,,,,,,,,,,,,,,,huille petrolle; verny; cendres; copperoze; huille daspic,huille petrolle; verny; cendres; huille d’aspic; copperoze,varnish; oil; coppera; ash,,,,,,,,,,aspic,aspic,spike lavender,,,,,,,,,,,,,,,,,,,,,,,,,,,,,,,,,,,,,,,
077v,77v,077v_3,varnish,Aultre verny,Aultre verny,Another varnish,,,,,,,,,,,,,,,,sang de raiye da rac; drogues; verny; terre; drappeau; huille daspic,sang de raiye da rac; drogues; verny; terre; huille d’aspic; drappeau,sang de raiye da rac; drug; oil; cloth; varnish; earthen,,,,once,once,ounce,,,,aspic,aspic,spike lavender,,,,,,,,,,,,,pot de terre; drappeau,pot de terre; drappeau,cloth; pot,,,,,,,,,,,,,,,,,,,,,,,,
078r,78r,078r_1,varnish,Aultre verny,Aultre verny,Another varnish,,,,,,,,,,,,,,,,verre; charbons; sang dea raiec; colle bien clere; verny; huille daspic,verre; charbons; sang dea raiec; colle bien clere; verny; huille d’aspic,glass; charcoal; sang dea raiec; oil; glue; varnish,,,,once; demye once,once; demye once,ounce,,,,aspic,aspic,spike lavender,,,,,,,,,,,,,pinceau; baston; fiolle de verre,pinceau; baston; fiolle de verre,vial; paintbrush; stick,,,,,,,,,,,,,,,,,,,,,,,,
078r,78r,078r_2,varnish,Pour faire verny Rouge,Pour faire verny rouge,For making red varnish,,,,,,,,,,,,,,,,eau; verny; eau de goume; erny rouge; vermilhon,eau; verny rouge; verny; eau de goume; vermilhon,vermilion; water; varnish,,,,,,,,,,,,,,,,,,,,,,,,,,,,,,,,,,,,,,,,,,,,,,,,,,,
078r,78r,078r_3,wood and its coloring,Pour faire trbois verd,Pour faire trbois verd,For making green trwood,cheval,cheval,horse,,,,,,,,,,,,,eau de pluye; boys; sel; fian de cheval; vinaigre bien fort; verd de grys; terre; trbois,eau de pluye; boys; sel; fian de cheval; vinaigre bien fort; verd de grys; terre; trbois,verdigri; wood; vinegar; dung; trwood; rainwater; salt; earthen,,,,jours,jours,day,,,,,,,,,,,,,,,,,,,vaisseau de terre,vaisseau de terre,vessel,jours,jours,day,,,,,,,,,,,,,,,,,,,,,
078v,78v,078v_1,metal process;wood and its coloring,Pour faire bronze en couleur dassier,Pour faire bronze en couleur d’assier,For making bronze in the color of steel,chien; loup,chien; loup,wolf; dog,,,,,,,,,,,,,enthimoyne; alung; fer; bronze; alung de glace; marbre; anthimoyne; eau de gomme,enthimoyne; fer; marbre; bronze; alung de glace; anthimoyne; eau de gomme,glass; bronze; antimony; marble; iron; water,,,,deux foys aultant,deux foys aultant,twice as much,,,,,,,,,,,,,,,,,,,pinceau; mortier de fer; dan de loup ou de chien; marbre,pinceau; mortier de fer; dan de loup ou de chien; marbre,tooth; marble; mortar; paintbrush,,,,,,,,,,,,,,,,,,,,,,,,
078v,78v,078v_2,varnish,Pour faire bronze en Couleur dor,Pour faire bronze en couleur d’or,For making bronze in the color of gold,chien; loup,chien; loup,wolf; dog,,,,,,,,,,,,,alung; goume; bronze; ocre; limailhe de cuyvre; pierre,alung; goume; bronze; ocre; limailhe de cuyvre; pierre,ocher; alum; gum; filing; bronze; stone,,,,,,,,,,,,,,,,,,,,,,,,,pinceau; mortier de pierre; dan de loup ou de chien,pinceau; mortier de pierre; dan de loup ou de chien,mortar; tooth; paintbrush,,,,,,,,,,,,,,,,,,,,,,,,
078v,78v,078v_3,wood and its coloring,Pour faire Os ou corne verd,Pour faire os ou corne verd,For making bone or horn green,,,,,,,,,,,,,,,,corne; verd de gris; fort vinaigre; os,corne; verd de gris; fort vinaigre; os,verdigri; vinegar; bone; horn,,,,heure,heure,hour,,,,,,,,,,,,,,,,,,,,,,heure,heure,hour,,,,,,,,,,,,,,,,,,,,,
078v,78v,078v_4,metal process;wood and its coloring,Pour faire bronze,Pour faire bronze,For making bronze,chien; loup,chien; loup,wolf; dog,,,,,,,,,,,,,eau; marbre; bronze; colle bien clere; colle bien claire; limailhe despaingle; leton,limailhe d’espaingle; eau; marbre; bronze; colle bien clere; colle bien claire; leton,filing; bronze; latten; marble; glue; water,,,,,,,,,,,,,,,,,,,,,,,,,dan de loup ou de chien; vaisseau; marbre,dan de loup ou de chien; vaisseau; marbre,tooth; marble; vessel,,,,,,,,,,,,,,,,,,,,,,,,
079r,79r,079r_1,wood and its coloring,Pour faire boys Gris,Pour faire boys gris,Making gray wood,,,,,,,,,,,,,,,,boys; alung; alung de glace; coperose; limaille de fer; moullee du grais; feraille; du noyr de courroieur,boys; noyr de courroieur; alung; alung de glace; coperose; limaille de fer; feraille; moullée du grais,currier’s’ black; wood; alum; powder; glass; filing; ironware; coppera,,,,,,,,,,,,,,,,,,,courroieur,courroieur,currier,,,,,,,,,,,,,,,,,,,,,,,,,,,,,,
079r,79r,079r_2,medicine,Pour faire Eau pour le mal des yeux,Pour faire eau pour le mal des yeux,For making water for disease of the eyes,,,,yeux; doigt,yeux; doigt,finger; eye,,,,,,,,,,eau de fontayne; verre; coupperose blanche; eau pour le mal des yeux,eau de fontayne; verre; coupperose blanche; eau pour le mal des yeux,glass; water; coppera,vous vous en trouveres fort bien; eau pour le mal des yeux,vous vous en trouverés fort bien; eau pour le mal des yeux,water for disease of the eye; you will find yourself very well from it,,,,,,,,,,,,,dieu,dieu,god,,,,,,,verre bien nect; drappeau blanc; drappeau; doigt,verre bien nect; drappeau blanc; drappeau; doigt,cloth; finger; glass,a toute heure,à toute heure,at any hour,,,,,,,,,,,,,,,,,,,,,
079r,79r,079r_3,metal process;wood and its coloring,Pour faire bronze en coulleur dor,Pour faire bronze en coulleur d’or,For making bronze in the color of gold,,,,,,,,,,,,,,,,souffre vif; sel armoniac; bronze; drogues; estaing cacides; terre; estaing; cendres; argent vif,souffre vif; sel armoniac; bronze; drogues; estaing calcinés; terre; estaing; cendres; argent vif,bronze; ash; drug; sulfur; calcined tin; ammoniac; quicksilver; tin; earthen,gardes que la fumee ne vous face mal car est maulvaix,gardés que la fumée ne vous face mal car est maulvaix,mind that the fumes do not harm you for they are bad,heures; onces,heures; onces,ounce; hour,,,,,,,,,,,,,,,,,,,pot de terre; pilles; mortier; cuilliere,pillés; mortier; pot de terre; cuilliere,mortar; spoon; pot; pestle,heures,heures,hour,,,,,,,,,,,,,,,,,,,,,
079v,79v,079v_1,varnish,Pour faire verny,Pour faire verny,For making varnish,,,,,,,,,,,,,,,,gomme arabic; colle bien clere; verny; masticq; sang darage darac; huille daspic,gomme arabic; colle bien clere; verny; masticq; sang darage darac; huille d’aspic,glue quite clear; arabic; mastic; sang darage darac; oil; varnish,,,,,,,,,,aspic,aspic,spike lavender,,,,,,,,,,,,,,,,,,,,,,,,,,,,,,,,,,,,,,,
079v,79v,079v_2,medicine,Contrepoison contre la fumee des metaulx, Contrepoison contre la fumée des metaulx,Antidote against the fumes of metals,porc,porc,pig,visage,visage,face,,,,,,,,,,antimoine; aultre vapeur; rostie au boeurre; vessie de porc,antimoine; aultre vapeur; rostie au boeurre; vessie de porc,toast with butter; pig’s bladder; antimony; any other vapor,contrepoison contre la fumee des metaulx; lantimoine ne aultre vapeur ne te pourra nuire,l’antimoine ne aultre vapeur ne te pourra nuire; contrepoison contre la fumée des metaulx,antidote; neither antimony nor any other vapor will be able to harm you,demy,demy,half,,,,,,,,,,,,,,,,,,,,,,matin,matin,in the morning,,,,,,,,,,,,,,,,,,,,,
079v,79v,079v_3,casting,Estaim pour gect,Estaim pour gect,Tin for casting,,,,,,,,,,,,,,,,plomb fin; estaim; estain fin; estain; estain commun,plomb fin; estaim; estain fin; estain; estain commun,tin; lead,,,,quintal; lb,quintal; lb,quintal; lb,,,,,,,,,,,,,pintiers,pintiers,pewterer,,,,,,,,,,,,,,,,,,,,,,,,,,,,,,
079v,79v,079v_4,printing,Mixture pour les imprimeurs,Mixture pour les imprimeurs,Mixture for printers,,,,,,,,,,,,,,,,letton; plomb; vielles escailles ou lames de fer; antimoine pulverise; testes de cloux de fer; estain,letton; plomb; vielles escailles ou lames de fer; testes de cloux de fer; estain; antimoine pulverisé,lead; latten; antimony; iron nail head; old scrapings or thin plates of iron; tin,,,,,,,,,,,,,,,,,,,imprimeurs,imprimeurs,printer,,,,crusol; four a vent,crusol; four à vent,crucible; four à vent,,,,,,,,,,,,,,,,,,,crusol,crusol,crucible,,,
080r,80r,080r_1,arms and armor,Mortier,Mortier,Petard,,,,,,,,,,,,,au pied dune muraille,au pied d’une muraille,at the foot of a wall,fin cuivre; pouldre,fin cuivre; pouldre,powder; copper,,,,lb,lb,lb,,,,,,,,,,,,,,,,,,,birons; barricot renforce,barricot renforcé; birons,firkin; gimlet,,,,,,,,,,,,,,,,,,,birons,birons,gimlets,,,
080r,80r,080r_2,stones,Stuc blanc fort dur,Stuc blanc fort dur,Very hard white stucco,,,,,,,,,,,,,,,,stuc; coquille doeuf; ceruse; tormentine de venise; cire blanche,stuc; coquille d’oeuf; ceruse; tormentine de venise; cire blanche,stucco; ceruse; turpentine; eggshell; wax,,,,,,,,,,,,,venise,venise,venice,,,,,,,,,,,,,,,,,,,,,,,,,,,,,,,,,,,,
080r,80r,080r_3,tool;household and daily life,Fontaines,Fontaines,Fountains,,,,,,,,,,,,,,,,eau,eau,water,,,,deulx fois plus longue que le tuyau montant; aussy longue,deulx fois plus longue que le tuyau montant; aussy longue,twice as long as the ascending pipe; as long a,,,,,,,,,,,,,,,,,,,cornet; tuyau,cornet; tuyau,cornet; pipe,,,,,,,,,,,,,,,,,,,,,,,,
080v,80v,080v_1,casting,Fondeurs de menus ouvrages destaim,Fondeurs de menus ouvrages  d’estaim,Founders of small works  of tin,huistres,huistres,oyster,doigt,doigt,finger,,,,,,,grandes escailles vers les montaignes,grandes escailles vers les montaignes,great flakes near the mountain,estain de glas; pierres dequoy se font les coulx ou filieres des barbiers; estaim fin &amp; doulx; pierres; suif; estaim; subtile pouldre de chaulx vive; linge; liege; plomb; estaing; estain doulx; vinaigre distille; souldure; ardoise; ferremens; coquilles dhuistres calcinees; carton,estain de glas; pierres; estaim fin &amp; doulx; ferremens; suif; estaim; subtile pouldre de chaulx vive; linge; liege; plomb; estaing; vinaigre distillé; estain doulx; coquilles d’huistres calcinées; souldure; ardoise; pierres de quoy se font les coulx ou filieres des barbiers; carton,solder; cork; lead; powder; shell; stone; vinegar; slate; fine &amp; soft tin; tallow; iron fitting; stones of which are made the sharpening stones or files of barber; linen; tin; carton,,,,doigt,doigt,finger,,,,,,,,,,,,,fondeurs de menus ouvrages destaim; barbiers,fondeurs de menus ouvrages  d’estaim; barbiers,founder; barber,,,,compas; chevilles; linge; foret; chassis; moule; un peu de liege; moules; carton; table soit bien unye,compas; chevilles; linge; foret; chassis; moule; un peu de liege; moules; carton; table soit bien unye,frame; a bit of cork; peg; mold; compass; borer; linen; carton; table is quite even,,,,,,,,,,,,,,,,,,,,,,,,
081r,81r,081r_1,casting,Sable,Sable,Sand,,,,,,,,,,,,,au costau,au costau,on the little hill,plomb; suif; estaim; linge; metal; sable; cuivre; crasse; paille; mercure arreste,plomb; suif; estaim; linge; mercure arresté; metal; sable; cuivre; crasse; paille,filth; lead; mercury; metal; sand; tallow; straw; copper; linen; tin; moistened sand,,,,,,,,,,,,,puy david; thoulouse,puy david; thoulouse,puy david; thoulouse,,,,,,,,,,chassis; linge fort subtil,chassis; linge fort subtil,frame; linen,,,,,,,,,,,,,,,,,,,,,,,,
081r,81r,081r_2,casting,Terre a mouler,Terre à mouler,Earth for molding,,,,,,,,,,,,,,,,plastre; plomb; terre a gainiers ou celle dont les potiers font un blanchiment sur les pots; terre; soufre,plastre; plomb; terre à gainiers ou celle dont les potiers font un blanchiment sur les pots; terre; soufre,plaster; sulfur; earth; lead,,,,,,,,,,,,,fosseret; ox,fosseret; ox,fosseret; ox,,,,potiers; gainiers,potiers; gainiers,tanner; potter,,,,,,,,,,,,,,,,,,,,,,,,,,,,,,
081r,81r,081r_3,casting,Plastre,Plastre,Plaster,,,,,,,,,,,,,,,,plastre; eau; fer; metal; terre; colle,plastre; eau; fer; metal; terre; colle,metal; plaster; iron; glue; earth; water,,,,,,,,,,,,,,,,,,,,,,,,,moule; cassolle de fer ou metal; verge de fer,moule; cassolle de fer ou metal; verge de fer,mold; rod; pot,,,,,,,,,,,,,,,,,,,,,,,,
081r,81r,081r_4,casting,Carton,Carton,Carton,,,,,,,,,,,,,,,,toile; eau; linge; colle; colle forte; papier de florence; carton,toile; eau; linge; colle; colle forte; papier de florence; carton,paper; water; glue; cloth; linen; carton,,,,,,,,,,,,,florence,florence,florence,,,,,,,sente,sente,smell,piler; dent; linge,piler; dent; linge,tooth; linen; pestle,tous les jours,tous les jours,day,,,,,,,,,,,,,,,,,,,,,
081v,81v,081v_1,casting,Sable,Sable,Sand,,,,urine,urine,urine,,,,,,,,,,brique; plomb; urine; sable; cuivre; brique blanchastre,brique; plomb; urine; sable; cuivre; brique blanchastre,urine; lead; brick; sand; copper,,,,,,,,,,,,,,,,,,,,,,,,,,,,,,,,,,,,,,,,,,,,,,,,,,,
081v,81v,081v_2,casting,Fayre courre le cuivre et letton,Fayre courre le cuivre et letton,Making copper and latten run,,,,,,,,,,,,,,,,letton; sel armoniac; ardides; salpestre; metal; fer; sable; cuivre; crasse; luth,letton; sel armoniac; ardides; salpestre; metal; fer; sable; cuivre; crasse; luth,ardide; filth; lute; saltpeter; latten; metal; sand; copper; ammoniac; iron,,,,,,,,,,,,,,,,,,,,,,,,,chassis; luth,chassis; luth,frame; lute,,,,,,,,,,,,,,,,,,,,,,,,
081v,81v,081v_3,casting,Sable,Sable,Sand,,,,,,,,,,,,,riviere,riviere,river,plomb; terre ardille dequoy on faict les tuiles; metal; sable; caillous noirs de riviere calcines; glaire; sable pour le b plomb; laitton; charbon de saule,plomb; caillous noirs de riviere calcinés; metal; sable; glaire; sable pour le b plomb; laitton; charbon de saule; terre ardille de quoy on faict les tuiles,calcined black pebbles from the river; lead; charcoal; latten; metal; sand; earth; glair,,,,,,,,,,saule,saule,willow,,,,,,,,,,,,,manche,manche,sleeve,,,,,,,,,,,,,,,,,,,,,,,,
081v,81v,081v_4,casting,Gect de chassis,Gect de chassis,Frame casting,,,,,,,,,,,,,,,,bois de buy; letton; plomb; lute; fer; metal; sable; cuivre; plomb noir de saulmon,bois de buy; letton; plomb; lute; fer; metal; sable; cuivre; plomb noir de saulmon,lead; lute; latten; metal; boxwood; sand; copper; iron,,,,,,,,,,buy,buy,boxwood,,,,,,,,,,,,,chassis; moule; lute,chassis; moule; lute,frame; mold; lute,,,,,,,,,,,,,,,,,,,,,,,,
082r,82r,082r_1,casting,Chaleur de cuivre,Chaleur de cuivre, Heat of copper,,,,,,,,,,,,,,,,crasse; cuivre,crasse; cuivre,filth; copper,,,,,,,,,,,,,,,,,,,,,,,,,,,,,,,,,,,,,,,,,,,,,,,,,,,
082r,82r,082r_2,casting,Chassis,Chassis,Frame,,,,,,,,,,,,,,,,brique; boys; fer; metal; cuivre; bois,brique; boys; fer; metal; cuivre; bois,wood; metal; brick; copper; iron,,,,,,,,,,,,,,,,,,,,,,,,,chassis; moule,chassis; moule,frame; mold,,,,,,,,,,,,,,,,,,,,,,,,
082r,82r,082r_3,casting,Glaire doeufs,Glaire d’oeufs,Glair of eggs,,,,,,,,,,,,,,,,glaire doeufs; sable,sable; glaire d’oeufs,sand; glair,,,,,,,,,,,,,,,,,,,,,,,,,,,,,,,,,,,,,,,,,,,,,,,,,,,
082r,82r,082r_4,tool,Horlogeurs,Horlogeurs,Clockmakers,,,,,,,,,,,,,,,,letton,letton,latten,,,,si petites distances comme celles des petites roues; troisiesme partie en tant de distances quil est necessaires en esgard a la totale division du cercle; esgalles distances,troisiesme partie en tant de distances qu’il est necessaires en esgard à la totale division du cercle; si petites distances comme celles des petites roues; esgalles distances,part; distances as small as those of the small cogwheel; equal distance,,,,,,,,,,,,,horlogeurs,horlogeurs,clockmaker,,,,pointe; compasser; compas,pointe; compasser; compas,compass; point,,,,,,,,,,,,,,,,,,,,,,,,
082v,82v,082v_1,tool,Horlogeurs,Horlogeurs,Clockmakers,,,,,,,,,,,,,,,,plomb fondu,plomb fondu,lead,,,,,,,,,,,,,,,,,,,horlogeurs,horlogeurs,clockmaker,,,,,,,aujourdhuy; ancienement,ancienement; aujourd’huy,in the past; today,,,,,,,,,,,,,,,,,,,,,
082v,82v,082v_2,casting,Gecter plomb en plomb,Gecter plomb en plomb,Casting lead in lead,,,,,,,,,,,,,,,,noir de chandelle; estaing; plomb; fumer,noir de chandelle; estaing; plomb; fumer,smoke; lead; black; tin,,,,,,,,,,,,,,,,,,,,,,,,,chandelle; moule de plomb,chandelle; moule de plomb,mold; candle,,,,,,,,,,,,,,,,,,,,,,,,
082v,82v,082v_3,casting,Sable,Sable,Sand,,,,,,,,,,,,,,,,sable,sable,,,,,,,,,,,,,,,,,,,,,,,,,,,,,,,,,,,,,,,,,,,,,,,,,,,,
082v,82v,082v_4,casting,Forme de gecter en bronze,Forme de gecter en bronze,Method of casting in bronze,,,,,,,,,,,,,,,,fer; bronze; luter; cuivre; letton fin; bourras; charbon; laitton de potin; laitton fin de cassole; fume; cuivre rouge,fer; bronze; luter; cuivre; letton fin; bourras; charbon; laitton de potin; laitton fin de cassole; fume; cuivre rouge,wood; wool; charcoal; lute; bronze; latten; smoke; copper; iron,,,,moictie,moictié,half,,,,,,,,,,,,,fondeurs,fondeurs,founder,,,,creuset; forge; souflets; crusol; luter; platte de fer; baston; grille; cruset,creuset; forge; souflets; crusol; creusset; luter; platte de fer; baston; grille; cruset,forge; lute; crucible; stick; bellow; grate; slab,,,,,,,,,,,,,,,,,,,crusol,crusol,crucible,,,
083r,83r,083r_1,casting,Sable pour le plomb,Sable pour le plomb,Sand for lead,,,,,,,,,,,,,,,,farine; suye grise des sarruriers; suye grise du fourneau des argentiers; chaulx vive; sable pour le plomb,plomb; farine; suye grise des sarruriers; suye grise du fourneau des argentiers; chaulx vive; sable,soot; lime; flour; sand,,,,ana,ana,ana,,,,,,,,,,,,,argentiers; sarruriers,argentiers; sarruriers,locksmith; silversmith,,,,forge,forge,forge,,,,,,,,,,,,,,,,ana; ℞,ana; ℞,ana; ℞,,,,,,
083r,83r,083r_2,casting,Sable pour medailles de cuivre,Sable pour medailles de cuivre,Sand for copper medals,,,,,,,,,,,,,,,,sables pulverises et subtilies bien fort sur le porphire; plastre; feultre brusle; feultre de chappeau brusle; feultre; sable; os brusle; cuivre; eau sel; os; paille; mache de fer,feultre bruslé; porphire; feultre de chappeau bruslé; plastre; os bruslé; feultre; sable pour medailles de cuivre; eau sel; sables; os; paille; mache de fer,saltwater; porphyry; bone; sand; felt; plaster; dross of iron; straw; iron dross,,,,,,,,,,,,,,,,,,,,,,,,,pile; porphire,porphire; pilé,pestled; porphyry,,,,,,,,,,,,,,,,℞,℞,℞,,,,,,
083r,83r,083r_3,casting,Aultre sable,Aultre sable,Another sand,,,,,,,,,,,,,,,,glaire doeufs bien battue; sable; terre argille; charbon de sarment; vinaigre,glaire d’oeufs bien battue; sable; terre argille; charbon de sarment; vinaigre,charcoal; vinegar; sand; earth; glair,,,,,,,,,,sarment,sarment,vine,,,,,,,,,,,,,tamisee; four,tamisée; four,furnace; sieved,,,,,,,,,,,,,,,,,,,,,,,,
083r,83r,083r_4,casting,Aultre pour le plomb,Aultre pour le plomb,Another for lead,,,,,,,,,,,,,,,,pierre ponce calcinee; vernis; plomb; ardoise subtillement pillee,pierre ponce calcinée; plomb; ardoise subtillement pillée; vernis,finely pestled slate; varnish; lead; stone,,,,,,,,,,,,,,,,,,,,,,,,,pillee; pot,pillée; pot,pestled; pot,,,,,,,,,,,,,,,,℞,℞,℞,,,,,,
083r,83r,083r_5,casting,Aultre,Aultre,Another,cheval,cheval,horse,,,,,,,,,,,,,papier de trasse brusle; fiente de cheval bruslee; glaire doeuf; papier de trasse noir brusle; tuile peu cuitte broyee; vin blanc; charbon,"papier de trasse noir bruslé; fiente de cheval bruslée; papier de trasse bruslé; glaire d’oeuf; vin blanc; charbon; tuile peu cuitte, broyée",paper; charcoal; dung; tile; wine; tracing paper burnt; glair,,,,,,,,,,,,,,,,,,,,,,,,,,,,,,,,,,,,,,,,,,,℞,℞,℞,,,,,,
083r,83r,083r_6,casting,Sable excellent,Sable excellent,Excellent sand,,,,,,,,,,,,,cave; lieu humide,cave; lieu humide,cellar; damp place,sel armoniac; albastre; metal; sable; albastre calcine; charbon,sable excellent; sel armoniac; albastre; metal; sable; albastre calciné; charbon,charcoal; alabaster calcined; metal; sand; alabaster; ammoniac,,,,lb; ℥,lb; ℥,lb; ℥,,,,,,,,,,,,,,,,,,,crusol; double tamis; moule,crusol; double tamis; moule,crucible; mold; sieve,,,,,,,,,,,,,,,,,,,crusol,crusol,crucible,,,
083v,83v,083v_1,casting,Forme de mouler excellente avecq eau,Forme de mouler excellente avecq eau,A way for molding excellently with water,,,,,,,,,,,,,en lieu humide,en lieu humide,damp place,eau; couperoses; axunge de verre; vitriol; cendres,eau; couperoses; axunge de verre; vitriol; cendres,sandiver; vitriol; ash; water; coppera,,,,,,,,,,,,,,,,,,,,,,,,,,,,,,,,,,,,,,,,,,,,,,,,,,,
083v,83v,083v_2,casting,Mouler de relief dune part et creux de laultre, Mouler de relief d’une part et creux de l’aultre, Molding in relief on one part and hollow on the other,,,,mains,mains,hand,,,,,,,,,,letton; sable grossier; vin; metal; sable; cuivre; crasse; charbon de saule; ordure; sable doulx &amp; subtil; vinaigre,letton; sable grossier; vin; metal; sable; cuivre; crasse; charbon de saule; ordure; sable doulx &amp; subtil; vinaigre,grime; filth; charcoal; latten; metal; vinegar; sand; wine; copper,,,,,,,,,,saule,saule,willow,,,,,,,,,,,,,presse; chassis; mains; chevilles,presse; chassis; mains; chevilles,frame; peg; press; hand,,,,,,,,,,,,,,,,,,,,,,,,
083v,83v,083v_3,tool;metal process,Souflets,Souflets,Bellows,,,,,,,,,,,,,en lieu aire; vent,vent; en lieu airé,wind; aerated place,charbon,charbon,charcoal,,,,,,,,,,,,,,,,,,,,,,,,,souflets; four; fourneau; four a vent; tuelle; grille,souflets; four; fourneau; four à vent; tuelle; grille,furnace; blast-pipe; four à vent; bellow; grate,,,,,,,,,,,,,,,,,,,,,,,,
084r,84r,084r_1,casting,Masque in promptu,Masque in promptu,Impromptu mask,,,,,,,,,,,,,,,,papier,papier,paper,,,,,,,,,,,,,,,,,,,,,,,,,,,,,,,,,,,,,,,,,,,,,,,,,,,
084r,84r,084r_3,casting,Eau magistra,Eau magistra,Eau magistra,,,,,,,,,,,,,cave,cave,cellar,eau magistra; sel; suin de verre subtilement pulverise; sel gemme; huile de tartre; mabre,eau magistra; sel; suin de verre; sel gemme; huile de tartre; mabre,sandiver; magistra; marble; oil; salt,,,,,,,,,,,,,,,,,,,,,,,,,moule; mabre,moule; mabre,marble; mold,,,,,,,,,,,,,,,,,,,,,,,,
084r,84r,084r_4,casting,Farine,Farine,Flour,,,,,,,,,,,,,,,,farine,farine,flour,,,,,,,,,,,,,,,,,,,,,,,,,,,,tout lan; advents de noel,tout l’an; advents de noel,advent; year,,,,,,,,,,,,,,,,,,,,,
084r,84r,084r_5,casting,Sable de mine de Thoulouse,Sable de mine de Thoulouse,Sand from a mine in Thoulouse,,,,,,,,,,,,,lieu sec; au costau de puy david bien profond en terre; mine de thoulouse,"au costau de puy david, bien profond en terre; lieu sec; mine de thoulouse","depths of the earth, from the small hill of puy david; mine; dry place",sable naturel; verre pile; sable de thoulouse; sable de mine de thoulouse; cuivre; eaulx des susdicts sels; seables; fume; suin de verre pulverise; mabre,sable naturel; sable de thoulouse; sable de mine de thoulouse; cuivre; eaulx des susdicts sels; verre pilé; suin de verre pulverisé; seables; fume; mabre,pestled glass; sandiver; smoke; sand; marble; copper; water,,,,,,,,,,,,,puy david; thoulouse,puy david; thoulouse,puy david; thoulouse,,,,,,,,,,tamise; pile; four; moule; chauldiere de cuivre,tamise; pile; four; moule; chauldiere de cuivre; pilé; commun tamis,pestled; sieve; oven; pestle; mold; copper kettle,apres que le pain en est tire,aprés que le pain en est tiré,after the bread has been taken out,,,,,,,,,,,,,,,,,,,,,
