folio,folio_display,div_id,categories,heading_tc,heading_tcn,heading_tl,al_tc,al_tcn,al_tl,bp_tc,bp_tcn,bp_tl,cn_tc,cn_tcn,cn_tl,df_tc,df_tcn,df_tl,env_tc,env_tcn,env_tl,m_tc,m_tcn,m_tl,md_tc,md_tcn,md_tl,ms_tc,ms_tcn,ms_tl,mu_tc,mu_tcn,mu_tl,pa_tc,pa_tcn,pa_tl,pl_tc,pl_tcn,pl_tl,pn_tc,pn_tcn,pn_tl,pro_tc,pro_tcn,pro_tl,sn_tc,sn_tcn,sn_tl,tl_tc,tl_tcn,tl_tl,tmp_tc,tmp_tcn,tmp_tl,wp_tc,wp_tcn,wp_tl,de_tc,de_tcn,de_tl,el_tc,el_tcn,el_tl,it_tc,it_tcn,it_tl,la_tc,la_tcn,la_tl,oc_tc,oc_tcn,oc_tl,po_tc,po_tcn,po_tl
040v,40v,040v_1,painting,Croix des commandeurs de malte,Croix des commandeurs de Malte,Cross of the commanders of Malta,dragon,dragon,dragon,,,,,,,,,,,,,laque platte dinde; tormentine claire; larme de mastic; esmail; foeilles de pierrerie; sang de dragon; eau de vye; rouge clair; argent,tormentine claire; larme de mastic; esmail; foeilles de pierrerie; sang de dragon; eau de vye; rouge clair; laque platte d’inde; argent,indian laque platte; turpentine; rouge clair; eau-de-vie; blood; mastic; silver; foil; enamel,,,,,,,,,,,,,inde; malte; flandres,inde; malte; flandres,flander; maltum; indian,,,,commandeurs de malte; painctres; ceulx qui font les foeilles de pierrerie; orfevres,commandeurs de malte; painctres; ceulx qui font les foeilles de pierrerie; orfevres,goldsmith; painter; commanders of maltum; those who make gemstone foil,,,,,,,,,,,,,,,,,,,,,,,,,,,,,,
040v,40v,040v_2,metal process,Letton et calamine,Letton et calamine,Latten and calamine,,,,,,,,,,,,,,,,calamine; charbons; letton,calamine; charbons; letton,charcoal; calamine; latten,,,,,,,,,,,,,,,,,,,fondeurs,fondeurs,founder,,,,four a vent de souflets; creusets; four a vent souflets,four à vent de souflets; creusets; four à vent souflets,furnace; crucible,,,,,,,,,,,,,,,,,,,,,,,,
040v,40v,040v_3,metal process,Metal,Metal,Metal,,,,,,,,,,,,,,,,plomb; metal; estain; cendree; estaim doibt estre pur; fumee,fumée; plomb; cendrée; metal; estain; estaim doibt estre pur,cendrée; tin; metal; smoke; lead,,,,,,,,,,,,,,,,,,,,,,,,,cendree,cendrée,cendrée,long temps,long temps,time,,,,,,,,,,,,,,,,,,,,,
040v,40v,040v_4,corrosives,Eau fort,Eau fort,Aquafortis,,,,pied,pied,foot,,,,,,,,,,eau fort; cendres; espricts; lutee; fumee,lutée; fumée; eau fort; cendres; espricts,smoke; spirit; luted; aquaforti; ash,,,,dour; demy pied,dour; demy pied,dour; foot,,,,,,,,,,,,,,,,,,,grille basse; cendres; lutee; fourneau; cornue; grille haulte,grille basse; lutée; cendres; fourneau; cornue; grille haulte,retort; grate; luted; furnace; ash,,,,,,,,,,,,,,,,,,,,,,,,
041r,41r,041r_02,cultivation,Lis de jardin,Lis de jardin,Garden lily,,,,,,,,,,,,,,,,,,,,,,an suivant,an suivant,in the following year,,,,lis de jardin,lis de jardin,garden lily,,,,,,,,,,,,,,,,an suivant,an suivant,in the following year,,,,,,,,,,,,,,,,,,,,,
041r,41r,041r_03,casting,Sable,Sable,Sand,boeuf,boeuf,ox,,,,,,,,,,de naturel,de naturel,in nature,porphire; brique fort broyee; moelle de corne de boeuf bruslee; aspalte brusle; sable; mable; tripoly; albastre calcine; terre grasse; pain; aspalte; noir a noircy; plastre,porphire; aspalte; noir à noircy; aspalte bruslé; sable; mable; tripoly; moelle de corne de boeuf bruslée; brique fort broyée; terre grasse; pain; albastre calciné; plastre,black; earth; alabaster; plaster; burned marrow of ox horn; tripoli; bread; burned aspalte; porphyry; brick thoroughly ground; marble; aspalte; sand,,,,quarte partye,quarte partye,part,,,,,,,,,,,,,,,,,,,porphire; mable,porphire; mable,porphyry; marble,,,,,,,,,,,,,,,,,,,,,,,,
041r,41r,041r_04,animal husbandry;household and daily life,Canards,Canards,Ducks,canards,canards,duck,,,,,,,,,,eau,eau,water,grain de mil bouilly; laictues fort hachees; pain,grain de mil bouilly; pain; laictues fort hachées,grain; bread; well chopped lettuce,,,,moys,moys,month,,,,laictues; mil,laictues; mil,lettuce; millet,,,,,,,,,,,,,,,,moys,moys,month,,,,,,,,,,,,,,,,,,,,,
041r,41r,041r_1,casting,Terre de gect pour les fondeurs,Terre de gect pour les fondeurs,"Earth for casting, for founders",cheval,cheval,horse,,,,,,,,,,,,,terres grasses; pailles; sable; fient de cheval; terre de gect pour les fondeurs; fiens; fiens de cheval; terres; terre des potiers; terre,terres grasses; pailles; sable; fient de cheval; terre de gect pour les fondeurs; fiens; fiens de cheval; terres; terre des potiers; terre,earth; dung; sand; straw,,,,moictie; cinquiesme; quarte,moictié; cinquiesme; quarte,half as much; fifth; quarter,,,,,,,,,,,,,potiers; fondeurs,potiers; fondeurs,potter; founder,,,,tamiser,tamiser,sift,,,,,,,,,,,,,,,,,,,,,,,,
041v,41v,041v_1,painting,Noir des vitriers,Noir des vitriers,Glassworkers’ black,,,,,,,,,,,,,,,,celle commune tendre qui tombe soubs lenclume; nel; minium; noir; lescaille de fer,nel; minium; celle commune tendre qui tombe soubs l’enclume; noir; l’escaille de fer,black; scale; minium; niello; common delicate kind that falls under the anvil,,,,,,,,,,,,,,,,,,,vitriers,vitriers,glassworker,,,,enclume; forge,enclume; forge,forge; anvil,long temps,long temps,time,,,,,,,,,,,,,,,,,,,,,
041v,41v,041v_2,animal husbandry;household and daily life,Brebis tondues,Brebis tondues,Sheared ewes,brebis; moutons,brebis; moutons,ewe; sheep,,,,,,,viscorter,viscorter,viscorter,,,,fiente mesme de brebis,fiente mesme de brebis,dung,,,,an,an,year,,,,,,,,,,,,,tondeur,tondeur,shearer,,,,,,,an,an,year,,,,,,,,,,,,,,,,viscorter,viscorter,viscorter,,,
041v,41v,041v_3,painting;glass process,Couleurs et doreure sur le verre,Couleurs et doreure sur le verre,Colors and gilding on glass,,,,halene,halene,breath,,,,,,,,,,or; verre; gomme; safran; argent; papier; massicot; eau gommee; doreure,or; verre; gomme; safran; argent; papier; massicot; eau gommée; doreure,paper; gilding; glass; silver; gum; massicot; water; gold,,,,,,,,,,safran,safran,saffron,,,,,,,,,,,,,,,,,,,,,,,,,,,,,,,,,,,,,,,
042r,42r,042r_1,casting,Fondeur,Fondeur,Founder,,,,,,,,,,,,,,,,pouldre de charbon; metal; terre,pouldre de charbon; metal; terre,powder; earth; metal,,,,,,,,,,,,,,,,,,,fondeur,fondeur,founder,,,,moule de terre,moule de terre,mold,,,,,,,,,,,,,,,,,,,,,,,,
042r,42r,042r_2,wax process,Cire a cachet et empraincte,Cire à cachet et empraincte,Wax for seal and imprint,,,,mains,mains,hand,,,,,,,,,,colle; verre; eau; gomme armoniac; vinagre; couleurs a tourmentine &amp; mastic; eau tiede; cire; argenter; couleurs a vernis; papier; dorer; papiers,colle; verre; eau; gomme armoniac; vinagre; couleurs à tourmentine &amp; mastic; eau tiede; cire; argenter; papier; dorer; couleurs à vernis; papiers,colors in varnish; paper; vinegar; glue; gild; ammoniac; wax; glass; silver; colors in turpentine &amp; mastic; water,,,,,,,,,,,,,,,,,,,,,,,,,pilon; moule; baston,pilon; moule; baston,mold; pestle; stick,,,,,,,,,,,,,,,,,,,,,,,,
042r,42r,042r_3,casting,Pour gecter de plastre,Pour gecter de plastre,For casting in plaster,,,,,,,,,,,,,,,,cire; plastre,cire; plastre,plaster; wax,,,,,,,,,,,,,,,,,,,,,,,,,broisse,broisse,brush,,,,,,,,,,,,,,,,,,,,,,,,
042v,42v,042v_1,painting;household and daily life,Poncis pour esgratigner sur le satin,Poncis pour esgratigner sur le satin,Pounced design for scratching satin,,,,,,,,,,,,,,,,verre; croye broyee; eau; farine; satin; glaire; laict ou escorce de figuier,verre; eau; farine; satin; glaire; croye broyée; laict ou escorce de figuier,water; milk; satin; glass; glair; chalk; flour,,,,,,,,,,figuier,figuier,tree,,,,,,,,,,,,,lopin de verre; trancheplume,lopin de verre; trancheplume,piece of glass; penknife,,,,,,,,,,,,,,,,,,,,,,,,
042v,42v,042v_2,painting,Toile pour paindre a huile sans se rompre,Toile pour paindre à huile sans se rompre,Canvas for painting in oil without breaking,,,,,,,,,,,,,,,,farine; eau; huile; miel,farine; eau; huile; miel,oil; water; flour; honey,,,,,,,,,,,,,,,,,,,,,,,,,,,,,,,,,,,,,,,,,,,,,,,,,,,
042v,42v,042v_3,painting,paindre a huile sur taffetas qui,Paindre à huile sur taffetas qui,Painting in oil on taffeta which,,,,,,,,,,,,,,,,eau dalum; miel; huile; eau damydon; taffetas,miel; eau d’amydon; eau d’alum; huile; taffetas,oil; taffetum; water; honey,,,,,,,,,,,,,,,,,,,,,,,,,,,,,,,,,,,,,,,,,,,,,,,,,,,
042v,42v,042v_4,casting,Sable de gect,Sable de gect,Sand for casting,,,,,,,,,,,,,,,,mabre; albastre calcine; sable de gect,mabre; albastre calciné; sable de gect,sand; alabaster; marble,,,,,,,,,,,,,,,,,,,,,,,,,mabre,mabre,marble,,,,,,,,,,,,,,,,,,,,,,,,
042v,42v,042v_5,painting,Pour pourfiler un portraict,Pour pourfiler un portraict,For outlining a portrait,,,,,,,,,,,,,,,,laque; huile dolif,laque; huile d’olif,oil; lake,,,,,,,,,,olif,olif,olive,,,,,,,,,,,,,,,,,,,,,,,,,,,,,,,,,,,,,,,
042v,42v,042v_6,varnish;painting,Vernis blanc sur le plastre,Vernis blanc sur le plastre,White varnish on plaster,,,,,,,,,,,,,,,,huile daspic; vernis blanc; vernis de sandarache; mastic; huile; colle bien blanche; plastre,vernis blanc; vernis de sandarache; huile d’aspic; mastic; huile; colle bien blanche; plastre,oil; glue; plaster; varnish; mastic,,,,mains,mains,coat,,,,aspic,aspic,spike lavender,,,,,,,,,,,,,pinceau; vaisseau; pile,pinceau; vaisseau; pilé,vessel; pestled; paintbrush,au soir,au soir,in the evening,,,,,,,,,,,,,,,,,,,,,
043r,43r,043r_1,cultivation,Mericotons et pavis,Mericotons et pavis,Mericotons and pavis,,,,,,,,,,,,,,,,,,,,,,,,,,,,pavis; mericotons,pavis; mericotons,pavi; mericoton,,,,,,,,,,,,,,,,advents de noël,advents de noël,advent,,,,,,,,,,,,,,,,,,,,,
043r,43r,043r_2,painting;varnish,Bronzure blanche sur plastre,Bronzure blanche sur plastre,White bronzing on plaster,,,,,,,,,,,,,,,,argent vif; colle; plomb; gomme; minium; plomb brusle; cotton; mine dangleterre; plastre,plomb bruslé; argent vif; colle; plomb; gomme; minium; mine d’angleterre; cotton; plastre,glue; plaster; minium; gum; quicksilver; cotton; lead,,,,,,,,,,,,,angleterre,angleterre,england,,,,painctres,painctres,painter,,,,,,,,,,,,,,,,,,,,,,,,,,,,,,
043r,43r,043r_3,painting;metal process;varnish,Purpurine,Purpurine,Purple,,,,ditto,ditto,ditto,,,,,,,,,,vernice; vetro; purpurina; sal armoniaco; porfidio; purpurine; stagno; solfo; colla; negro di resina; ☿,vernice; vetro; purpurina; sal armoniaco; porfidio; purpurine; stagno; solfo; colla; negro di resina; ☿,vernice; vetro; purpurina; sal armoniaco; porfidio; stagno; purple; solfo; colla; negro di resina; ☿,,,,meza onca; hora; ℥,hora; ℥; meza onça,hora; ℥; meza onça,,,,,,,,,,,,,pintori,pintori,pintori,,,,cochiaro; sublimatorio di vetro; ditto,cochiaro; sublimatorio di vetro; ditto,cochiaro; sublimatorio di vetro; ditto,hora,hora,hora,,,,,,,,,,℞ stagno dolce meza onca farlo fondere in un cochiaro depoi fonduto gectarly dentro una ℥ de ☿ mesedar insieme essendo freddo macinar supra il porfidio dapoi piglia una ℥ de sal armoniaco una ℥ de solfo del piu giallo que se possa troval macinar tutti duoi et poi mesedar molto bene tutti gli matteriali sopradetti dapoi metter tutto insieme dentro un a pignatta sublimatorio di vetro tenerlo sopra picciol fuoco una hora &amp; una hora un poco piu forte &amp; una hora bonissimo fuoco et sara fatto dapoi per adoperarla datte il negro di resina con colla di pintori da pintar &amp; per doi o tre volte fin a tanto che sia ben negro dapoi datte un poco di vernice essendo secco datte a secco con ditto la purpurina dove vorrette tanto piu ne darette sara piu bello dapoi si volete datte vernice sopra,"℞ stagno dolce, meza onça, farlo fondere in un cochiaro. depoi fonduto, gectarly dentro una ℥ de ☿, mesedar insieme. essendo freddo, macinar supra il porfidio. dapoi piglia una ℥ de sal armoniaco, una ℥ de solfo del più giallo que se possa troval, macinar tutti duoi. et poi mesedar molto bene tutti gli matteriali sopradetti. dapoi metter tutto insieme dentro un a pignatta sublimatorio di vetro, tenerlo sopra picciol fuoco una hora &amp; una hora un poco piu forte &amp; una hora bonissimo fuoco, et sarà fatto. dapoi, per adoperarla, datte il negro di resina con colla di pintori da pintar &amp; per doi o tre volte, fin a tanto che sia ben negro. dapoi datte un poco di vernice. essendo secco, datte a secco con ditto la purpurina dove vorrette. tanto più ne darette, sarà piu bello. dapoi, si volete, datte vernice sopra","℞ stagno dolce, meza onça, farlo fondere in un cochiaro. depoi fonduto, gectarly dentro una ℥ de ☿, mesedar insieme. essendo freddo, macinar supra il porfidio. dapoi piglia una ℥ de sal armoniaco, una ℥ de solfo del più giallo que se possa troval, macinar tutti duoi. et poi mesedar molto bene tutti gli matteriali sopradetti. dapoi metter tutto insieme dentro un a pignatta sublimatorio di vetro, tenerlo sopra picciol fuoco una hora &amp; una hora un poco piu forte &amp; una hora bonissimo fuoco, et sarà fatto. dapoi, per adoperarla, datte il negro di resina con colla di pintori da pintar &amp; per doi o tre volte, fin a tanto che sia ben negro. dapoi datte un poco di vernice. essendo secco, datte a secco con ditto la purpurina dove vorrette. tanto più ne darette, sarà piu bello. dapoi, si volete, datte vernice sopra",,,,,,,,,
043r,43r,043r_4,painting,Bronzure blanche,Bronzure blanche,White bronzing,,,,doigt,doigt,finger,,,,,,,,,,colle; plomb; vernis; mine dangleterre; mine,colle; plomb; mine d’angleterre; vernis; mine,glue; varnish; minium; lead,,,,,,,,,,,,,angleterre,angleterre,england,,,,,,,,,,pinceau; doigt,pinceau; doigt,finger; paintbrush,,,,,,,,,,,,,,,,,,,,,,,,
043v,43v,043v_1,tricks and sleight of hand,Vin diversifie et transmue,Vin diversifié et transmué,Varied and transmuted wine,,,,,,,,,,,,,,,,bresil; eau taincte; eau claire; vin; just de citron ou dorange; vin diversifie et transmue,bresil; vin diversifié et transmué; just de citron ou d’orange; eau taincte; eau claire; vin,lemon or orange juice; tinted water; wine; brazilwood; water; varied and transmuted wine,,,,goute; heures,goute; heures,hour; drop,,,,citron; bresil; orange,citron; bresil; orange,brazilwood; lemon; orange,,,,,,,,,,,,,,,,heures,heures,hour,,,,,,,,,,,,,,,,,,,,,
043v,43v,043v_2,stones,Perles,Perles,Pearls,,,,,,,,,,,,,,,,perles; talc pulverise,perles; talc pulverisé,pearl; pulverized talc,,,,,,,,,,,,,,,,,,,,,,,,,lampe,lampe,lamp,,,,,,,,,,,,,,,,,,,,,,,,
043v,43v,043v_3,arms and armor,Harquebusier,Harquebusier,Arquebusier,,,,,,,,,,,,,,,,pouldre,pouldre,powder,,,,ligne,ligne,line,,,,,,,,,,,,,harquebusier,harquebusier,arquebusier,,,,,,,,,,harquebus chambree; harquebus,harquebus; harquebus chambrée,arquebus,,,,,,,,,,,,,,,,,,
043v,43v,043v_4,arms and armor,Dragee dharquebus,Dragee d’harquebus,Hail shot of the arquebus,,,,,,,,,,,,,,,,cuir; feultre; papier,cuir; feultre; papier,paper; felt; leather,,,,,,,,,,,,,,,,,,,,,,,,,porte piece,portepiece,cutting-punch,,,,harquebus,harquebus,arquebus,,,,,,,,,,,,,,,,,,
044r,44r,044r_1,arms and armor,Portee dharquebus,Portée d’harquebus,The range of an arquebus,,,,,,,deniers,deniers,denier,aulne de paris,aulne de paris,paris aulne,,,,pouldre,pouldre,powder,,,,pieds; deniers; aulne de paris; pans; poulces; pas; pieds de roy; ligne,pieds; deniers; aulne de paris; pans; poulces; pas; pieds de roy; ligne,feet; pace; denier; inch; aulne; pan; line,,,,,,,paris,paris,pari,,,,,,,,,,,,,,,,haquebute; harquebus; harquebus de chasse,haquebute; harquebus; harquebus de chasse,hackbut; piece; arquebus,,,,,,,,,,,,,,,,,,
044r,44r,044r_2,casting,Pintier,Pintier,Pewterer,,,,,,,,,,,,,villes ou sont les maistres jures,villes où sont les maistres jurés,city,mitraille; plomb; estaim commun; estaim de glace; estaim; retailles de cuivre que font les chaudroniers,mitraille; plomb; estaim commun; estaim de glace; estaim; retailles de cuivre que font les chaudroniers,tin; debri; copper shards that coppersmiths make; lead,,,,lb; quintal,lb; quintal,lb; quintal,,,,,,,,,,,,,chaudroniers; maistres jures; pintier,chaudroniers; maistres jurés; pintier,pewterer; master; coppersmith,sonner,sonner,sonorous,,,,,,,,,,,,,,,,,,,,,,,,,,,
044r,44r,044r_3,arms and armor,Harquebus,Harquebus,Arquebus,,,,,,,,,,,,,,,,linge; huile; papier,linge; huile; papier,oil; paper; cloth,,,,huict en huict jours,huict en huict jours,day,,,,,,,,,,,,,,,,,,,,,,,,,harquebus,harquebus,arquebus,,,,,,,,,,,,,,,,,,
044r,44r,044r_4,painting,Laque,Laque,Lake,,,,,,,,,,,,,,,,laque; papier,laque; papier,paper; lake,,,,heures,heures,hour,,,,,,,,,,,,,,,,,,,,,,heures,heures,hour,,,,,,,,,,,,,,,,,,,,,
044r,44r,044r_5,dyeing,Taincture de fleurs,Taincture de fleurs,Dyes from flowers,,,,,,,,,,,,,,,,herbe qui croist par les hayes qui ha la tige semblable au lin la foeuille longue &amp; large comme menue buglose qui ha la fleur violette tirant au bleu &amp; faicte comme la fleur du lys; boufain; pavot rouge; colombine; taincture de fleurs; pensee; cuir blanc; fleur de buglose,"boufain; pavot rouge; colombine; taincture de fleurs; herbe, qui croist par les hayes, qui ha la tige semblable au lin, la foeuille longue &amp; large comme menue buglose, qui ha la fleur violette tirant au bleu &amp; faicte comme la fleur du lys; cuir blanc; fleur de buglose; pensée","plant which grows in hedges, which has a stem similar to flax, a long &amp; broad leaf like small bugloss, which has a violet flower verging on blue &amp; is shaped like the lily flower; red poppy; dye; columbine; pansy; flower; cornflower; leather",,,,,,,,,,pavot rouge; bleds; lin; colombine; lys; pensee; boufain; buglose,pavot rouge; bleds; lin; colombine; lys; boufain; buglose; pensée,red poppy; bugloss; grain; columbine; pansy; lily flower; cornflower; flax,,,,,,,,,,,,,,,,,,,,,,,,,,,,,,,,,,,,,boufain,boufain,cornflower
044v,44v,044v_1,tool,Tamis de poil de cheval,Tamis de poil de cheval,Horsehair sieves,cheval,cheval,horse,bouche; doitgs,bouche; doitgs,finger; mouth,sols,sols,sous,,,,,,,poil de cheval; lessive; poil de la queue de cheval; poil; estamine de soye; poils,poil de cheval; lessive; poil de la queue de cheval; poil; estamine de soye; poils,horsehair; hair; silk tammy; lye,,,,douzaines; large de ii ou trois doitgs; sols,douzaines; large de ii ou trois doitgs; sols,sous; dozen; finger,,,,,,,espaigne; coustance; normandie; thoulouse,espaigne; coustance; normandie; thoulouse,normandy; toulouse; coustance; spain,,,,,,,,,,bouche; lames; petit baston plat; lame,bouche; lames; petit baston plat; lame,reed; stick; mouth,,,,,,,,,,,,,,,,,,,,,,,,
044v,44v,044v_2,medicine,Excellente eau contre la peste / de monsieur de montorsin,"Excellente eau contre la peste, de monsieur de Montorsin",Excellent water against the plague of Monsieur de Montorsin,,,,,,,,,,,,,,,,verre; eau; dictam; theriaque; bon vinaigre; rue,verre; eau; dictam; theriaque; bon vinaigre; rue,vinegar; glass; theriac; rue; water; dittany,eau contre la peste,eau contre la peste,water against the plague,jours,jours,day,,,,rue; dictam,rue; dictam,rue; dittany,,,,monsieur de montorsin,monsieur de montorsin,monsieur de montorsin,,,,,,,bouteille de verre; quarreau rouge enflamme,bouteille de verre; quarreau rouge enflammé,bottle; tile,jours,jours,day,,,,,,,,,,,,,,,,,,,,,
044v,44v,044v_3,medicine,Huile blanc somnifere,Huile blanc somnifere,White soporific oil,,,,plante des pieds,plante des pieds,soles of your feet,,,,,,,,,,verre; huile dolif; pommes de mandragore; huile; huile blanc somnifere,huile d’olif; verre; pommes de mandragore; huile; huile blanc somnifere,oil; glass; mandrake apple,auras bien tost envye de dormir; huile blanc somnifere,auras bientost envye de dormir; huile blanc somnifere,will soon feel like sleeping; white soporific oil,jours,jours,day,,,,olif; mandragore,olif; mandragore,mandrake; olive,,,,,,,,,,,,,phiol; bouteille de verre,phiol; bouteille de verre,bottle; vial,jours,jours,day,,,,,,,,,,,,,,,,,,,,,
044v,44v,044v_4,stones,Stuc,Stuc,Stucco,,,,,,,,,,,,,,,,soufre; gemme; stuc; rousine; brique pilee; pierre; croye blanche; cire; pierre blanche; poix resine noire; coller,soufre; gemme; stuc; brique pilée; rousine; pierre; croye blanche; cire; pierre blanche; poix resine noire; coller,pestled brick; stucco; glueing; resin; rosin; wax; sulfur; stone; chalk,,,,aultant que dun que daultre &amp;,aultant que d’un que d’aultre,as much as of one as the other,,,,,,,,,,,,,,,,,,,pilee,pilée,pestled,,,,,,,,,,,,,,,,,,,,,,,,
045r,45r,045r_1,arms and armor,Charger arquebus de dragee,Charger arquebus de dragée,Loading an arquebus with hail shot,,,,doigts,doigts,finger,,,,,,,,,,toile ciree; feultre; buys; papier de la fort comme de grands livres imprimes; cuir; papier; carte; papier cire,"feultre; buys; papier ciré; cuir; toile cirée; papier; carte; papier, de la fort comme de grands livres imprimes",cardboard; paper; felt; wooden; leather; waxed,,,,pas; large aultant que tu vouldras faire longue une cartuche; long comme la largeur de 4 ou 5 doigts,pas; large aultant que tu vouldras faire longue une cartuche; long comme la largeur de 4 ou 5 doigts,long as the width of 4 or 5 finger; wide as you want to make your cartridge long; pace,,,,,,,,,,,,,,,,,,,tuyau; portepiece; baston,tuyau; portepiece; baston,baton; cutting-punch; pipe,,,,arquebus de dragee; pistole; arquebus,arquebus de dragée; pistole; arquebus,pistol; arquebus,,,,,,,,,,,,,,,,,,
045v,45v,045v_1,arms and armor,Charger arquebus,Charger arquebus,Loading an arquebus,,,,,,,,,,,,,,,,pouldre; crasse,pouldre; crasse,powder; filth,,,,,,,,,,,,,,,,,,,,,,,,,ancrou; vergette; vis; verge,ancrou; vergette; vis; verge,nut; ramrod; screw,,,,harquebus; canon; arquebus,harquebus; arquebus,arquebus,,,,,,,,,,,,,,,,,,
045v,45v,045v_2,arms and armor,Pour adjouster un canon faulce,Pour adjouster un canon faulcé,For adjusting a crooked cannon,,,,,,,,,,,,,,,,plomb,plomb,plumb,,,,,,,,,,,,,,,,,,,,,,,,,table bien unie &amp; bien posee a plomb; plomb; marteau; filet sans noeuds &amp; bien uni; filet,plomb; marteau; filet sans noeuds &amp; bien uni; filet; bien unie &amp; bien posée à plomb,plumb; hammer; table; string,,,,canon,canon,cannon,,,,,,,,,,,,,,,,,,
046r,46r,046r_1,medicine,Pour les dents huile de soufre,"Pour les dents, huile de soufre","For the teeth, oil of sulfur",,,,bouche; dents,bouche; dents,teeth; mouth,,,,,,,,,,huiles; miel rosat; huile de girofle; eau fort; eau tiede; huile de soufre; cotton,huiles; miel rosat; huile de girofle; eau fort; eau tiede; huile de soufre; cotton,oil; rose; cotton; aquaforti; water,cela par apres les corrompt &amp; leur cause une noirceur; blanchissent; pour les dents; penetre &amp; est corrosif,cela par aprés les corrompt &amp; leur cause une noirceur; blanchissent; pour les dents; penetre &amp; est corrosif,penetrates &amp; is corrosive; whiten; this corrupts them afterward &amp; causes a blackness on them; for the teeth,coquille de noix; goutes,coquille de noix; goutes,shell; drop,,,,girofle; noix,girofle; noix,walnut; clove,,,,,,,,,,,,,petit burin; coquille de noix,petit burin; coquille de noix,shell; burin,,,,,,,,,,,,,,,,,,,,,,,,
046r,46r,046r_2,medicine,Huile de froment,Huile de froment,Wheat oil,,,,,,,,,,,,,,,,huile de froment,huile de froment,oil,aplique sur le poil le faict tumber &amp; le garde de naistre,"apliqué sur le poil le faict tumber, &amp; le garde de naistre","applied to hair, it makes it fall out &amp; keeps it from being born.",,,,,,,froment,froment,wheat,,,,,,,,,,,,,,,,,,,,,,,,,,,,,,,,,,,,,,,
046r,46r,046r_3,medicine,Contre mal caducq,Contre mal caducq,Against the falling sickness,corbeau,corbeau,crow,,,,,,,,,,,,,oeufs frais dun corbeau; huile de soufre; gentiane en pouldre,huile de soufre; gentiane en pouldre; oeufs frais d’un corbeau,oil; powdered gentian; egg,le mal ne revient plus; contre mal caducq,le mal ne revient plus; contre mal caducq,against the falling sickness; the pain will not return,espace de 4 ou cinq matins; goutte,espace de 4 ou cinq matins; goutte,drop; space of 4 or five morning,,,,gentiane,gentiane,gentian,,,,,,,,,,,,,,,,matins,matins,morning,,,,,,,,,,,,,,,,,,,,,
046r,46r,046r_4,medicine,Contre goutes froides,Contre goutes froides,Against cold gouts,,,,,,,,,,,,,,,,huile de gayac &amp; de soufre,huile de gayac &amp; de soufre,oil,contre goutes froides,contre goutes froides,against cold gout,,,,,,,gayac,gayac,guaiac,,,,,,,,,,,,,,,,,,,,,,,,,,,,,,,,,,,,,,,
046r,46r,046r_5,cultivation,Go Fleurs dabres,Go Fleurs d’abres,Go Flowers of trees,,,,,,,,,,,,,,,,,,,,,,,,,,,,,,,,,,,,,,,,,,,,,,en toutess les renouveaulx de ☾,en toutess les renouveaulx de ☾,with everyes new ☾,,,,,,,,,,,,,,,,,,,,,
046v,46v,046v_1,corrosives,Escrivain huile de soufre,"Escrivain, huile de soufre","Scribe, Oil of sulfur",,,,,,,,,,,,,,,,huile de soufre; ancre,huile de soufre; ancre,oil; ink,,,,,,,,,,,,,,,,,,,escrivain,escrivain,scribe,,,,plume,plume,quill,,,,,,,,,,,,,,,,,,,,,,,,
046v,46v,046v_2,corrosives;decorative,Cordonnier,Cordonnier,Shoemaker,,,,,,,,,,,,,,,,huile de soufre; cuir noir,huile de soufre; cuir noir,oil; leather,,,,,,,,,,,,,,,,,,,cordonnier,cordonnier,shoemaker,,,,plume a escripre,plume à escripre,writing quill,,,,,,,,,,,,,,,,,,,,,,,,
046v,46v,046v_3,corrosives,Effacer lettre,Effacer lettre,Erasing a letter,,,,,,,,,,,,,,,,parchemin; huile de soufre recent &amp; bon,parchemin; huile de soufre recent &amp; bon,fresh &amp; good oil of sulfur; parchment,,,,,,,,,,,,,,,,,,,,,,,,,plume a escripre; plume,plume; plume à escripre,writing quill; quill,,,,,,,,,,,,,,,,,,,,,,,,
046v,46v,046v_4,corrosives,Escripre sans ancre,Escripre sans ancre,Writing without ink,,,,,,,,,,,,,,,,huile de soufre; ancre,huile de soufre; ancre,oil; ink,,,,,,,,,,,,,,,,,,,,,,,,,,,,,,,,,,,,,,,,,,,,,,,,,,,
046v,46v,046v_5,corrosives,Faire lettre a jour sur papier et aultre ouvrage,Faire lettre à jour sur papier et aultre ouvrage ,Making a letter à jour on paper and other work,,,,,,,,,,,,,,,,papier,papier,paper,,,,,,,,,,,,,,,,,,,,,,,,,plume; esponge,plume; esponge,quill; sponge,,,,,,,,,,,,,,,,,,,,,,,,
046v,46v,046v_6,corrosives,Faire brusler les bottes a quelquun,Faire brusler les bottes à quelqu’un,Making someone’s boots burn,,,,,,,,,,,,,,,,huile,huile,oil,,,,,,,,,,,,,,,,,,,,,,,,,,,,,,,,,,,,,,,,,,,,,,,,,,,
