folio,folio_display,div_id,categories,heading_tc,heading_tcn,heading_tl,al_tc,al_tcn,al_tl,bp_tc,bp_tcn,bp_tl,cn_tc,cn_tcn,cn_tl,df_tc,df_tcn,df_tl,env_tc,env_tcn,env_tl,m_tc,m_tcn,m_tl,md_tc,md_tcn,md_tl,ms_tc,ms_tcn,ms_tl,mu_tc,mu_tcn,mu_tl,pa_tc,pa_tcn,pa_tl,pl_tc,pl_tcn,pl_tl,pn_tc,pn_tcn,pn_tl,pro_tc,pro_tcn,pro_tl,sn_tc,sn_tcn,sn_tl,tl_tc,tl_tcn,tl_tl,tmp_tc,tmp_tcn,tmp_tl,wp_tc,wp_tcn,wp_tl,de_tc,de_tcn,de_tl,el_tc,el_tcn,el_tl,it_tc,it_tcn,it_tl,la_tc,la_tcn,la_tl,oc_tc,oc_tcn,oc_tl,po_tc,po_tcn,po_tl
040v,40v,040v_1,painting,Croix des commandeurs de malte,Croix des commandeurs de Malte,Cross of the commanders of Malta,dragon,dragon,dragon,,,,,,,,,,,,,eau de vye; foeilles de pierrerie; rouge clair; laque platte dinde; larme de mastic; tormentine claire; sang de dragon; argent; esmail,eau de vye; foeilles de pierrerie; rouge clair; larme de mastic; tormentine claire; sang de dragon; argent; laque platte d’inde; esmail,foil; blood; turpentine; rouge clair; indian laque platte; eau-de-vie; mastic; silver; enamel,,,,,,,,,,,,,inde; flandres; malte,inde; flandres; malte,maltum; flander; indian,,,,orfevres; painctres; ceulx qui font les foeilles de pierrerie; commandeurs de malte,orfevres; painctres; ceulx qui font les foeilles de pierrerie; commandeurs de malte,goldsmith; painter; those who make gemstone foil; commanders of maltum,,,,,,,,,,,,,,,,,,,,,,,,,,,,,,
040v,40v,040v_2,metal process,Letton et calamine,Letton et calamine,Latten and calamine,,,,,,,,,,,,,,,,calamine; letton; charbons,calamine; letton; charbons,calamine; latten; charcoal,,,,,,,,,,,,,,,,,,,fondeurs,fondeurs,founder,,,,creusets; four a vent souflets; four a vent de souflets,four à vent souflets; creusets; four à vent de souflets,crucible; furnace,,,,,,,,,,,,,,,,,,,,,,,,
040v,40v,040v_3,metal process,Metal,Metal,Metal,,,,,,,,,,,,,,,,plomb; metal; fumee; cendree; estain; estaim doibt estre pur,plomb; metal; cendrée; fumée; estain; estaim doibt estre pur,lead; smoke; metal; cendrée; tin,,,,,,,,,,,,,,,,,,,,,,,,,cendree,cendrée,cendrée,long temps,long temps,time,,,,,,,,,,,,,,,,,,,,,
040v,40v,040v_4,corrosives,Eau fort,Eau fort,Aquafortis,,,,pied,pied,foot,,,,,,,,,,espricts; lutee; fumee; cendres; eau fort,espricts; lutée; cendres; fumée; eau fort,spirit; smoke; luted; ash; aquaforti,,,,demy pied; dour,demy pied; dour,dour; foot,,,,,,,,,,,,,,,,,,,cornue; lutee; fourneau; grille basse; cendres; grille haulte,cornue; lutée; fourneau; grille basse; cendres; grille haulte,furnace; luted; ash; grate; retort,,,,,,,,,,,,,,,,,,,,,,,,
041r,41r,041r_02,cultivation,Lis de jardin,Lis de jardin,Garden lily,,,,,,,,,,,,,,,,,,,,,,an suivant,an suivant,in the following year,,,,lis de jardin,lis de jardin,garden lily,,,,,,,,,,,,,,,,an suivant,an suivant,in the following year,,,,,,,,,,,,,,,,,,,,,
041r,41r,041r_03,casting,Sable,Sable,Sand,boeuf,boeuf,ox,,,,,,,,,,de naturel,de naturel,in nature,plastre; aspalte brusle; porphire; aspalte; pain; mable; tripoly; noir a noircy; sable; brique fort broyee; albastre calcine; moelle de corne de boeuf bruslee; terre grasse,plastre; aspalte bruslé; porphire; aspalte; pain; mable; tripoly; sable; noir à noircy; albastre calciné; terre grasse; moelle de corne de boeuf bruslée; brique fort broyée,brick thoroughly ground; aspalte; porphyry; burned marrow of ox horn; bread; sand; burned aspalte; marble; plaster; tripoli; alabaster; earth; black,,,,quarte partye,quarte partye,part,,,,,,,,,,,,,,,,,,,mable; porphire,mable; porphire,marble; porphyry,,,,,,,,,,,,,,,,,,,,,,,,
041r,41r,041r_04,animal husbandry;household and daily life,Canards,Canards,Ducks,canards,canards,duck,,,,,,,,,,eau,eau,water,grain de mil bouilly; pain; laictues fort hachees,grain de mil bouilly; pain; laictues fort hachées,grain; bread; well chopped lettuce,,,,moys,moys,month,,,,laictues; mil,laictues; mil,lettuce; millet,,,,,,,,,,,,,,,,moys,moys,month,,,,,,,,,,,,,,,,,,,,,
041r,41r,041r_1,casting,Terre de gect pour les fondeurs,Terre de gect pour les fondeurs,"Earth for casting, for founders",cheval,cheval,horse,,,,,,,,,,,,,fiens; fiens de cheval; terres grasses; sable; terre des potiers; pailles; terre de gect pour les fondeurs; terre; terres; fient de cheval,fiens; fiens de cheval; terres grasses; sable; terre des potiers; pailles; terre de gect pour les fondeurs; terre; terres; fient de cheval,dung; earth; straw; sand,,,,quarte; moictie; cinquiesme,moictié; quarte; cinquiesme,fifth; quarter; half as much,,,,,,,,,,,,,fondeurs; potiers,fondeurs; potiers,founder; potter,,,,tamiser,tamiser,sift,,,,,,,,,,,,,,,,,,,,,,,,
041v,41v,041v_1,painting,Noir des vitriers,Noir des vitriers,Glassworkers’ black,,,,,,,,,,,,,,,,nel; celle commune tendre qui tombe soubs lenclume; lescaille de fer; noir; minium,nel; noir; minium; l’escaille de fer; celle commune tendre qui tombe soubs l’enclume,scale; minium; niello; common delicate kind that falls under the anvil; black,,,,,,,,,,,,,,,,,,,vitriers,vitriers,glassworker,,,,forge; enclume,forge; enclume,forge; anvil,long temps,long temps,time,,,,,,,,,,,,,,,,,,,,,
041v,41v,041v_2,animal husbandry;household and daily life,Brebis tondues,Brebis tondues,Sheared ewes,brebis; moutons,brebis; moutons,ewe; sheep,,,,,,,viscorter,viscorter,viscorter,,,,fiente mesme de brebis,fiente mesme de brebis,dung,,,,an,an,year,,,,,,,,,,,,,tondeur,tondeur,shearer,,,,,,,an,an,year,,,,,,,,,,,,,,,,viscorter,viscorter,viscorter,,,
041v,41v,041v_3,painting;glass process,Couleurs et doreure sur le verre,Couleurs et doreure sur le verre,Colors and gilding on glass,,,,halene,halene,breath,,,,,,,,,,massicot; verre; or; safran; eau gommee; gomme; doreure; argent; papier,massicot; verre; or; safran; eau gommée; doreure; argent; gomme; papier,paper; massicot; gum; glass; gold; gilding; silver; water,,,,,,,,,,safran,safran,saffron,,,,,,,,,,,,,,,,,,,,,,,,,,,,,,,,,,,,,,,
042r,42r,042r_1,casting,Fondeur,Fondeur,Founder,,,,,,,,,,,,,,,,terre; pouldre de charbon; metal,terre; pouldre de charbon; metal,earth; metal; powder,,,,,,,,,,,,,,,,,,,fondeur,fondeur,founder,,,,moule de terre,moule de terre,mold,,,,,,,,,,,,,,,,,,,,,,,,
042r,42r,042r_2,wax process,Cire a cachet et empraincte,Cire à cachet et empraincte,Wax for seal and imprint,,,,mains,mains,hand,,,,,,,,,,eau; couleurs a vernis; eau tiede; verre; argenter; vinagre; dorer; colle; gomme armoniac; papier; papiers; cire; couleurs a tourmentine &amp; mastic,couleurs à vernis; eau; verre; eau tiede; vinagre; argenter; dorer; couleurs à tourmentine &amp; mastic; colle; gomme armoniac; papier; papiers; cire,paper; glass; vinegar; gild; wax; silver; colors in turpentine &amp; mastic; glue; ammoniac; water; colors in varnish,,,,,,,,,,,,,,,,,,,,,,,,,baston; pilon; moule,baston; pilon; moule,mold; stick; pestle,,,,,,,,,,,,,,,,,,,,,,,,
042r,42r,042r_3,casting,Pour gecter de plastre,Pour gecter de plastre,For casting in plaster,,,,,,,,,,,,,,,,plastre; cire,plastre; cire,plaster; wax,,,,,,,,,,,,,,,,,,,,,,,,,broisse,broisse,brush,,,,,,,,,,,,,,,,,,,,,,,,
042v,42v,042v_1,painting;household and daily life,Poncis pour esgratigner sur le satin,Poncis pour esgratigner sur le satin,Pounced design for scratching satin,,,,,,,,,,,,,,,,laict ou escorce de figuier; farine; eau; verre; glaire; croye broyee; satin,laict ou escorce de figuier; farine; eau; croye broyée; verre; glaire; satin,chalk; water; glass; flour; satin; milk; glair,,,,,,,,,,figuier,figuier,tree,,,,,,,,,,,,,trancheplume; lopin de verre,trancheplume; lopin de verre,piece of glass; penknife,,,,,,,,,,,,,,,,,,,,,,,,
042v,42v,042v_2,painting,Toile pour paindre a huile sans se rompre,Toile pour paindre à huile sans se rompre,Canvas for painting in oil without breaking,,,,,,,,,,,,,,,,huile; farine; eau; miel,huile; farine; eau; miel,water; oil; flour; honey,,,,,,,,,,,,,,,,,,,,,,,,,,,,,,,,,,,,,,,,,,,,,,,,,,,
042v,42v,042v_3,painting,paindre a huile sur taffetas qui,Paindre à huile sur taffetas qui,Painting in oil on taffeta which,,,,,,,,,,,,,,,,taffetas; huile; eau damydon; miel; eau dalum,taffetas; huile; eau d’alum; miel; eau d’amydon,taffetum; water; oil; honey,,,,,,,,,,,,,,,,,,,,,,,,,,,,,,,,,,,,,,,,,,,,,,,,,,,
042v,42v,042v_4,casting,Sable de gect,Sable de gect,Sand for casting,,,,,,,,,,,,,,,,albastre calcine; sable de gect; mabre,sable de gect; albastre calciné; mabre,marble; alabaster; sand,,,,,,,,,,,,,,,,,,,,,,,,,mabre,mabre,marble,,,,,,,,,,,,,,,,,,,,,,,,
042v,42v,042v_5,painting,Pour pourfiler un portraict,Pour pourfiler un portraict,For outlining a portrait,,,,,,,,,,,,,,,,laque; huile dolif,laque; huile d’olif,lake; oil,,,,,,,,,,olif,olif,olive,,,,,,,,,,,,,,,,,,,,,,,,,,,,,,,,,,,,,,,
042v,42v,042v_6,varnish;painting,Vernis blanc sur le plastre,Vernis blanc sur le plastre,White varnish on plaster,,,,,,,,,,,,,,,,huile; plastre; huile daspic; vernis de sandarache; colle bien blanche; vernis blanc; mastic,huile; plastre; huile d’aspic; vernis de sandarache; colle bien blanche; vernis blanc; mastic,plaster; mastic; oil; glue; varnish,,,,mains,mains,coat,,,,aspic,aspic,spike lavender,,,,,,,,,,,,,pinceau; pile; vaisseau,pinceau; vaisseau; pilé,pestled; paintbrush; vessel,au soir,au soir,in the evening,,,,,,,,,,,,,,,,,,,,,
043r,43r,043r_1,cultivation,Mericotons et pavis,Mericotons et pavis,Mericotons and pavis,,,,,,,,,,,,,,,,,,,,,,,,,,,,mericotons; pavis,mericotons; pavis,pavi; mericoton,,,,,,,,,,,,,,,,advents de noël,advents de noël,advent,,,,,,,,,,,,,,,,,,,,,
043r,43r,043r_2,painting;varnish,Bronzure blanche sur plastre,Bronzure blanche sur plastre,White bronzing on plaster,,,,,,,,,,,,,,,,plastre; plomb; plomb brusle; cotton; mine dangleterre; colle; gomme; minium; argent vif,plastre; plomb; cotton; colle; gomme; minium; argent vif; mine d’angleterre; plomb bruslé,gum; lead; cotton; plaster; minium; glue; quicksilver,,,,,,,,,,,,,angleterre,angleterre,england,,,,painctres,painctres,painter,,,,,,,,,,,,,,,,,,,,,,,,,,,,,,
043r,43r,043r_3,painting;metal process;varnish,Purpurine,Purpurine,Purple,,,,ditto,ditto,ditto,,,,,,,,,,porfidio; stagno; sal armoniaco; solfo; colla; vetro; vernice; purpurina; ☿; purpurine; negro di resina,porfidio; stagno; sal armoniaco; solfo; colla; vetro; vernice; purpurina; ☿; purpurine; negro di resina,porfidio; stagno; colla; solfo; vetro; purple; vernice; purpurina; ☿; sal armoniaco; negro di resina,,,,meza onca; ℥; hora,meza onça; ℥; hora,meza onça; ℥; hora,,,,,,,,,,,,,pintori,pintori,pintori,,,,cochiaro; ditto; sublimatorio di vetro,cochiaro; ditto; sublimatorio di vetro,cochiaro; ditto; sublimatorio di vetro,hora,hora,hora,,,,,,,,,,℞ stagno dolce meza onca farlo fondere in un cochiaro depoi fonduto gectarly dentro una ℥ de ☿ mesedar insieme essendo freddo macinar supra il porfidio dapoi piglia una ℥ de sal armoniaco una ℥ de solfo del piu giallo que se possa troval macinar tutti duoi et poi mesedar molto bene tutti gli matteriali sopradetti dapoi metter tutto insieme dentro un a pignatta sublimatorio di vetro tenerlo sopra picciol fuoco una hora &amp; una hora un poco piu forte &amp; una hora bonissimo fuoco et sara fatto dapoi per adoperarla datte il negro di resina con colla di pintori da pintar &amp; per doi o tre volte fin a tanto che sia ben negro dapoi datte un poco di vernice essendo secco datte a secco con ditto la purpurina dove vorrette tanto piu ne darette sara piu bello dapoi si volete datte vernice sopra,"℞ stagno dolce, meza onça, farlo fondere in un cochiaro. depoi fonduto, gectarly dentro una ℥ de ☿, mesedar insieme. essendo freddo, macinar supra il porfidio. dapoi piglia una ℥ de sal armoniaco, una ℥ de solfo del più giallo que se possa troval, macinar tutti duoi. et poi mesedar molto bene tutti gli matteriali sopradetti. dapoi metter tutto insieme dentro un a pignatta sublimatorio di vetro, tenerlo sopra picciol fuoco una hora &amp; una hora un poco piu forte &amp; una hora bonissimo fuoco, et sarà fatto. dapoi, per adoperarla, datte il negro di resina con colla di pintori da pintar &amp; per doi o tre volte, fin a tanto che sia ben negro. dapoi datte un poco di vernice. essendo secco, datte a secco con ditto la purpurina dove vorrette. tanto più ne darette, sarà piu bello. dapoi, si volete, datte vernice sopra","℞ stagno dolce, meza onça, farlo fondere in un cochiaro. depoi fonduto, gectarly dentro una ℥ de ☿, mesedar insieme. essendo freddo, macinar supra il porfidio. dapoi piglia una ℥ de sal armoniaco, una ℥ de solfo del più giallo que se possa troval, macinar tutti duoi. et poi mesedar molto bene tutti gli matteriali sopradetti. dapoi metter tutto insieme dentro un a pignatta sublimatorio di vetro, tenerlo sopra picciol fuoco una hora &amp; una hora un poco piu forte &amp; una hora bonissimo fuoco, et sarà fatto. dapoi, per adoperarla, datte il negro di resina con colla di pintori da pintar &amp; per doi o tre volte, fin a tanto che sia ben negro. dapoi datte un poco di vernice. essendo secco, datte a secco con ditto la purpurina dove vorrette. tanto più ne darette, sarà piu bello. dapoi, si volete, datte vernice sopra",,,,,,,,,
043r,43r,043r_4,painting,Bronzure blanche,Bronzure blanche,White bronzing,,,,doigt,doigt,finger,,,,,,,,,,plomb; mine dangleterre; vernis; colle; mine,plomb; vernis; colle; mine; mine d’angleterre,glue; varnish; minium; lead,,,,,,,,,,,,,angleterre,angleterre,england,,,,,,,,,,pinceau; doigt,pinceau; doigt,finger; paintbrush,,,,,,,,,,,,,,,,,,,,,,,,
043v,43v,043v_1,tricks and sleight of hand,Vin diversifie et transmue,Vin diversifié et transmué,Varied and transmuted wine,,,,,,,,,,,,,,,,vin; eau taincte; bresil; vin diversifie et transmue; eau claire; just de citron ou dorange,vin; eau taincte; bresil; eau claire; vin diversifié et transmué; just de citron ou d’orange,lemon or orange juice; wine; varied and transmuted wine; water; tinted water; brazilwood,,,,heures; goute,heures; goute,hour; drop,,,,bresil; orange; citron,bresil; orange; citron,orange; brazilwood; lemon,,,,,,,,,,,,,,,,heures,heures,hour,,,,,,,,,,,,,,,,,,,,,
043v,43v,043v_2,stones,Perles,Perles,Pearls,,,,,,,,,,,,,,,,perles; talc pulverise,talc pulverisé; perles,pulverized talc; pearl,,,,,,,,,,,,,,,,,,,,,,,,,lampe,lampe,lamp,,,,,,,,,,,,,,,,,,,,,,,,
043v,43v,043v_3,arms and armor,Harquebusier,Harquebusier,Arquebusier,,,,,,,,,,,,,,,,pouldre,pouldre,powder,,,,ligne,ligne,line,,,,,,,,,,,,,harquebusier,harquebusier,arquebusier,,,,,,,,,,harquebus chambree; harquebus,harquebus; harquebus chambrée,arquebus,,,,,,,,,,,,,,,,,,
043v,43v,043v_4,arms and armor,Dragee dharquebus,Dragee d’harquebus,Hail shot of the arquebus,,,,,,,,,,,,,,,,feultre; cuir; papier,feultre; cuir; papier,paper; felt; leather,,,,,,,,,,,,,,,,,,,,,,,,,porte piece,portepiece,cutting-punch,,,,harquebus,harquebus,arquebus,,,,,,,,,,,,,,,,,,
044r,44r,044r_1,arms and armor,Portee dharquebus,Portée d’harquebus,The range of an arquebus,,,,,,,deniers,deniers,denier,aulne de paris,aulne de paris,paris aulne,,,,pouldre,pouldre,powder,,,,pans; pas; deniers; aulne de paris; pieds; pieds de roy; ligne; poulces,pans; pas; deniers; aulne de paris; pieds; pieds de roy; ligne; poulces,line; pan; inch; pace; aulne; feet; denier,,,,,,,paris,paris,pari,,,,,,,,,,,,,,,,haquebute; harquebus; harquebus de chasse,haquebute; harquebus; harquebus de chasse,piece; hackbut; arquebus,,,,,,,,,,,,,,,,,,
044r,44r,044r_2,casting,Pintier,Pintier,Pewterer,,,,,,,,,,,,,villes ou sont les maistres jures,villes où sont les maistres jurés,city,estaim commun; plomb; retailles de cuivre que font les chaudroniers; estaim; estaim de glace; mitraille,estaim commun; plomb; retailles de cuivre que font les chaudroniers; estaim; estaim de glace; mitraille,tin; lead; copper shards that coppersmiths make; debri,,,,quintal; lb,quintal; lb,quintal; lb,,,,,,,,,,,,,chaudroniers; maistres jures; pintier,chaudroniers; pintier; maistres jurés,pewterer; coppersmith; master,sonner,sonner,sonorous,,,,,,,,,,,,,,,,,,,,,,,,,,,
044r,44r,044r_3,arms and armor,Harquebus,Harquebus,Arquebus,,,,,,,,,,,,,,,,huile; papier; linge,huile; papier; linge,paper; oil; cloth,,,,huict en huict jours,huict en huict jours,day,,,,,,,,,,,,,,,,,,,,,,,,,harquebus,harquebus,arquebus,,,,,,,,,,,,,,,,,,
044r,44r,044r_4,painting,Laque,Laque,Lake,,,,,,,,,,,,,,,,laque; papier,laque; papier,paper; lake,,,,heures,heures,hour,,,,,,,,,,,,,,,,,,,,,,heures,heures,hour,,,,,,,,,,,,,,,,,,,,,
044r,44r,044r_5,dyeing,Taincture de fleurs,Taincture de fleurs,Dyes from flowers,,,,,,,,,,,,,,,,pavot rouge; colombine; boufain; pensee; taincture de fleurs; fleur de buglose; cuir blanc; herbe qui croist par les hayes qui ha la tige semblable au lin la foeuille longue &amp; large comme menue buglose qui ha la fleur violette tirant au bleu &amp; faicte comme la fleur du lys,"pavot rouge; colombine; pensée; taincture de fleurs; herbe, qui croist par les hayes, qui ha la tige semblable au lin, la foeuille longue &amp; large comme menue buglose, qui ha la fleur violette tirant au bleu &amp; faicte comme la fleur du lys; fleur de buglose; cuir blanc; boufain","dye; red poppy; plant which grows in hedges, which has a stem similar to flax, a long &amp; broad leaf like small bugloss, which has a violet flower verging on blue &amp; is shaped like the lily flower; flower; pansy; leather; columbine; cornflower",,,,,,,,,,pavot rouge; colombine; lin; buglose; pensee; lys; boufain; bleds,pavot rouge; colombine; lin; pensée; buglose; lys; boufain; bleds,red poppy; grain; pansy; flax; bugloss; columbine; cornflower; lily flower,,,,,,,,,,,,,,,,,,,,,,,,,,,,,,,,,,,,,boufain,boufain,cornflower
044v,44v,044v_1,tool,Tamis de poil de cheval,Tamis de poil de cheval,Horsehair sieves,cheval,cheval,horse,bouche; doitgs,bouche; doitgs,finger; mouth,sols,sols,sous,,,,,,,estamine de soye; poil de cheval; poil; poil de la queue de cheval; poils; lessive,estamine de soye; poil de cheval; poil; poil de la queue de cheval; poils; lessive,lye; silk tammy; horsehair; hair,,,,douzaines; large de ii ou trois doitgs; sols,douzaines; large de ii ou trois doitgs; sols,sous; finger; dozen,,,,,,,coustance; normandie; espaigne; thoulouse,coustance; normandie; espaigne; thoulouse,coustance; toulouse; normandy; spain,,,,,,,,,,lames; petit baston plat; lame; bouche,lames; petit baston plat; lame; bouche,reed; mouth; stick,,,,,,,,,,,,,,,,,,,,,,,,
044v,44v,044v_2,medicine,Excellente eau contre la peste / de monsieur de montorsin,"Excellente eau contre la peste, de monsieur de Montorsin",Excellent water against the plague of Monsieur de Montorsin,,,,,,,,,,,,,,,,eau; theriaque; bon vinaigre; verre; dictam; rue,eau; theriaque; bon vinaigre; verre; dictam; rue,glass; dittany; vinegar; rue; water; theriac,eau contre la peste,eau contre la peste,water against the plague,jours,jours,day,,,,dictam; rue,dictam; rue,dittany; rue,,,,monsieur de montorsin,monsieur de montorsin,monsieur de montorsin,,,,,,,quarreau rouge enflamme; bouteille de verre,bouteille de verre; quarreau rouge enflammé,tile; bottle,jours,jours,day,,,,,,,,,,,,,,,,,,,,,
044v,44v,044v_3,medicine,Huile blanc somnifere,Huile blanc somnifere,White soporific oil,,,,plante des pieds,plante des pieds,soles of your feet,,,,,,,,,,huile; verre; pommes de mandragore; huile dolif; huile blanc somnifere,huile; verre; pommes de mandragore; huile blanc somnifere; huile d’olif,mandrake apple; oil; glass,auras bien tost envye de dormir; huile blanc somnifere,auras bientost envye de dormir; huile blanc somnifere,will soon feel like sleeping; white soporific oil,jours,jours,day,,,,olif; mandragore,olif; mandragore,mandrake; olive,,,,,,,,,,,,,phiol; bouteille de verre,phiol; bouteille de verre,bottle; vial,jours,jours,day,,,,,,,,,,,,,,,,,,,,,
044v,44v,044v_4,stones,Stuc,Stuc,Stucco,,,,,,,,,,,,,,,,coller; stuc; cire; croye blanche; poix resine noire; gemme; pierre blanche; pierre; brique pilee; soufre; rousine,coller; stuc; cire; croye blanche; poix resine noire; brique pilée; gemme; pierre blanche; pierre; soufre; rousine,chalk; stucco; stone; glueing; rosin; sulfur; wax; pestled brick; resin,,,,aultant que dun que daultre &amp;,aultant que d’un que d’aultre,as much as of one as the other,,,,,,,,,,,,,,,,,,,pilee,pilée,pestled,,,,,,,,,,,,,,,,,,,,,,,,
045r,45r,045r_1,arms and armor,Charger arquebus de dragee,Charger arquebus de dragée,Loading an arquebus with hail shot,,,,doigts,doigts,finger,,,,,,,,,,papier cire; feultre; cuir; carte; buys; papier; papier de la fort comme de grands livres imprimes; toile ciree,"feultre; cuir; carte; papier, de la fort comme de grands livres imprimes; buys; toile cirée; papier; papier ciré",paper; wooden; felt; leather; cardboard; waxed,,,,long comme la largeur de 4 ou 5 doigts; pas; large aultant que tu vouldras faire longue une cartuche,long comme la largeur de 4 ou 5 doigts; pas; large aultant que tu vouldras faire longue une cartuche,pace; wide as you want to make your cartridge long; long as the width of 4 or 5 finger,,,,,,,,,,,,,,,,,,,baston; portepiece; tuyau,baston; portepiece; tuyau,pipe; baton; cutting-punch,,,,pistole; arquebus de dragee; arquebus,pistole; arquebus de dragée; arquebus,arquebus; pistol,,,,,,,,,,,,,,,,,,
045v,45v,045v_1,arms and armor,Charger arquebus,Charger arquebus,Loading an arquebus,,,,,,,,,,,,,,,,crasse; pouldre,crasse; pouldre,powder; filth,,,,,,,,,,,,,,,,,,,,,,,,,vis; vergette; verge; ancrou,vis; vergette; verge; ancrou,screw; nut; ramrod,,,,harquebus; canon; arquebus,harquebus; arquebus,arquebus,,,,,,,,,,,,,,,,,,
045v,45v,045v_2,arms and armor,Pour adjouster un canon faulce,Pour adjouster un canon faulcé,For adjusting a crooked cannon,,,,,,,,,,,,,,,,plomb,plomb,plumb,,,,,,,,,,,,,,,,,,,,,,,,,plomb; filet sans noeuds &amp; bien uni; marteau; table bien unie &amp; bien posee a plomb; filet,plomb; filet sans noeuds &amp; bien uni; marteau; bien unie &amp; bien posée à plomb; filet,plumb; hammer; string; table,,,,canon,canon,cannon,,,,,,,,,,,,,,,,,,
046r,46r,046r_1,medicine,Pour les dents huile de soufre,"Pour les dents, huile de soufre","For the teeth, oil of sulfur",,,,dents; bouche,dents; bouche,teeth; mouth,,,,,,,,,,miel rosat; huile de soufre; cotton; eau tiede; huile de girofle; huiles; eau fort,miel rosat; huile de soufre; cotton; eau tiede; huile de girofle; huiles; eau fort,rose; cotton; oil; water; aquaforti,cela par apres les corrompt &amp; leur cause une noirceur; pour les dents; blanchissent; penetre &amp; est corrosif,pour les dents; cela par aprés les corrompt &amp; leur cause une noirceur; blanchissent; penetre &amp; est corrosif,whiten; this corrupts them afterward &amp; causes a blackness on them; penetrates &amp; is corrosive; for the teeth,coquille de noix; goutes,coquille de noix; goutes,shell; drop,,,,noix; girofle,noix; girofle,walnut; clove,,,,,,,,,,,,,coquille de noix; petit burin,coquille de noix; petit burin,shell; burin,,,,,,,,,,,,,,,,,,,,,,,,
046r,46r,046r_2,medicine,Huile de froment,Huile de froment,Wheat oil,,,,,,,,,,,,,,,,huile de froment,huile de froment,oil,aplique sur le poil le faict tumber &amp; le garde de naistre,"apliqué sur le poil le faict tumber, &amp; le garde de naistre","applied to hair, it makes it fall out &amp; keeps it from being born.",,,,,,,froment,froment,wheat,,,,,,,,,,,,,,,,,,,,,,,,,,,,,,,,,,,,,,,
046r,46r,046r_3,medicine,Contre mal caducq,Contre mal caducq,Against the falling sickness,corbeau,corbeau,crow,,,,,,,,,,,,,huile de soufre; gentiane en pouldre; oeufs frais dun corbeau,huile de soufre; gentiane en pouldre; oeufs frais d’un corbeau,egg; oil; powdered gentian,le mal ne revient plus; contre mal caducq,le mal ne revient plus; contre mal caducq,the pain will not return; against the falling sickness,goutte; espace de 4 ou cinq matins,goutte; espace de 4 ou cinq matins,space of 4 or five morning; drop,,,,gentiane,gentiane,gentian,,,,,,,,,,,,,,,,matins,matins,morning,,,,,,,,,,,,,,,,,,,,,
046r,46r,046r_4,medicine,Contre goutes froides,Contre goutes froides,Against cold gouts,,,,,,,,,,,,,,,,huile de gayac &amp; de soufre,huile de gayac &amp; de soufre,oil,contre goutes froides,contre goutes froides,against cold gout,,,,,,,gayac,gayac,guaiac,,,,,,,,,,,,,,,,,,,,,,,,,,,,,,,,,,,,,,,
046r,46r,046r_5,cultivation,Go Fleurs dabres,Go Fleurs d’abres,Go Flowers of trees,,,,,,,,,,,,,,,,,,,,,,,,,,,,,,,,,,,,,,,,,,,,,,en toutess les renouveaulx de ☾,en toutess les renouveaulx de ☾,with everyes new ☾,,,,,,,,,,,,,,,,,,,,,
046v,46v,046v_1,corrosives,Escrivain huile de soufre,"Escrivain, huile de soufre","Scribe, Oil of sulfur",,,,,,,,,,,,,,,,huile de soufre; ancre,huile de soufre; ancre,oil; ink,,,,,,,,,,,,,,,,,,,escrivain,escrivain,scribe,,,,plume,plume,quill,,,,,,,,,,,,,,,,,,,,,,,,
046v,46v,046v_2,corrosives;decorative,Cordonnier,Cordonnier,Shoemaker,,,,,,,,,,,,,,,,huile de soufre; cuir noir,huile de soufre; cuir noir,leather; oil,,,,,,,,,,,,,,,,,,,cordonnier,cordonnier,shoemaker,,,,plume a escripre,plume à escripre,writing quill,,,,,,,,,,,,,,,,,,,,,,,,
046v,46v,046v_3,corrosives,Effacer lettre,Effacer lettre,Erasing a letter,,,,,,,,,,,,,,,,parchemin; huile de soufre recent &amp; bon,parchemin; huile de soufre recent &amp; bon,fresh &amp; good oil of sulfur; parchment,,,,,,,,,,,,,,,,,,,,,,,,,plume a escripre; plume,plume à escripre; plume,writing quill; quill,,,,,,,,,,,,,,,,,,,,,,,,
046v,46v,046v_4,corrosives,Escripre sans ancre,Escripre sans ancre,Writing without ink,,,,,,,,,,,,,,,,huile de soufre; ancre,huile de soufre; ancre,oil; ink,,,,,,,,,,,,,,,,,,,,,,,,,,,,,,,,,,,,,,,,,,,,,,,,,,,
046v,46v,046v_5,corrosives,Faire lettre a jour sur papier et aultre ouvrage,Faire lettre à jour sur papier et aultre ouvrage ,Making a letter à jour on paper and other work,,,,,,,,,,,,,,,,papier,papier,paper,,,,,,,,,,,,,,,,,,,,,,,,,esponge; plume,esponge; plume,sponge; quill,,,,,,,,,,,,,,,,,,,,,,,,
046v,46v,046v_6,corrosives,Faire brusler les bottes a quelquun,Faire brusler les bottes à quelqu’un,Making someone’s boots burn,,,,,,,,,,,,,,,,huile,huile,oil,,,,,,,,,,,,,,,,,,,,,,,,,,,,,,,,,,,,,,,,,,,,,,,,,,,
