div_id,categories,subject_tag,subject_label,subject_term,verb_lemma,verb_form,passive,obj_text,obj_tag,sentence
p058v_5,painting,tl,Tool,small rods to rest their hand when they are painting,rest,rest,False,their hand,bp,"The handle of paintbrushes is made by those who work with care from porcupine quills, by others from wood of arrows from Turkey with which they also make small rods to rest their hand when they are painting."
p058v_5,painting,tl,Tool,very thin paintbrushes which have a firm point,have,have,False,a firm point,tl,To work well on a small scale very thin paintbrushes which have a firm point are needed.
p058v_5,painting,m,Material,bristles of beech martens & weasels & small animals that make musk,make,make,False,musk,m,"The bristles of beech martens & weasels & small animals that make musk are even better, for a single hair in a paintbrush suffices."
p059r_1,varnish;painting,pl,Place,Italians,make,make,False,three shadows,,"The Italians commonly make three shadows, the first one, of light, very clear, the second one darker & the third ones quite strong, then blend these three shadows together by hatching them from the darkest to the clearest."
p059v_6,painting,m,Material,oil,receive,receive,False,color,,"And the oil mixed with wax will better receive color, which is also tempered with oil."
p060r_1,painting,pro,Profession,painters,have,have,False,such panels,,Flemish painters have such panels made by the dozen.
p060r_3,painting;varnish,m,Material,oil,have,has,False,a little body,,"And when the oil has a little body, the colors soften in it."
p060v_3,painting,pro,Profession,painters,pour,pour,False,a few drops,,"Also, painters, sometimes envious of the work undertaken by another, in the evening secretly pour a few drops of spike lavender oil on the top edge of the panel such that, running down, it makes a stain that penetrates as far as the wood & makes the colors come off such that, to make the work even & of an equal composition, they are forced to do everything again and thus lose their work."
p062r_4,painting,pro,Profession,masters,pass,pass,False,judgment,,"And by a line of charcoal, masters pass judgment on their apprentices."
p063r_1,painting,m,Material,white wine,remove,removes,False,its tint,,"Although it is said to be immortal, it is nonetheless the case that white wine removes its tint & turns claret-colored, & the dry flower ends up white afterward."
p063r_1,painting,m,Material,Eau-de-vie,do,does,False,much,,Eau-de-vie does as much.
p063r_1,painting,m,Material,Eau-de-vie,do,does,False,much,,Eau-de-vie does as much.
p063r_1,painting,m,Material,Eau-de-vie,do,does,False,much,,Eau-de-vie does as much.
p063r_1,painting,m,Material,Eau-de-vie,do,does,False,much,,Eau-de-vie does as much.
p063r_3,casting,pl,Place,Germans,use,use,False,lead,m,The Germans use lead from Flanders because it is very soft.
p063r_4,painting,pro,Profession,painters,make,make,False,their shadows,,"German painters make their shadows on flesh color of men with ground jet, stil de grain yellow & ocher."
p063v_1,painting,m,Material,common charcoal,make,makes,False,black,,The common charcoal makes a whitish black.
p063v_2,painting,m,Material,Soft wood charcoal,make,makes,False,a bluish color,,Soft wood charcoal makes a bluish color.
p064r_5,painting,m,Material,lake,require,require,False,two layers,,"But lake & others, & principally flesh colors, require two layers."
p066r_1,painting,pl,Place,Flemish,make,make,False,one layer,,"The Flemish & those who paint panels by the dozen only make one layer & finish at the first go, but the colors soon die."
p066r_5,varnish,pl,Place,Flemish,give,give,False,a layer,,"The Flemish give a layer of distemper glue on the molding, then mix lamp black or soot black with the same glue & let dry."
p067r_4,varnish,m,Material,another fragrant one that resembles olive oil,resemble,resembles,False,olive oil,m,"The Germans make boxes covered with painted paper & varnish it with glair of egg mixed with gum & a little oil, not of spike lavender, but another fragrant one that resembles olive oil."
p067r_4,varnish,pro,Profession,painters,trick,trick,False,the poor peasants,pro,"It is with this that painters trick the poor peasants, painting their bands of taffeta with this glair, to be done sooner."
p067v_1,tool,pro,Profession,Founders,have,have,False,their files,tl,Founders whose work is to repair latten & copper must have their files coarse otherwise they would fill up with the copper which would make them smooth & soon render them useless.
p067v_1,tool,m,Material,Latten,welcome,welcomes,False,softer files,tl,"Latten, which is more brittle, welcomes softer files than copper does."
p068r_2,cultivation,env,Environment,rains,fill,fill,False,the holes,,"One needs to plant them in dry weather, & gather plenty of earth at the foot all around, like a mound, in order that the rains do not fill the holes & drown the trees."
p068r_3,casting,m,Material,cristallin,contain,contains,False,both salt,m,"Pestled glass can be made from common glass sand, however, cristallin is more excellent, for common glass contains salt of saltwort only, but cristallin contains both salt of tartar & saltwort all together, which both help fusion, the glass once calcined & reduced as if to its prime substance."
p068r_3,casting,m,Material,Burnt linen,give,gives,False,less trouble,,"Burnt linen gives less trouble than any other, because it needs neither to be reheated nor to be moistened, & molds and releases very neatly , subtly & neatly, like the previous ones do as well, & withstands several fusions."
p069r_2,,m,Material,"Sand from oxen feet, burned twice & finely ground",burn,burned,False,ground,m,"Sand from oxen feet, burned twice & finely ground, melts more neatly with copper than sand that I have seen, & without crust."
p069r_2,,pro,Profession,Founders,cast,cast,False,frames,tl,"Founders do cast frames up to 30 or 40 lb, but not more."
p069r_2,,pro,Profession,Founders,cast,cast,False,lb,ms,"Founders do cast frames up to 30 or 40 lb, but not more."
p069r_2,casting,m,Material,Ash,have,have,False,enough body,,Ash does not have enough body to withstand copper.
p069r_2,casting,m,Material,Slightly coarser sand,have,has,False,more body,,Slightly coarser sand has more body.
p071r_2,wood and its coloring,m,Material,elm,have,has,False,beautiful streaks,,"The elm, in its knotty root, has beautiful streaks diversified with grey and black, and the root of the maple, but one needs to choose well the grain of the wood."
p071r_3,household and daily life,pl,Place,English,mull,mull,False,wine,m,"The English, when they feel a cold coming on, mull wine in this manner."
p071r_3,household and daily life,m,Material,wine,lose,lost,False,its sweetness,,"The common English put sugar in wine to affect for themselves the sweet new wine, which they cannot have because, owing to the long sea crossing, the wine has lost its sweetness and is clarified before it reaches their country."
p071r_5,household and daily life,pl,Place,Irish,drink,drink,False,any wine,m,"The Irish do not drink any wine because they convert it into eau-de-vie, which they use almost as habitually as we use wine."
p071v_1,varnish,m,Material,oil,leave,leaves,False,the paper,m,"If the oil, which will evaporate, leaves the paper clean, without a yellow mark, it is good, if not, it is fatty."
p071v_2,household and daily life;animal husbandry,al,Animal,sheep,have,have,False,very yellow fat,,"In a certain region of England, the sheep that graze there have very yellow fat and are nevertheless just as good as others."
p071v_4,casting,pro,Profession,those who sharpen,sharpen,sharpen,False,"smooth, mold",,"Pierres de filieres, with which those who sharpen smooth, mold very neatly, once scraped, for lead."
p072r_2,casting,tl,Tool,frame,have,have,False,vents,,"And if your frame does not have vents, make some in the sand, which come from the edges of the piece, to go into the gate."
p072v_1,casting,pl,Place,Germans,cast,cast,False,their leads,m,"The Germans cast their leads very thinly, because it seems they come out better than very thick ones, but in order that are not too pliant, being so thin, they mix a little tin with the said lead, which otherwise would bend like wax."
p072v_1,casting,sn,Sense Term,"You will know its goodness by rubbing it with your finger, which will render it very black immediately",know,know,False,its goodness,sn,"You will know its goodness by rubbing it with your finger, which will render it very black immediately."
p072v_1,casting,m,Material,tin,exceed,exceeds,False,more than one part,ms,"The alloy good for running lead & tin is per one lb of lead, one lb & a half of tin, in order that the tin exceeds more than one part."
p075v_2,wood and its coloring,m,Material,gold,have,have,False,beautiful enough color,,"If your gold does not have beautiful enough color, you will take a partridge feather, & make it burn in a chafing-dish, and make the smoke go against what you have gilded."
p081r_2,casting,m,Material,"Tanner's earth, or the one with which potters make a whitening on pots",make,make,False,a whitening,m,"Tanner's earth, or the one with which potters make a whitening on pots to make lead run better on them & to prevent the lead from being absorbed into them, is very good for molding the hollow forms of things you want make in relief."
p081v_3,casting,m,Material,clay earth with which one makes tiles,make,makes,False,tiles,m,"There is only clay earth with which one makes tiles, reheated & reddened & passed through a sleeve finely mixed with glair."
p081v_4,casting,m,Material,metal,touch,touch,False,the frame's iron,m,"Lute also, or cover the mouth of the frame with sand in order that the melted metal, or lead, or copper does not touch the frame's iron or latten, because it makes it brittle, & makes it porous."
p081v_4,casting,m,Material,Black lead of saulmon,make,makes,False,one,,Black lead of saulmon from the first melting makes a very neat one.
p082r_3,casting,m,Material,Glair of eggs,give,gives,False,strength,,Glair of eggs gives strength to sand to make several casts.
p083r_2,casting,m,Material,Bone,have,has,False,scarcely any body,,Bone has scarcely any body unless it has iron dross.
p083v_2,casting,m,Material,coarse sand,communicate,communicate,False,its humidity,,"This is why the press is better, for it tightens evenly, & more than your hands, and makes the coarse sand, which is humid, communicate its humidity to the soft & fine sand, which is sprinkled & pounced dry on the medal."
p084v_1,casting,m,Material,sands,withstand,withstand,False,one casting,,These sands only withstand one casting.
p084v_1,casting,m,Material,fatty metal,need,needs,False,lean sand,m,A fatty metal needs lean sand.
p085r_2,household and daily life;decorative,pl,Place,Flemish,reglue,reglue,False,their earthen pots,tl,"The Flemish reglue their earthen pots with gold color, that is to say minium, massicot & varnish."
p086v_1,casting,pro,Profession,founders,have,have,False,this superstition,,"Some founders have this superstition, that only three days a week are good for melting, namely Tuesdays, Thursdays, and Saturdays."
p086v_1,casting,m,Material,sand,surpass,surpass,False,the edges,,"Take heed also that the sand does not surpass the edges of the frame, for it makes the molded medal higher than the cast, & in this way, metal will never enter the mold."
p086v_1,casting,m,Material,metal,enter,enter,False,the mold,tl,"Take heed also that the sand does not surpass the edges of the frame, for it makes the molded medal higher than the cast, & in this way, metal will never enter the mold."
p087v_1,casting,m,Material,Thoroughly burnt sand,lose,loses,False,its bond,,Thoroughly burnt sand loses its bond.
p087v_2,casting,pro,Profession,Founders,take,take,False,the roots,m,"Founders take the roots of a young elm when it is in sap & boil it in wine, or better yet vinegar, and keep it all year long in a barrel."
p087v_3,casting,m,Material,vinegar,give,gives,False,any bond,,"I have molded it from pure lead cast very hot, & I had as an example the very neat principal, but the vinegar hardly gives it any bond, & thus it sustained only one cast."
p088r_2,tool,tl,Tool,Fine copper mortars,throw,throw,False,fire,,"Fine copper mortars do not throw fire, as long as the iron pestle is not tempered."
p088r_2,tool,tl,Tool,metal mortar,do,does,False,same,,"The metal mortar does the same, because it is sour."
p088r_5,household and daily life,m,Material,Dust,keep,keeps,False,wheat,m,Dust keeps wheat from becoming infested with weevils.
p089v_1,casting,m,Material,sand that releases well,have,has,False,body,,All sand that releases well has body & gives a good hold.
p090r_2,casting,pro,Profession,Molders,use,use,False,crocum ferri,m,"Molders from Foix who cast their medals crosswise, use crocum ferri and calcined slate."
p090r_3,casting,pro,Profession,Artisans who work in large works,seek,seek,False,one,m,"Artisans who work in large works & who need to further their profit by seeking things already prepared in nature, because she does not sell her wares to her children, and to also save the time they would use for grinding finely & for artificially preparing sands, seek the one of the mine, which is not too fatty, the one that is a kin of earth, not too lean & consequently without bond, but rather that which is pulled from the depths of the sand-bed in bricks & clods that show its natural compaction, which is quite difficult to break & which has a very small & delicate grain, & which is found soft when handling it between the fingers."
p090r_3,casting,m,Material,water,rest,rested,False,little,,"For if it is coarse, pass it through a sieve, and if it is not yet fine enough, wash it, & when the water has rested a little, empty that which is still troubled in some separate vessel."
p091r_1,cultivation,pa,Plant,Apricot trees,have,have,False,a very thin bark,,"Apricot trees have a very thin bark, & thus one needs to graft them onto young trees which do not yet have thick bark, like on shoots of prune trees & almond trees."
p092v_1,casting,m,Material,shells,make,make,False,an impalpable white sand,m,"The long shells that one finds in fresh water rivers, once calcined, make an impalpable white sand, which molds very neatly."
p092v_3,metal process,m,Material,Fine tin,make,makes,False,a substance,,"Fine tin, congealed mercury with the smell of tin, looking-glass tin, fine lead, as much of one as the other, makes a substance that melts very promptly but is breakable & white."
p093v_2,painting,pro,Profession,painters,bring,bring,False,their palette,tl,"To assay it, painters bring their palette to the grocers, & temper & alloy it with a little white ground in oil, for in this way, the beautiful shows its turquine vivacity, but the bad is lavender grey."
p094r_1,arms and armor,df,Definition,blades,have,have,False,a sharp ridge,,"Some blades have a sharp ridge, which has one single elevated ridge in the middle & along the whole length, and are easy to break."
p094r_1,,m,Material,Iron wire,have,has,False,a lower price,,Iron wire has a lower price & is the most durable.
p094r_1,,m,Material,skin,cost,costs,False,fifty or lx sous,cn,The beautiful skin costs fifty or lx sous & 4 or five dozen grips are made from it.
p094r_1,,pro,Profession,Those who create sword guards,create,create,False,sword guards,wp,Those who create sword guards are artisans separate from the furbisher.
p094r_1,arms and armor,pro,Profession,furbisher,buy,buys,False,his blades,,"The furbisher buys his blades by the dozen, which are not fully drawn by the tang because he does this himself to adjust them well to the pommel & guards."
p094r_1,arms and armor,ms,Measurement,dozen,cost,costs,False,x lb,cn,"The furbishers buy them by dozens, the dozen of plain ones commonly costs x lb."
p094r_1,arms and armor,wp,Weapon,sword,cut,cut,False,the scabbard,,"Without this scraping, the sword would always cut the scabbard."
p094r_1,,pro,Profession,worker who made the wood piece,make,made,False,the wood piece,pro,"Next, the same worker who made the wood piece has to adjust the scabbard to be well made."
p096v_1,arms and armor,m,Material,ash,heat,heated,False,the guards,wp,"Blue is obtained as soon as the ash has heated the guards a little, but it is still grey in some places."
p097v_1,varnish,m,Material,varnish,have,have,False,body,,"One knows that this varnish does not have body enough when it does not take well on a panel in oil, for it is like water."
p097v_1,varnish,pl,Place,Italians,varnish,varnish,False,their paintings,,"The Italians scarcely varnish their paintings because they layer their paintings very thick, & they are a long time drying on the inside, though on top they make a dry skin & crust."
p098r_2,cultivation;household and daily life,tl,Tool,cord,mark,marks,False,a straight line,,"Then, stretch the cord very close, and hit on the entire length of the cord with the back of a pruning knife, in order that the cord marks a straight line, the length of which you will make holes with an iron stake where you will plant your rosemary."
p098r_3,metal process;varnish,tl,Tool,head of a nail,soak,soak,False,little,,"And when the tin is well melted & moderately warm, they throw in rosin to burn the filth, & then they let the head of a nail or something similar soak a little, & having remained there for seven or eight pauses, they take it out and shake it, hitting the top with an iron to make the tin that is superfluous fall off, & clean it with a small stick wrapped in tow."
p100v_1,stones,pro,Profession,common people,make,make,False,emeralds,m,"In this way, the common people make emeralds & cast in sand."
p101r_1,stones,m,Material,ruby,want,wants,False,more time,,The ruby wants more time & more fire & colored with gold leaf.
p101v_1,stones,m,Material,ruby,want,wants,False,fire,,"The ruby wants fire for a whole day, and if it does not have enough fire, it will only have red veins."
p101v_1,stones,m,Material,rubified antimony,make,makes,False,jacinth,m,One holds that rubified antimony makes jacinth.
p101v_3,varnish,pl,Place,Germans,make,make,False,minium boil,,"The Germans make minium boil well in linseed oil, & to give it the body of varnish, they mix in thoroughly pulverized yellow amber."
p103r_2,medicine,pl,Place,English,have,have,False,grooms,pro,"The English, who caress their dogs a lot for taking care of their livestock, have grooms for them, who particularly hold this office."
p104r_2,metal process,ms,Measurement,℥,grind,grind,False,massicot,m,"One ℥ of verdet, ii ℥ of coarse salt & a little sublimate, or else grind massicot with linseed oil, and cover the quite clean & polished blade or iron with it, & let dry in the fire or in the sun, and draw on it what you please."
p104r_2,metal process,ms,Measurement,℥,grind,grind,False,massicot,m,"One ℥ of verdet, ii ℥ of coarse salt & a little sublimate, or else grind massicot with linseed oil, and cover the quite clean & polished blade or iron with it, & let dry in the fire or in the sun, and draw on it what you please."
p105r_4,,pa,Plant,Almond trees,lose,lose,False,their sap,,"Almond trees, which by their nature are drier, lose their sap earlier, therefore those who want to graft onto them mericotons, apricots & grafts of trees with pitted fruit, which are the best there, they are grafted in the month of January."
p105v_3,animal husbandry,al,Animal,nightingale,maintain,maintains,False,a territory,,"The nightingale, as long as it sings, maintains a territory for itself alone."
p106v_2,casting,m,Material,Plaster,withstand,withstand,False,fire,,Plaster alone does not withstand fire but breaks up into pieces.
p107r_1,casting,m,Material,sand,withstand,withstand,False,the fire,,"There can never be too much feather alum, for this is what gives bond to the sand, and because it does not burn, it makes sand withstand the fire without cracking & bursting."
p107r_1,casting,m,Material,sand,withstand,withstands,False,the fire,,"It is necessary that all sand with which you want to cast well, withstands the fire well, that is to say that it withstands a great firing without getting spoiled."
p107r_1,,m,Material,feather alum,resist,resists,False,the fire,,"It is this, with its small soft & thin filaments, which gives binding to the sand in a much more excellent fashion than cloth shearings in the founder's earth of the founders of great works, because these cloth shearings & cloth waste burn and feather alum resists the fire."
p107r_1,,tl,Tool,mold,retain,retains,False,the color,,"When the mold, having set, retains the color of brick and is reddish, it is firmer."
p107r_1,casting,m,Material,Eau-de-vie,prevent,prevents,False,the sand,m,Eau-de-vie prevents the sand from becoming porous & does not make little holes on the edges of the mold if the thing to mold is well moistened with it.
p107r_1,casting,m,Material,Eau-de-vie,prevent,prevents,False,the sand,m,Eau-de-vie prevents the sand from becoming porous & does not make little holes on the edges of the mold if the thing to mold is well moistened with it.
p107r_1,casting,m,Material,Eau-de-vie,prevent,prevents,False,the sand,m,Eau-de-vie prevents the sand from becoming porous & does not make little holes on the edges of the mold if the thing to mold is well moistened with it.
p108r_2,casting,pro,Profession,those who make pots,make,make,False,pots,tl,"Then, one puts it to cook neatly in a earthen vessel in the fornaise of those who make pots, and one leaves it there until the pots are cooked."
p109r_3,casting;wax process,m,Material,cold water,repel,repel,False,the oil,m,"In order that your mold grips without repelling in any place on a shape or image of wax, you need to anoint it with oil and moisten your sand with lukewarm water, for the cold water would repel the oil more & would not have a good seating on it."
p112r_4,casting,m,Material,eau-de-vie,mix,mix,False,little,,"to cast, make him take through the mouth some good eau-de-vie or else mix a little with the vinegar."
p112v_1,casting,m,Material,wax,touch,touch,False,this wax,m,"But place wax, as much as a grain of millet, between the body & the end of the tail, then with a bit of flattened & hot iron wire, touch this wax & join by lightly pressing."
p113r_1,casting,tl,Tool,bowls of different size which have a lip,have,have,False,a lip,tl,"Therefore, for this effect, take several bowls of different size which have a lip, to cast better."
p113r_1,casting,tl,Tool,mold,have,have,False,the same thickness,,"Also, tip your mold up on the side of the head, which is higher than the body, and thus your mold will have the same thickness, & you will spare sand."
p114r_1,casting,al,Animal,lizard,have,has,False,large jaws,,"However, be more careful when uncovering the throat of the lizard than with the snake, for the lizard has large jaws & large bones that are not malleable and has hollow ears, where, if the wet sand has entered, it is not easy to release."
p115v_1,casting,m,Material,tin,exceed,exceeds,False,the lead,m,"If the plant or flower that you want to cast is delicate & fine, it is necessary that the tin exceeds the lead in the mixture, & on the contrary, if it is thick, it is necessary that the lead exceeds."
p115v_3,casting,tl,Tool,molds,have,have,False,their gate,,"After your molds have their gate, vents & clamps, as is said, make at the end of the forge , or in some clean place, a surrounding of bricks, and fill it with large half-lit charcoals."
p116r_2,casting,m,Material,oil,make,makes,False,no thickness,,"If they do not, fill with wax what does not, and then anoint your images of wax or of lead with olive oil, very thinly & very lightly, such that the oil makes no thickness nor body on the medal."
p116v_2,casting,ms,Measurement,cool until you can hold the tip of your finger in the gate without burning yourself,hold,hold,False,the tip,tl,"For for these, they ought to be red when you cast, but for lead and tin, let it cool until you can hold the tip of your finger in the gate without burning yourself, but you find a lukewarm heat."
p118v_1,casting,tl,Tool,bottle in which one boils tisane,boil,boils,False,tisane,m,"And having prepared it thus, I moistened it with sal ammoniac water, made of sal ammoniac, as much as two walnuts, in a bottle of common water, the same size as a bottle in which one boils tisane, or in a good pot of water, so that you find the water moderately salty."
p118v_1,casting,tl,Tool,frame,take,take,False,the imprint,,"In order that the second frame take the imprint thereupon to denote the place for making the cast, I uncovered the outline of the medal and pounced the whole side with pulverized charcoal, and then filled the male part with sand."
p119v_1,casting,tl,Tool,pestles,make,makes,False,little balls,,"And because it is mixed with earth and filth, one pestles it coarsely & one makes little balls, having for this purpose soaked it in sal ammoniac water of such a composition that you were told above."
p119v_2,casting,m,Material,gold,have,has,False,the thickness,ms,"Next, gild it with fine gold, as uniform as it will be possible for you, three or four or five times, & until your gold has the thickness of a piece of paper or something similar, & all the scales will always show equally."
p120v_6,preserving,tmp,Temporal,"out of season, when winter denies flowers",deny,denies,False,flowers,tmp,"This is a rare secret, & which gives pleasure for adorning tables, rooms & cabinets out of season, when winter denies flowers."
p120v_6,preserving,m,Material,sand,make,makes,False,dust,m,"If the sand makes dust, & clings to the flowers, & is not easily removed with a paintbrush, it is no good."
