div_id,categories,subject_tag,subject_label,subject_term,verb_lemma,verb_form,passive,obj_text,obj_tag,sentence
p121v_1,casting,ms,Measurement,part,reheat,reheated,False,feather alum,m,"You need to arrange your animals as said and compose the same sand out of 4 parts of plaster, of two parts reheated brick, & one part reheated feather alum, and mix it well."
p121v_1,casting,pro,Profession,peasants,eat,eat,False,their soup,ms,"Then, having been prepared thus, and you wishing to mold it, take the three parts of an earthenware bowl, from which the peasants eat their soup, of the aforesaid sand, & add to it pure feather alum, reheated & pulverized in the mortar, as much as you can take with 4 fingers and the thumb, or a small double handful."
p121v_2,casting,pro,Profession,goldsmiths,know,knew,False,the substance,,"If the goldsmiths knew the substance to make silver run in their works, they would buy much of it."
p122v_2,casting,m,Material,Wax,keep,keeps,False,its heat,,"Wax on its own cools too quickly & does not run well everywhere, & tallow keeps its heat well & runs everywhere, but on its own it is not good."
p123r_1,metal process,pro,Profession,Goldsmiths,sell,sell,False,a denier,ms,"Goldsmiths who have knowledge of this substance sell a denier of it for five sous to other goldsmiths, & especially to those who work in plate and large wares, for at the end of their works, they can solder over the first solder by means of this mixture."
p124v_1,painting;metal process,m,Material,Gold,render,renders,False,the enamel,m,"Gold , with its own pale color, renders the enamel a dead color."
p124v_2,casting,m,Material,gold,reach,reaches,False,its perfect heat,,"When gold reaches its perfect heat, it is green like an emerald."
p124v_3,casting,m,Material,metal,run,run,False,roll wax,m,"Because you always have to make the gate by the tail, and because it is so delicate and thin that the metal would run with difficulty, especially when it is curled, roll wax in little threads of this thickness and apply some with the hot iron wire, as is said, one at the end of the tail & the others, that are applied in the same way, from one side of the tail to the other, as you see depicted."
p125v_1,casting,al,Animal,snakes,have,have,False,a double row,,Other snakes have a double row of teeth.
p126v_1,casting,m,Material,vinegar,have,have,False,much more strength,,"However, when the filings are passed through vinegar, & you have made it evaporate & heat up, & it is very red, if you do this again for a second time, the vinegar will have much more strength, & the crocum will only be finer for it, & redder."
p126v_2,casting,m,Material,wood,imbibe,imbibe,False,very hot wax,m,"But if you take your molds from large works & pieces of wood, it will not release well unless you make your wood imbibe very hot wax."
p128r_1,casting,tl,Tool,crucible,give,gives,False,some vapor,,"This makes it so that if the crucible gives off some vapor or sour fumes, it will not impair these two metals."
p128r_1,,m,Material,alloyed silver,produce,produces,False,film,,"All alloyed silver produces film, and all other metal as well."
p129r_1,painting,m,Material,oil,take,takes,False,a long time,tmp,"If you are in a hurry, it would be better to mix your color with a not-too-thick gum because oil takes a long time to dry and runs if it is layered thinly, as the plants require."
p129v_1,preserving;decorative;casting,ms,Measurement,"hot enough, like when one takes out the bread",take,takes,False,the bread,m,"Note that one needs to give them their shape & put them in the sand, as with flowers, & promptly dry them in the oven, which is hot enough, like when one takes out the bread."
p131v_1,casting,sn,Sense Term,"of such a heat that you can handle it without harm, or that you can keep your finger in the gate without burning yourself",keep,keep,False,your finger,bp,"Your mold must not be cold, but of such a heat that you can handle it without harm, or that you can keep your finger in the gate without burning yourself."
p134v_1,metal process;casting,m,Material,borax,weigh,weigh,False,half,ms,"But the borax & saltpeter together must only weigh half of the others, that is to say, as much together as the verdigris."
p135v_1,casting,m,Material,smokes,put,put,False,some more borax,m,"And if the gold smokes & swirls, put some more borax in and blow on top, making sure that, if it is still brittle & not softened enough, it does not cover itself when you blow, as if it had cooled."
p136r_1,casting;metal process,pro,Profession,Goldsmiths,scrape,scrape,False,gold leaf,m,"Goldsmiths scrape gold leaf with the brim of a burin, & then set the enamel down on it."
p136v_1,casting,m,Material,latten from skillets in which one makes the mush for little children,make,makes,False,the mush,m,"The latten from skillets in which one makes the mush for little children, which is soft, is appropriate for the cast."
p136v_1,casting,m,Material,German tokens,contain,contain,False,a lot,,Some say that German tokens contain a lot of calamine.
p136v_1,casting,pro,Profession,Casters,take,take,False,that very yellow latten,m,"Casters do not usually take that very yellow latten, because of the calamine passed through the fire."
p137r_2,casting;metal process,pro,Profession,Founders of large casts for statues,throw,throw,False,much tartar,m,"Founders of large casts for statues throw in much tartar to clean it of its filth & nastiness, & much sal ammoniac to render it thin & neat."
p137v_1,casting,sn,Sense Term,of such heat that you cannot hold your finger there without feeling strong heat,hold,hold,False,your finger,bp,Hot water should be of such heat that you cannot hold your finger there without feeling strong heat.
p137v_1,casting,m,Material,grey earth,dry,dries,False,the mold,tl,"Yet, I have experienced that grey earth dries the mold too soon."
p138v_2,casting,tl,Tool,things that withstand the fire,withstand,withstand,False,the fire,tl,"When goldsmiths have something to solder promptly and do not have leisure to forge it, they melt some gold and then throw it on a cloth or other things that withstand the fire, and they flatten it immediately with a hammer or similar thing."
p139r_1,casting,sn,Sense Term,until you can hold your finger without harm in the hole of the gate,hold,hold,False,your finger,bp,"The mold is made of the aforesaid sand, common to all metals; when it is reheated let it cool until you can hold your finger without harm in the hole of the gate."
p139r_1,casting,ms,Measurement,"Test for this effect with paper. If it turns the paper red, it is enough, it is good to cast, but if it blackens the paper, it is too hot.",turn,turns,False,the paper red,ms,"If it turns the paper red, it is enough, it is good to cast, but if it blackens the paper, it is too hot."
p139r_1,casting,ms,Measurement,"Test for this effect with paper. If it turns the paper red, it is enough, it is good to cast, but if it blackens the paper, it is too hot.",blacken,blackens,False,the paper,m,"If it turns the paper red, it is enough, it is good to cast, but if it blackens the paper, it is too hot."
p139v_1,casting;wax process,m,Material,charcoal,give,gives,False,color,,"The charcoal gives color and body to the wax, which would otherwise be transparent & the features would not be seen as well."
p139v_1,casting;wax process,m,Material,wax,pass,passed,False,its high heat,sn,"And as it will be well incorporated, take heed if your wax has passed its high heat, which you will recognize when it no longer smokes, when it makes large tracts pulling at the edges, & motionless & close one to the other."
p139v_1,casting;wax process,sn,Sense Term,"water so hot, that, at the beginning, you cannot hold your finger in it",hold,hold,False,your finger,bp,"But before you use it, soak it for a good hour in cold water & for at least as long in water so hot, that, at the beginning, you cannot hold your finger in it."
p139v_1,casting;wax process,m,Material,wax,have,has,False,more,,"Cut down the protuberance of the gates, in order that they are smooth & that the wax has more of the silver to run in one go without turning around in the folds of the snake."
p140v_3,casting,sn,Sense Term,I could hold my finger to it without burning myself,hold,hold,False,my finger,bp,I let it cool in such a way that I could hold my finger to it without burning myself.
p141r_1,,al,Animal,crayfish,have,has,False,eggs,,"If your crayfish has eggs, which are delicate and which would be awkward to uncover without breaking, you would do better to make the first cast on the belly & eggs, in order that you only need to uncover the back, which is hard & easy to handle."
p141r_1,,al,Animal,crayfish,have,has,False,no eggs,,"If your crayfish has no eggs, mold the back on top & the belly on the bottom."
p142v_3,casting,m,Material,lean earth of which the founders of artillery & bells make their trusseaulx and molds,make,make,False,their trusseaulx,m,"Take this lean earth of which the founders of artillery & bells make their trusseaulx and molds, which is lean & sandy."
p143r_1,casting,al,Animal,those of the garrigue,have,have,False,crooked ones,,And those of the garrigue have crooked ones.
p143r_2,casting,m,Material,slate,retain,retains,False,its asperity,,"Those who mold crosswise make their sand with crocum & calcined slate, but slate always retains its asperity & becomes porous, because it is fatty."
p144r_1,casting,sn,Sense Term,"so that without burning yourself, you can hold your finger in it without burning yourself",hold,hold,False,your finger,bp,"Temper in hot water, so that without burning yourself, you can hold your finger in it without burning yourself, your sand, a little thick."
p145v_2,,sn,Sense Term,of such heat that you can hold your finger there without harm in the hole,hold,hold,False,your finger,bp,"Cast your tin very red in the mold, of such heat that you can hold your finger there without harm in the hole."
p145v_1,casting,tl,Tool,mold,lean,lean,False,little,,"Make the mold lean a little toward its widest part, and if you find the remains of thick sand, which has not thinned well, cast it rather toward the gate than elsewhere."
p146v_1,casting,al,Animal,Those of the water,have,have,False,ones,,"Those of the water do not have ones as deep as those of the garrigue, which are leaner."
p146v_1,,m,Material,clay,bring,brings,False,the wax,m,"And if the pulled-out clay brings with it the wax that you put there, put back it in the places that cannot release, as is said."
p149v_3,casting,m,Material,tempered sand,change,change,False,their form,,"Because being weak & delicate, the tempered sand, weighing down their tops, would change their form."
p150r_3,casting,m,Material,glowing charcoal,stop,stopping,False,the space,,"And, glowing charcoal stopping up the space between the molds, the heat reverberates from one to the other in such a way that more often you will find your molds burst & cracked on one side more than another."
p150r_3,casting,m,Material,Brick,cool,cools,False,the metal,m,"Brick cools the metal, & if this were not for giving bond, it would not be necessary."
p150r_3,casting,tl,Tool,molds,withstand,withstand,False,several casts,,The reheated molds cannot withstand several casts.
p150v_1,casting,m,Material,wax,have,has,False,such little substance,,"the white wax with which you have composed your black sulfured wax, has such little substance, since being dry and purified, that it leaves nothing inside, and flows very gently."
p150v_1,,al,Animal,turtles,have,have,False,as much work,,"The turtles which are not molded hollow do not have as much work, for they are molded in two pieces, to repair them with small chisels, small cutting-punches, small gouges & small serrated chisels."
p152v_1,casting,m,Material,tin,cast,cast,False,thick retracts,,"If there is also too much tin in a moderately thick thing, it does not come out well, because tin cast thick retracts & becomes porous."
p152v_1,casting,tl,Tool,files,place,place,False,your work,,"If, therefore, some flaw should happen, take a leather cushionet full of fine sand, & having placed it on the bequet of the goldsmith's table, where one files, place your work on it & secure it with a rope which passes under your foot."
p154r_3,metal process,pro,Profession,goldsmiths who work large wares,forge,forged,False,their platters,,"When goldsmiths who work large wares have forged their platters, it very often happens with their sheddings that it bursts & cracks for being too soured."
p154r_3,metal process,pro,Profession,goldsmiths who work large wares,work,work,False,large wares,pro,"When goldsmiths who work large wares have forged their platters, it very often happens with their sheddings that it bursts & cracks for being too soured."
p154v_3,casting,m,Material,Silver,need,needs,False,a longish gate,,Silver needs a longish gate.
p154v_3,casting,m,Material,Silver,tolerate,tolerates,False,the water,m,"Silver, when soldering, tolerates the water one throws on it."
p155r_1,casting,pa,Plant,rose,have,has,False,great volume,,"I would be of the opinion to mold the rose on its own with a little of its stem close to its bud, & then to join it to a longer one of tinned latten, because the rose in full bloom has great volume & weight."
p157v_2,casting,pro,Profession,curriers,do,do,False,that,,"They are skinned & filled with cotton cloth. & even better, one needs to dress them in the fashion that curriers do, in order that they do not lose a feather, weight."
p158r_1,casting,m,Material,☿,clean,cleans,False,the ash,m,"The ☿ cleans the ash well, especially flat things where there are not delicate lineaments which could be broken by its weight."
p158v_1,painting,m,Material,verdigris,have,has,False,depth,,"For green, the verdigris has depth & is too dark."
p159v_4,casting,pl,Place,Germans,make,make,False,statues,,"Germans make statues for their fountains with it, which are not spoiled, especially once varnished, but it hardens in water."
p162r_1,La boutique,pro,Profession,small peddlers,lie,lay,False,open small wares,,"As small peddlers lay open small wares in order to buy richer ones & to profit more and more, so I, from a desire to learn, am exposing what little is in my workshop to receive, through a common commerce of letters, much rarer secrets from my benevolent readers."
p163r_1,household and daily life;tool,m,Material,amber,overtake,overtakes,False,the principal scent,sn,"They readily put half of amber & half of musk & very little civet, because amber always overtakes the principal scent of musk."
p163r_1,household and daily life;tool,m,Material,ben oil,put,put,False,your ambergris,m,"And having put in a small silver bowl a spoonful of flower oil, or lacking that, ben oil, that is to say, a silver spoon that one uses at the table, put in your ambergris & place all on a low fire, and it will melt quickly if your amber is good, & it will remain there without lumps."
p163v_2,metal process,m,Material,Urine,give,gives,False,much tincture,,"Urine gives much tincture, and eau-de-vie also."
p163v_2,metal process,m,Material,Urine,give,gives,False,-,m,"Urine gives much tincture, and eau-de-vie also."
p163v_2,metal process,m,Material,Urine,give,gives,False,vie,m,"Urine gives much tincture, and eau-de-vie also."
p164v_1,casting,tl,Tool,earthen slab,arrange,arrange,False,your animal,,"When the earth from which you make the earthen slab to arrange your animal is too soft, the points that you put in it come out easily & come undone when you cast in the sand, & thus the mold spoils and the shape comes undone."
p165r_4,casting,m,Material,Good plaster,keep,keeps,False,a long time,tmp,Good plaster keeps a long time in molds.
p165v_1,casting,tl,Tool,sponge,purge,purge,False,their mouth,,"of vinegar & urine, & with a sponge purge their mouth, eyes, and the head of the slaver which comes out, for the sand would never set well there and would become lumpy."
p166r_1,La boutique,al,Animal,hen,search,searches,False,the garbage,,"As the hen carefully searches the garbage thrown out of a house for a crumb or a grain that she divides among her chicks, thus one distributes to orphans that which has been sought among the arts considered vile & abject."
p166r_1,La boutique,env,Environment,workshop,represent,represents,False,all things,,"Tablet of Cebes, idle, but the workshop represents all things active."
p166r_1,La boutique,pn,Personal Name,Aulus Gellius,make,made,False,a collection,,"Aulus Gellius, Valerius Maximus only made a collection from various authors who had already written."
p166r_1,La boutique,pn,Personal Name,Livy,make,made,False,his xxiii book,,Livy made his xxiii book from the 2nd or 3rd of Polybius.
p166r_1,La boutique,pro,Profession,weaver,make,made,False,a cloth,,"Will one not say the weaver has made a cloth or precious stuff, even though he did not dye & twist , wind & prepare the bobbins and balls of thread?"
p166r_1,La boutique,pro,Profession,mason,make,made,False,a house,env,"Will one say the mason has not made a house, but only piled up ready-made stones?"
p166r_1,La boutique,pn,Personal Name,St. Athanasius,make,makes,False,mention,,"To the Greek examples, there can be added a psalm of David of which St. Athanasius makes mention in Sinopsi."
p167r_1,arms and armor,tl,Tool,peg,attach,attach,False,the petard,wp,"And for those that have a pierced breech, one must have a good gimlet to first make the hole in order that the peg, which is made with a gimlet-like point, may attach the petard faster & without noise."
p167r_1,arms and armor,tl,Tool,Iron fork made in the form of pincers of the height of a man,place,place,False,the mortar,,"E. Iron fork made in the form of pincers of the height of a man, to quickly place the mortar without a peg."
p169r_1,lists,pa,Plant,mosses,apply,applied,False,Molding,,Very hard wax Molding a ring and that which is engraved Molding pieces of carcanets Things that are not released Fountains Grottos Diverse mosses applied Molding in three frames Softening iron to engrave it
